"text","likeCount","reply"
"我20岁那年谈了个男友，也是异地网恋，但万幸，不涉及诈骗，每次约会基本也是aa，不过他条件很差，早年爹死娘疯家徒四壁，自己高中没毕业就出来上班了，我也不知道我看上他哪了，可能觉得他比较吃苦，比同龄人成熟，但相处久了就发现这种人内心阴暗，社交圈子极窄，说话真假难辨，从未带我见过他的亲戚朋友，从他口中就两个朋友，也是社会底层，带我去过他农村老家，随手一指说是他家老宅，也不开门让我进去看看，就说什么也没有，逛了一圈出来和我保持距离，说不想被亲戚看见，反正我是没有一丁点机会从其他人口中了解他，但我当时似乎杯圣母附体了，也没有去计较，直到每几个月开口跟我借钱，我开始不爽，你一个上班的找我一个上学的借，而且还是因为身无分文吃不上饭，我就问他工资去哪了，他就说用完了，头两次我看他可怜没饭吃就借了，事后他也还了，最后一次我非常生气，我觉得这种男人太恶心，他为什么总想到我，我不借还威胁我，让我留着钱买棺材，呵呵，后来僵持了一周我怕他自杀或者做出什么报复社会的事我还是借了，他吃饱肚子态度立刻大转弯，其实和他根本没有未来他也不想结婚，但就像老梁说的沉没成本，我也不知道为什么要耗着，反正也怪自己傻吧，后来父母强势介入分的很干脆，十几年过去了，我现在家庭幸福，他依旧是孑然一身无房无车，他自己选择自暴自弃是他自己的事，和我不再有关",2,FALSE
"周瑜打黄盖",0,FALSE
"对，国外性伴侣关系更受欢迎",0,TRUE
"沉默成本论经济可以，论感情未必 比如老梁自己吧，赌咒发誓不移民不定居国外，可是你若是投胎投错了咋办，战乱饥荒匪盗四起你咋办。别总是劝别人理性，谁都是感性的，包括用冰冷理性温暖社会的老梁。 危邦不入，乱邦不居才是正理。 萨达姆、卡扎菲就是希望所有的国民都眷恋乡土，被思想钢印了“狐死首丘、落叶归根”什么的 希特勒上台，集中营都建起来了，还写信给美国的爱因斯坦回国做贡献 而人间理性梁老师呢，笃信“儿不嫌母丑、狗不厌家贫”，无怨无悔的钉死在神州赤土",0,FALSE
"我自己小的时候也有过很一样的时候，也曾经为了满足女朋友的各种各样的愿望。在高中交的第一个女朋友就是我最记忆犹新的一个，明目张胆的跟我要情人节礼物。我的家在北方，情人节的时候也是最冷的一段时间，她想要的礼物就是一件纯白色的耐克的羽绒服，当时是2003年。这一件差不多1500块的羽绒服用了我整整一个月的生活费和所有的压岁钱。当我把礼物送给了她，我们过了一个和谐的情人节之后，我发现我并没有多么的开心。而且越来越觉得这样的男女关系好像不是我想要的，我开始质疑我究竟是为了什么一个劲儿的消耗自己来满足她的愿望！？一件1500块的名牌羽绒服（耐克阿迪在当时对于我来说就是名牌了），100块的零食，200块的晚餐，300块的酒店，一共2100块左右的花销，作用在自己身上的也就只有那么几个小时。换句话说，当时在北方的洗浴中心里找个大活也不过300块一次，2100多够我一个礼拜每天换一个人来侍寝了，，，哈哈哈。 当时真的就觉得越来越舒服。后来又一次这个女孩跟我借我父亲的相机说好朋友几个出去春游要用，我就借给她了，后来怎么的也不提归还的事。记得当时还是个非常贵的富士相机，虽然我太懂。但是我知道的是我帮你向别人借来的东西你要归还。就很严肃的跟她说要把相机还给我的事，还被嘲笑说小气，，，虽然很不爽但还是说，“对，我就是这么小气，但是我父亲的东西你要归还！你还给我东西以后我绝对不再打扰你。”之后就是最后一次见面，她还好意思穿我送给她的羽绒服，没好气的把东西还给了我，并且说“你这人小气，抠门没有爷们儿样，真后悔怎么找了你这么个男的。”好在东西没坏，可是崭新的相机机身上多了好几道划痕。我当时也真的是好脾气，心想着“好男不跟女斗”，但是嘴上也不想服输就回怼道“我是没有钱，那我也不能为了面子就去勉强自己做能力之外的事。你倒是有骨气，还真他妈好意思穿我送你的衣服来跟我见面，有本事你把这衣服也还了呀！？（当时零下20多度）想吃想穿就自己去赚去，靠男人养着没什么值得骄傲的，又当又立。你都没有技女靠自己身体来赚钱值得人尊敬。”说完我就转身离开了，打了出租车去了网吧。我到现在都记得当时在车上那个开心劲儿，后来在网吧玩的那叫一个爽。 这次通过胖猫的这个事儿，我也又会想起了那次事情，只觉得类似的事情经常发生无论角色是否对调，都感觉又可笑，又可悲，在一个圈圈里跳不出来的那种无助，旁边人看着却又无能为力的复杂心情充满着内心。哎，，，本应该是情感上的伴侣，却不知不觉中做的都是对方父母应该做的事。社会如此发展真的是不太好。",31,FALSE
"情商高！",0,FALSE
"早20年看见老梁这番话就好了。",2,FALSE
"惊心动魄。有一句说的好，就是当我们除了这个人本身，无法接触他周遭的任何人的时候，我们就成了瞎子聋子，无法从任何侧面去了解他的为人。因此，被介绍给对方的社交圈子不应该只是一种仪式感，那太流于表面了，它更是一种认可，和希望别人都能像他一样喜欢你，同时也是一个契机，让我们能更全面地了解他、不至于被堵塞了言路、永远只从一个视角看他",2,TRUE
"我也是",0,TRUE
"有人在找安全感",0,TRUE
"对，老梁也是阅历丰富的过来人，谁不经历都不会懂",0,TRUE
"老梁几乎是和王局同时更新了说胖猫的视频",0,FALSE
"有水平的一段话，很难在网上看到如此精彩的总结",0,TRUE
"不同意老梁最后的观点，让自己更优秀，回头一看当初仰慕的人是个p啊！",1,FALSE
"老梁这句话说的有些道理，但是你不能生搬硬套，这是在特定场景中才适用的，不是任何情况下都适用，比如，某个人脾气特别暴躁，谈恋爱的过程中总是因为一丁点小事儿就发火，谈了多少个对象都因为受不了他的暴脾气分手了，那么你说说这件事究竟是非得找个能接受暴脾气的好呢？还是稍微收敛一下，顾及一下别人的感受才叫好呢？ 性格脾气虽然很难改，但也不是绝对的，明知道自己有重大缺陷，还硬要不改，还非得找个能接受这种缺陷的，那不是脑子有病吗？",10,TRUE
"“这一幕打动了全国无数男屌丝脆弱的心理”",6,FALSE
"他也只是个孩子，才21，还分不清是非，不要这样说他",5,TRUE
"想多了",0,TRUE
"基本赞同，唯有一点，胖猫问题确实关乎中国男女相处的普遍问题，中式畸形婚恋观里把对男性的经济索取当作理所当然，是导致出现这种很极端的典型案例的原因之一。",0,FALSE
"胖猫事件是为了冲淡梅州高速塌方48人死亡冲上热搜。",0,FALSE
"老梁说得太对了！早出这样的节目就好了，",0,FALSE
"还有强迫性重复，就是受原生家庭影响，大概率会找到和父母一样的人，企图改变他们，来证明自己是有用的，可是真的有用，他们也不会变成那样的人",0,TRUE
"還是老梁講話實在",0,FALSE
"杀了它在死不好吗？",1,FALSE
"His destiny. , he is too much attached to the girl and give the girl opportunity to do anything to him!",0,FALSE
"我是真的没看到剪辑痕迹啊，一镜到底这个表达力太强了",28,FALSE
"老梁回国啦",0,FALSE
"老梁是人間清醒",0,FALSE
"说的很中肯，非常好",0,FALSE
"不明白他临死前把所有的钱都给这个女的打过去。而不是给家人？",0,FALSE
"-r6y你是不是蠢啊，不努力改变自己和不努力有直接关系吗？我已经努力工作10小时，我不再改变自己工作12小时，表明我不努力吗？",1,TRUE
"，遇到不同的人，不同的场合表现得不一样并不能说明改变了自己，依然还是你自己。就像找工作面试你再怎么表现，演戏，面试结束该怎么样还是怎么样",0,TRUE
"真是掏心窝子的真诚话！谢谢老梁",0,FALSE
"老粱我太他爹地喜欢你啦",1,FALSE
"对对对",0,FALSE
"听了你这么说，感觉我媳妇当初就是拿我当备胎",0,FALSE
"老梁引用沉没成本这个概念十分贴切，补充一个微观经济学的基本原理：在决策的时候不应考虑沉没成本，沉没了就是沉没了，没了，不考虑了",0,FALSE
"是的，年幼，且每天只活在网络世界，价值观极易被牵着鼻子走病态扭曲。不是他的错，百分之九十是这个时代这个社会和家庭的错。",0,TRUE
"在反复多次经历了老梁说的四种情况之后，我决定赚钱自己花，对自己好，现在别提有多潇洒了，根本花不完",8,FALSE
"梁先生真是我们的良师益友",0,FALSE
"，不是孩子了。 要是搁过去，孩子都生好几个了。现代，在任何国家，21岁都已成年。 21岁这么年轻，死了确实可惜，但是要说他是孩子，那他不是。",0,TRUE
"改变又不是单单靠卖死力气。比如你这个逮谁咬谁的性格不考虑改变一下吗？",0,TRUE
"喜欢老梁讲的东西，希望老梁多出视频",0,FALSE
"老梁讲的实在是太好了！",0,FALSE
"到位",0,FALSE
"这不是什么性别对立，也不是感情问题，这就是诈骗。",0,FALSE
"梁老师，这个热度好像是为了掩盖道路损害死伤了52人的事情",1,FALSE
"说得好 今天我就跟我相亲对象说真话 退一步海阔天空",0,FALSE
"你说的有道理。但是毕竟他出自一个破碎的原生家庭，不懂爱不会爱几乎是必然",3,TRUE
"网上婚骗多了！ 我认识最少三个人都被婚骗骗了好多钱。就是杀猪盘！",0,FALSE
"21岁'啥事不懂？",0,TRUE
"酒越喝越厚，钱越耍越薄",0,FALSE
"I had to look up what PUA was.",0,FALSE
"猴子献宝 这个比喻太贴切了",0,FALSE
"感情的事只有男女雙方自個衡量付出多點或少點 我們第三方都是站著說話不腰疼 肥貓小兄弟自願決定做過的事 人即逝矣請尊重貓寶寶 哪個處男沒被渣過才成熟呢！",0,FALSE
"老梁这期说得真好，这就像去下馆子一样，饭菜难吃，换一家就完了，难道还要硬逼自己吃完，或者怪自己的口味吗？我们都要对自己好一点儿。",0,FALSE
"老梁从美国回来了啊。",0,FALSE
"主要是没放进去 放进去后就会好很多",0,FALSE
"要给年轻人上上课",0,FALSE
"老梁了解的还是少了，谭竹本身是同性恋，与胖猫“谈恋爱”期间还和其他“老板”以老公相称，在KTV还担任过“妈咪”",0,FALSE
"这期老梁是情感博主",0,FALSE
"受教了，原本总是跟儿子说，你要找到心仪的对象你自己首先要变优秀，以后不说了，一切随缘",1,FALSE
"老梁讲这方面内容比王局讲的好",0,FALSE
"操我在哭什麼",0,FALSE
"通透个毛线，关键点一个都不敢说，",1,TRUE
"猴子献宝",0,FALSE
"梁老师说的好呀",0,FALSE
"看到爛電影還不走，那就是浪費時間，不走的應該是還期待後續會好看了呢！坐錯公車，立刻下車，因為沒有期待了啊！ 所以前面的看電影，和後面的坐公車，沒有可比性。",0,FALSE
"第五条：张口就要钱！",0,FALSE
"谈论胖猫而避免谈论广东高速坍塌？",0,FALSE
"老梁老了 用80/90年代的爱情来理解现代。我遇到过好几个女生，面都没见过，就给我发奢侈品链接。满街捞女已经是普遍现象了",4,FALSE
"归根结底是一个极端简单的人碰到一个骗子，这个女的和街上卖假保健品的给老头老太太的人没有什么区别，只是用话语糊弄人，就是骗。",0,FALSE
"2003年我大三，那时候的女朋友也算是看重形式主义吧，这个节要这样，那个节要那样的。倒是没有跟我说要买这买那的，但是跟我说“某某老板和朋友要来这个城市玩，让我找几个女孩去伴游，还给钱”。我只能说哭笑不得吧，当导游赚钱没啥的吧，伴游应该也没啥的，但是这个性质应该是不一样啊。大四的时候我去另一个城市实习，火车俩小时，经常周五下班跑回学校，周一凌晨再回去上班。电话里也经常吵架，无意中也发现了几次她对我说谎，后来一次吵架，我提出分手，她不同意，还哭求我妈劝我。但是很多时候我拿定主意的事情，没什么人能改变。 十几年前还联系过一两次，后来听大学同学说看到她在湖边带孩子散步，希望是碰到了合适的人安稳下来了。",0,TRUE
"老梁也上当，还是配合？ 炒作胖猫是为梅大高速事故转移视听，不说梅大高速事故而评论胖猫，就别评论时事了。",2,FALSE
"老梁说的太好了",0,FALSE
"胖猫可没苦苦追求，是那女的主动贴上去叫老公，把胖猫叫迷糊了。",0,FALSE
"认真看完了你在梁老师下的留言，要回想一下你这同学是不是观察你有钱并且容易被控制才决定跟你谈恋爱，你还有什么优势比如成绩帅，多才艺，好说话，家有权势，你回想回想细节，分析起因。他是爱你还是有其他的目的才接近你，你自己对她的第一面印象是什么",0,TRUE
"说的对，这是个恋爱观的问题。不要因为追求别人而改变自己，我就这样，去找一个能接受我这样的人",2,TRUE
"老梁最后给的建议实际上就是大家多谈恋爱，多去经历，自然这种事儿处理起来就好了",0,FALSE
"你这种跟他的事情性质不完全一样，你这个还算是正常恋爱，互相利用吧，她至少是认可你的能力的，钦佩仰慕和尊敬你人本身的。这段感情是不对等的，更像是皮肉交易，我猜你更看重她的人品，所以你长期下去肯定要痛苦的，分手是正确",0,TRUE
"老梁也来吃这波流量了",0,FALSE
"对，所以我回复的是brucelu这哥们，而不是老梁。",0,TRUE
"谢谢梁先生的分享祝您健康快乐",2,FALSE
"还是打游戏打出来",0,TRUE
"分析得很透彻",1,FALSE
"有機會的才叫備胎，但實際上有些人根本只是更低一層的提款機或工具人，從網上得到的資訊看到譚竹就是想讓人帶練才找上胖貓，之後又開始各種理由要求金錢資助才從工具人兼任提款機，但看2人相處狀況女方根本沒當他是備胎，畢竟就算腳踏多條船也是要花時間跟心思去相處周旋，有希望才能讓人安心當備胎，她連見面都懶就能證明不把胖貓當回事。",12,FALSE
"老梁啊，因为现在是个特殊的时期，无法再抛开性别对立谈问题了，现在不是正常时代",1,FALSE
"为爱放手",1,FALSE
"小孩不可能懂",1,FALSE
"老梁真的不是一般的人间清醒",2,FALSE
"说得太好了 跟男女无关",3,FALSE
"实用宝典",0,FALSE
"我一朋友的独子是个富二代，一个人在加拿大留学，也是被个捞女骗光了钱后跳楼自杀了。",4,FALSE
"老梁 很牛",1,FALSE
"不可惜…这个智商…哎",2,FALSE
"哎，这孩子的妈干啥去了？？？从高中到大学，我妈跟我聊了无数别人的恋爱教训",1,FALSE
"老梁先生在性的问题上有个歧视：男女之间的性行为是女方拿出自己去让男方得到便宜。这不公平。就像常常会从中国的母亲口里说出：我十月怀胎辛辛苦苦，为了你家的传宗接代。",1,FALSE
"",1,FALSE
"世上有覆水难收的沉没成本，也有回心转意的投资回报。哈哈哈，感情这种事只要有转钱的戏码，那就一定是嫖与被嫖的一单生意。一个想沽起来卖个好价，一个是惦记着白嫖。都可以理解。",3,FALSE
"相亲都是起初没感觉然后慢慢处处 当然也像您说的都相完蛋了",1,FALSE
"梁老师句句肺腑，这期内容功德无量！",1,FALSE
"不是梁先生第一次提沉默成本了，即使不碰股市也要早學不接盤不抄底不追漲少投機，該割肉割肉，生於韭菜地處處是市場，別拿自己不當韭菜，生死內外無大事但活得長能看到王八羔也倒霉。",0,FALSE
"好像《从你的全世界路过》岳云鹏和柳岩那场戏的大桥就是胖猫跳的那座桥",1,FALSE
"合适1.25x播放",0,FALSE
"",0,FALSE
"老房子着火更难救",1,FALSE
"换个名字，小梁，老崔。没任何贬义意思。二位都是我所尊重的长辈。",0,FALSE
"知非即舍",0,FALSE
"分析的真好",0,FALSE
"没有爱情就不要付出，我觉得吧，胖猫的感情应该不是爱情，应该有人给他把这个事儿说明白 当然，渣女确实可恨，也不知道有没有人去砸她家玻璃",1,FALSE
"赞赞赞",0,FALSE
"游戏害死人。",0,FALSE
"缺爱。",1,FALSE
"找对象的底线应该是至少对方是个善良的人吧？任何一个善良的人无论如何也不忍心致对方于死地吧？",0,FALSE
"希望你赶紧活出自我，为自己而活就行",5,TRUE
"并不想性别大战，但是有包丽案在前，如果性别互换，现在男的应该已经被刑拘了",1,FALSE
"缺爱缺教育。但是毕竟可怜",1,TRUE
"-so9lw他说的是真的。就是为了遮盖",3,TRUE
"1暧昧不确定。爱情是一把火，说是要再等等，拖拖拉拉。不见朋友父母。 2说话不算数，经常爽约的。 3有事才找你。你找他他没空。 4屏蔽朋友圈，不够坦诚，遮遮掩掩。 5单方面付出。男女可以不AA制，但是，女方必须有一个差不多的对等付出。",1,FALSE
"不过还是捞女更多",0,FALSE
"其实这里的沉没成本并不是钱啊，时间啊，老梁能说会道体有一点您肯定体会不到，因为我年轻时候也是这种类型的人，最大的沉没成本其实是机会成本。因为这种性格在恋爱市场不招人待见，正常有点姿色的女孩搞暧昧都会嫌恶心，一听说你看上她了都处处躲着你，好不容易有个谭竹这样还愿意搞暧昧的可得抓住机会了。所以碰到了基本是无解的，除非有另外一个漂亮女孩愿意献身才能解套。",8,FALSE
"梁先生就是有水平，有学识啊！听一次，每每有收获！谢谢",1,FALSE
"老梁就是大师，讲话循循善诱。没一句废话，全是干货，学到了，不愧是大家。关键是看您每一个视频都能学到新的东西。梁大师现在出来了，多说啊，我们爱听",0,FALSE
"及时止损",0,TRUE
"我们要学会及时止损",0,FALSE
"我也是，我喜欢了一个女生10多年了，一直没被对方认可，各种付出，现在释然了。",13,TRUE
"梁老师",0,FALSE
"老梁，就是评论界的神，永远崇拜你。",0,FALSE
"感谢老梁的讲说，讲的太好了。",0,FALSE
"清晰透彻",0,FALSE
"老梁说的真对，早晚都会碰到，就看你去不去找。",0,FALSE
"沉默成本的概念差不多赌徒心态，明知自己在不公平的游戏规则里，想要继续才有机会，结果是肯定的。",1,FALSE
"老梁现在做的根本不算是新闻节目，一会聊电影，一会讲历史，能先把新闻事件梳理清楚吗？比以前的老梁观世界差十万八千里",4,TRUE
"老梁现在做的根本不算是新闻节目，一会聊电影，一会讲历史，能先把新闻事件梳理清楚吗？比以前的老梁观世界差十万八千里",0,TRUE
"老梁现在做的根本不算是新闻节目，一会聊电影，一会讲历史，能先把新闻事件梳理清楚吗？比以前的老梁观世界差十万八千里",0,TRUE
"梁老师好",1,FALSE
"主动让你给她消费",16,TRUE
"按老梁的说法，你得是刘德华，女生才能白捡。其实追女生很正常，付出多很正常，问题是时间，如果一两个月还好，如果一年以上就说明女的不爱男的。相处久了，也就发现了。付出生命完全不值得，因为给你生命的不是女朋友",0,FALSE
"也许那位看过那个电影，才想起那座桥。",1,TRUE
"看看",0,FALSE
"老梁又回来了，特别喜欢老梁的时事评论",1,FALSE
"老乡",0,TRUE
"这个是我看了那么多，分析得最到位的",0,FALSE
"-no7dq9hq2x 一切尽在不言中",0,TRUE
"老梁挺懂啊",0,FALSE
"老梁你模仿渣男的语气可以啊",0,FALSE
"成年人不做改变只做筛选，很现实的一句话，但说到心窝子里去了",0,FALSE
"太对了",1,TRUE
"九言劝醒迷途仕,一语惊醒梦中人",0,FALSE
"以前总是叫老梁，今天我尊称您一下“梁老师”，我今年40岁了，从记事以来成长也算比较坎坷，也经过大起大落的人生，身边至亲生离死别也经历了许多，但是今天听到您这席话让我觉得豁然开朗，突然觉得之前的人生经历也不过尔尔。",7,FALSE
"相亲时如果听到“我这人比较慢热”就立马离开",0,FALSE
"说的真好",0,FALSE
"-so9lw脑回路清奇比有些没脑子的人强多了",0,TRUE
"感谢老梁持续关注社会问题！今后多更新！",2,FALSE
"感觉梁知才是精华",0,TRUE
"其实年轻时遇到这种恋爱对象还是好的，还年轻最后自己想通了，破钱学到了经验，而且EQ也同时提高，对将来看人，看事都有帮助。 还好你头脑亲醒看清这个女朋友的人品，她不值得你付出，但该放手就放手才是男人",2,TRUE
"非常喜欢老梁，从小就看",0,FALSE
"还有父母也要多关心孩子的行踪和感情。但凡这个男孩有人关心帮他理智分析，支持他，也不至于走到这一步。21岁真的好可惜。我儿子这个年纪遇到这样的渣女，我肯定不能饶过她",0,FALSE
"还有父母也要多关心孩子的行踪和感情。但凡这个男孩有人关心帮他理智分析，支持他，也不至于走到这一步。21岁真的好可惜。我儿子这个年纪遇到这样的渣女，我肯定不能饶过她",1,FALSE
"男的不可怜，女的不可恶。",0,FALSE
"透彻",0,FALSE
"老梁说得甚是",0,FALSE
"确实没有必要上升到性别对立上，这种类似的杀猪盘模式受害者占绝对多数的是女性。只不过很奇怪的一点应该是，当地警方对此没有任何反应，也没发蓝白通告，是女方有这个力量一手遮天，还是这事情的真实性本身就有诈，很难说",0,FALSE
"这真是命里不受财，来了也白来",0,FALSE
"他不講政治都可以啊 一直都能",0,TRUE
"老梁润物细无声 真美好 胖猫如果见见老梁就好了",0,FALSE
"老梁这期节目解开了我的心结，刚工作时认识他算是正经谈的初恋，也是他追求的我，在一起后出门一分钱不花，都是我买单，成天和我要钱要东西，发展到后面他的亲姐消费他请朋友吃饭也变成我买单，还向他朋友炫耀女朋友给他花钱，我提分手他就哭，哭完接着要东西，感觉每天在一起地狱一般，最终的的导火索是因为我生病，让他来照顾，他嫌远且有朋友约他出去玩，我就彻底要求分手，他立马跑来哭，哭完又让我给他买单。最后彻底分手还要说我嫌他没能力嫌他穷，过去很多年我都难以理解这个人的逻辑，还有他的姐姐竟然会和自己男朋友要钱给弟弟花。总结下来，遇到这类人真的要远离，你的善良会变成对方手里的利刃，刀刀致命。",0,FALSE
"我觉得一个人最重要的是要学会自己爱自己，我曾经还被自己的亲生父母PUA压榨到几乎活不下去。",0,FALSE
"当老梁说到“你都坐错车了，本来要去上海的，结果坐车去乌鲁木齐了时”不厚道的笑了 我们东北人的幽默感自然涌出",0,FALSE
"很怀念老梁在内网做意见领袖时的日子，那时候像老梁这样的人还有很多，空闲时间看看老梁他们的视频，听听他们的想法，觉得生活虽然辛苦，但还是充满希望，值得奋斗的。现在内网像老梁这样的人几乎没有了，性别的战火也越烧越旺，我也加入了反女权阵营。我也认同老梁的说法，但如今性别大战不打不行啊，没几个人为男性发声，不能把舆论场让给女权任她们拉屎拉尿吧",0,FALSE
"老梁肯定是个情圣",0,FALSE
"大学哪怕上一次这种课，不至于现在这个世道",0,FALSE
"其实很简单男女关系你就不能被人算到你的规律，就比如过节发红包，有的妹子就群发红包因为他知道男的肯定比她回的多，你就需要一两次不发或者比她少扰乱她的逾期，如果她还理你就是真的。然后如果妹子连你盆友圈都不看不评论不点赞就不用处了压根不关注你。还有就是吃饭的时候如果都微信叫男盆友老公了，乘机抓一下手看看人家缩不缩，第一反应是最真实的。",0,FALSE
"问题不在宅不宅，而是老实人遇到一个三观不正的对方。 贪婪的心吊着对方。",0,FALSE
"說的很對，有點類似凡高割自己耳朵一樣",0,FALSE
"实际上是诈骗案，",0,FALSE
"-u7t 我建议情商课所有刚入社会的必看",0,TRUE
"我现女友吧，是我大学时的对象，都离了，但现在发现，我和她的三观太不合了，但是她现在吧，也不容易，又狠不下心不理她。",0,FALSE
"老梁一针见血…",0,FALSE
"上晓治国理政，下治不孕不育",0,FALSE
