"text","likeCount","reply"
"先来占个座儿，就喜欢老梁节目",8,FALSE
"来了",1,FALSE
"老梁又能评论时事了？",4,FALSE
"来啦",0,FALSE
"来了",0,FALSE
"猴子献宝",3,FALSE
"四条都出现，不过我没把她当朋友",1,FALSE
"更多的体会是觉得这个男的傻。",1,FALSE
"一直都能",0,TRUE
"梁老师一来一回真快",17,FALSE
"讲得真好",4,FALSE
"",0,FALSE
"这不是90年代",0,FALSE
"渣女渣男 到處都有天黑路滑 社会复杂",0,FALSE
"新闻评论家梁老师",5,FALSE
"国外也有玩的好的",1,FALSE
"直白讲还是太年轻，稚嫩，但凡经历过太多，就不会为渣女付出太多",50,FALSE
"重庆女，真太狠了",0,FALSE
"老梁老梁，精靈古怪，琴棋書法，奇門遁甲，上知天文，下知地理，無所不用其極。",34,FALSE
"我真的很像胖猫",0,FALSE
"现在我国的女性.已经被宠坏..张口伸手就敢像男的要钱..",0,FALSE
"沉没成本指的是不舍得及时抽身仍抱有回本的侥幸心理，而胖猫最后已决定时还把剩余的钱转给对方，明显不想回本了，这又如何理解",1,FALSE
"谢谢老梁，我下定决心了，再做最后一次努力，还是没结果的话，也算是对得起自己这十多年的喜欢了",10,FALSE
"让子弹飞一会儿",0,FALSE
"他是日久生情，是真有感情了，所以才是分手才跳，霍欣欣那个才是沉没成本，没钱了才跳",0,TRUE
"要懂得及时止损",7,FALSE
"我们不做改变，只做筛选",5,FALSE
"梁老师多出点新社评呀，不够看啦",1,FALSE
"胖猫就是太天真，为了一个不爱自己的女人自杀，不值得",1,FALSE
"孩子从小在家里确实是缺爱的！而且接触异性的机会太少了。。。",5,FALSE
"梁老师，您在美国的演讲啥时候能传上来，想一饱耳福",4,FALSE
"十多年？？人间啥事能值得呢，只有那个也稀罕你的值得啊",4,TRUE
"牛逼 你早就该放弃了",1,TRUE
"老梁从美国回到家了",0,FALSE
"最后是认清现实的绝望行为？觉得开初期到中期有沉没成本的心态，到末期就完全抛弃理智，纯粹是被感情左右了，这种情况特别容易自杀唉",1,TRUE
"梁老师国内在哪个平台更新呀",0,FALSE
"OMG，大侠快放弃，真是不值得。",2,TRUE
"老梁你这期后面说的就不对了，你说沉没成本但这俩人情况都不是这个情况 程序员是本身资产够硬，不在乎那些钱，后来知道实情了也准备离婚，只是他黑资料被女的搞到了，女的威胁让他破产坐牢，他是被吓到跳楼的 胖猫的话，那就纯粹是因为感情，不然也不会特地跳河前还转个六万六",2,FALSE
"梁老师太厉害了 信手拈来 都不用稿子的",0,FALSE
"这个时间点，是为了遮挡梅州高速那个事情",17,FALSE
"我倒是覺得可能是因為完全絕望，最後陷入攬炒心態擺爛了",1,TRUE
"",0,FALSE
"",1,FALSE
"爱情是突然来的，学到了。想想确实是这么回事",12,FALSE
"及时止损为了一个女人不值得！",0,FALSE
"梁老师",0,FALSE
"还是梁师傅解说透测",2,FALSE
"就佩服你们这些人…脑回路清奇",0,TRUE
"你能说出这种话，证明你还有所留恋，想要自己止损，立即赶紧撤出，远离那个伤害自己的人……其实要想在失恋中不痛苦，就一招好使，换个人谈恋爱就行。换一个新的环境和新的对象，能让人迅速从悲伤、痛苦中解脱出来。",4,TRUE
"千里沉江底蓝桥事难成",1,FALSE
"谢谢老梁",2,FALSE
"好家伙",0,TRUE
"梁局拍案",0,FALSE
"专业性和趣味性兼顾，新闻评论家梁老师",23,FALSE
"梁老师是新闻界-皇冠上-璀璨的明珠。",32,FALSE
"沉没成本，你总想梭哈一把",1,TRUE
"大概率是假瓜",0,FALSE
"提取精华1、暧昧不确定2、说话不算数3、有事才找你4、屏蔽朋友圈",232,FALSE
"高速的那个事就这么过去了！",0,FALSE
"及时止损 永离股市",0,FALSE
"说得真好",2,FALSE
"还有最近的吾妻之死，妻子被丈夫榨死，也非常令人震撼，也希望梁老师能说一说",4,FALSE
"就爱听老梁唠嗑",20,FALSE
"老梁太懂了哈哈",4,FALSE
"老梁这期说得太好，回答了我多年来的困惑。成年人不应该尝试去改变自己，而应该去尝试不同的选择",192,FALSE
"这么会讲话的人真的不多啊！",24,FALSE
"燕子，燕子，没有你我可怎么活啊",1,FALSE
"情感大师老梁",1,FALSE
"你猜为啥4月11日跳江的，却51期间火爆全网",6,FALSE
"或許是人生必經路程之一吧。有時候明明周遭人都拼命阻擋拼命勸阻，情執當下的人往往還是會抱有一口氣想要證明或是以為會有修成正果的一天....",2,FALSE
"前女友四條占了三條，哈哈",0,FALSE
"老梁，加拿大欢迎您。非常敬佩您。",10,FALSE
"关键乘车员吊着你，跟你说：“别下车啊，能到上海”，你还会下车吗？",0,FALSE
"我也遇到过捞女，唉，爱情就是一场病",2,FALSE
"真爱追不来",1,FALSE
"老梁说的很有道理……亲身经历",1,FALSE
"我对一个女人好的时候那是真好，让她吃好穿好用好，会照顾的无微不至，但是一旦我心里不喜欢了或者她说一句不想谈了不论我投入多少我从来不会考虑什么沉没成本扭头就走然后换下一个",1,FALSE
"空调界的是董明珠？",5,TRUE
"我知道背景是个图片",0,FALSE
"回国了？",0,FALSE
"我考，干游戏代练两年就能赚51万",0,FALSE
"你是男的女的？你喜欢的是自己的爱情梦而已，恰好套在了这个人身上而已。",4,TRUE
"你还是没听进去",0,TRUE
"以夷制夷, 以鮑制鮑. 自古以來, 香蕉要對抗鮑魚, 只有這一個方法.",0,FALSE
"就像在投资学里的“及时止损”是一样的",0,FALSE
"我不完全赞同老梁说的，年轻人应该既要想办法努力提升自己，也要筛选合适自己的人。 人如果下定决心改变自己，短时间也许看不到成效，但是时间长了是可能会有翻天覆地的变化的。 比如是提高自己的学历，找到更好的工作，健身改变自己的形象，社交让自己更多朋友，提升自己的礼仪素质和沟通能力还有情商，这些都是要后天学习和锻炼出来的。这些东西也都会帮你在情场上加分，让你心仪的人也看得上你",3,FALSE
"听完老梁再去听王局，看看两大高手的观点",0,FALSE
"不谈恋爱，屁事没有",0,FALSE
"那就别去爱这种人作贱自己 爱是双向奔赴",1,TRUE
"老梁说的太好了，我学废了",2,FALSE
"情海明燈，人生導師",13,FALSE
"-h3li05 难道是游戏左右了心智？",0,TRUE
"还有把你当 ATM提款机的",0,FALSE
"老梁说的太对了",2,FALSE
"[ 肥猫事件] 不是严重夸大就是完全虚构，21岁的代玩2年赚50几万？你算算这费用和时间，对得上吗？",1,FALSE
"视频最后的内容观点太棒了 甚至有理",1,FALSE
"这件破事还值得一提吗？根本是自导自演的剧本啊，所谓的亲属不过是如同胡鑫宇事件里的牛鬼蛇神罢了。",0,FALSE
"老梁就是老梁，没一句废话，全是干货，学到了，不愧是大家，比王菊厉害多了。沉没成本 备胎四标准 只作筛选不做改变，简直就是名言，我都记到小本本上了，将来给孩子教育都有用",36,FALSE
"人家没偷没抢，愿赌服输",1,FALSE
"踩一捧一要脸不",16,TRUE
"老梁真实接地气，修电脑都知道",0,FALSE
"谢谢你",0,FALSE
"老梁的节目，百分之90是观点和旁征博引，只有百分之十是事件的梳理，如果不是详细了解过新闻本身，听老梁讲会云里雾里甚至跑偏。",0,FALSE
"多吃两次亏就醒悟了，我就有过曾经经历！",1,FALSE
"筛选要有本钱，穷男和丑女基本没得选。",0,TRUE
"暧昧不明确。 说话不算数。 有事才找你。 屏蔽朋友圈。",0,FALSE
"孩子都生了 还有机会吗",0,FALSE
"还不完全是沉没成本，梁老师对 红丸， 进化心理学 可能不是很精通。这里面涉及到 回避型人格，移情，母亲的投射，真命天女症。",1,FALSE
"“改变自己比改变别人更困难，改变自己是一辈子的事情。不然全世界都是霸道总裁。”真是“听君一席话，胜读十年书”。每个人资质和才能以及出身已经限制了自己的一辈子的发展方向，逆天改命哪有那么简单。",106,FALSE
"那日久生情呢",0,TRUE
"佩服口才，我估计要是老梁乐意，可以滔滔不绝讲到摄像机没电。",0,FALSE
"分析得太到位了",0,FALSE
"去一次夜場就知道自己付出的錢可以換來什麼服務，這樣就不容易被騙錢了",3,FALSE
"胖猫有姐姐和妹妹，怎么可能缺爱？",2,TRUE
"老梁这演播室背景是AI生成的嘛？还是已经回到国内了。",0,FALSE
"梁老师说的四条里第四条最关键，第四条满足前三条不用看基本恋爱关系成立，第四条不满足前三条满足恋爱关系成立一多半，第一条不满足基本恋爱关系大概率不成立",1,FALSE
"抖音上胖猫的妹妹发了纪念胖猫的视频，里面有胖猫跟妹妹聊天的截图。胖猫曾经教唆妹妹在直播间勾引老男人给她打赏。胖猫宁可把钱给女友也不给自己妹妹，然后让妹妹再去找男的养她，他们那个圈子的价值观就那样，不知道哪里可怜了。",25,FALSE
"什么沉没成本，老梁，你太扯，他跳江前又给了6万多，他最后都啥都不要了，还给那女的钱，这是沉没成本？这是不甘心给了那么多？！！",1,FALSE
"改变自己和改变别人一样难，说的真好",66,FALSE
"成长是不断发现自己曾经是sb的过程，年轻最大的缺陷就是脑子简单",0,FALSE
"老梁這說的可真是精準到位 就知道要提鍾無艷了 早一天認識老梁，這輩子少花很多冤妄錢",0,FALSE
"这个女的用胖猫的手机给自己转了六万六然后说自愿赠予，然后胖猫才发现这个女人的心思想不开才自杀的",0,FALSE
"那男的是性格原生家庭有问题，但是这个事件主要问题应该是女的诈骗问题啊，老梁，你这说的………",0,FALSE
"梁老师",0,FALSE
"同缺爱家庭长大同沉迷游戏的路过 然而看到父母婚姻一团糟于是变成了怕婚姻怕负责任的人 成为了别人口中的""渣男"" 然而这反而救了我....真的是塞翁失马",0,FALSE
"你大爷的，骂游戏是公害才是你的救命稻草。",0,FALSE
"我想给我儿子说这件事的体会 但是不知道该从何说起 索性一起看老梁讲解 我们有很多话题一起讨论",0,FALSE
"这个事件老梁比王局分析的更好",2,FALSE
"典型的诈骗，而且造成严重结果",0,FALSE
"我从04年就开始听老梁的节目 现在依然在听",24,FALSE
"还不抽身，你等急扒呢",0,TRUE
"听君一席话，胜读百年书。",0,FALSE
"结局肯定是悲剧",0,TRUE
"说的太对了，如果对方重视你，一定会谨言慎行，不会随便惹你不高兴，不会让你觉得他不行。 至于那些说自己留恋前女友的，说自己没找到感觉的，一句话，祝一辈子单身",28,FALSE
"对自己付出的难以割舍，损失厌恶",0,FALSE
"亏B汉",0,FALSE
"在台灣很久之前就流傳一句話，不論是對男對女，都應該好好的去思考這句話的意義 「別把犯賤當真愛」",5,FALSE
"老梁太可爱了，改变自己哪那么容易啊每个人都对自己好一点吧",46,FALSE
"毛 我身上有200 被骗100 我绝不会再搭100去挽回来 及时止损",0,FALSE
"本期节目质量极高 牛逼。",0,FALSE
"这男的也是很蠢",0,FALSE
"老梁是我的男神，尽管我也是男的",0,FALSE
"确实改变自己不容易，可是袜子内裤八天不换的主，还是要改一改的好。",1,FALSE
"只要是梁老师的评论都是精品",0,FALSE
"不是一个两个外国网友问我：为什么你们中国女人谈恋爱喜欢找男的要钱。哈哈哈哈，身名远扬！",0,FALSE
"明显这新闻是掩盖高速事故的，您也上套",0,FALSE
"沉默成本能及时割舍才是理智的",4,FALSE
"渣女渣男比例不懂多少",0,FALSE
"前段时间看M2档案，Ray说过一句话让我印象深刻：爱情里总是有两种错觉，我能改变你，和我能为你改变",51,FALSE
"国内没了",0,TRUE
"他要是能那么想他就不是胖猫了",0,FALSE
"沉没成本没办法解释胖猫死之前赠予66666元的举动了。",1,FALSE
"怎么不显示ip地址",0,FALSE
"一场失败的感情加速了他的自杀欲望",0,FALSE
"沉没成本别在乎是经济学入门就要指明的道理！",0,FALSE
"道德问题",0,FALSE
"-j5r9o 那是没办法，只能一起凑活过个日子",3,TRUE
"我以前被一个女的骗了9000块钱，但是我及时止损了，从此就不联系她了",5,FALSE
"真是江河日下呀，听了三分钟就不想听你再继续喷下去了…真的很抱歉",0,FALSE
"暧昧，嘴对嘴的关系，还要保持手牵手的距离。",0,FALSE
"算了吧，你一样是生活一团糟。",0,TRUE
"人家要的是正常婚恋成家。",0,TRUE
"老梁像你说的只是解释两个人爱情观，并没有说现今社会的价值观问题吧，像涂磊的名言说;给你钱花的人不一定爱你，但是不给你钱花的人一定不爱你，这不就是人的价值观导向吗？",2,FALSE
"王局在官场结构和政治黑暗 方面有自己过人的见解和评述，老梁对历史文化和人情世故有自己独到的理解和分析，各有各的长处，捧别人也不用黑其他人，这就能看出来你为人尖酸刻薄",15,TRUE
"说的太好了",1,FALSE
"你这样感情能好才怪了 你以为吃好穿好就是对别人好了？别人家里没吃没喝？你以为的好是别人觉得的好吗？说白了，你就是一个没有一点能力经营感情的人。估计你每段感情也长久不了。你也不会正真从中学到什么",2,TRUE
"我已经结婚了",0,FALSE
"那得发电站故障才会发生",0,TRUE
"見父母這點是錯的 起碼在台灣不對 台灣太多真實故事是早早帶女人見父母來安對方心的",0,FALSE
"王局都几岁了，还是一个老光棍，你觉得他懂得2性关系？",1,TRUE
"一个成年男人会吓到跳楼？",0,TRUE
"老梁就是老梁说的太通透了！",89,FALSE
"我谁都不服！但就服老梁！老梁绝对是大才！我只喜欢老梁！",0,FALSE
"",0,FALSE
"这就是社会问题，就是男女对立，现在社会风气就是这样，女孩张嘴闭嘴就是要钱，国外有这种风气吗",0,FALSE
"老梁，你说女的付出身体，那男的身体就不是身体吗？ 这句话本身就是一种扭曲观念，这是本质一点，，",0,FALSE
"最好的结局就是谭竹去见胖猫",1,FALSE
"老梁怎么不留在美国",2,FALSE
"苏享茂自杀和胖猫自杀本质不一样。 瞿欣欣是勒索，不给钱，就举报你公司违法， 苏支付不起，自己觉得走投无路才自杀； 而胖猫没有被勒索， 他的自杀单纯为了感情。",1,FALSE
"講的非常好",1,FALSE
"这孩子肯定没看老梁的情商课",0,FALSE
"学习了但我觉的除了沉默成本，还有一个纠错成本，比如坐错车，马上下车后，再回头，导致面对错误的心理成本和回程车票的成本，都上涨了",2,FALSE
"老梁，一个善良，通透，厚道的人！",208,FALSE
"胖猫的故事在快手征婚直播间每天都在上演，都是合法诈骗，法律本身不完善，平台也跟着分钱不管，上当的都是穷人而且前仆后继",0,FALSE
"好可怜，连个备胎都不当。",0,FALSE
"说得容易，互相看不上是单生的第一原因、还有一厢情愿，这是人性",0,FALSE
"说这么多，最简单做法就是，恋爱期间所有花费基本原则AA制，互送礼物但价值相当。谈婚论嫁那就彩礼嫁妆价值相当…",2,FALSE
"我不可怜这种人，他不被这个女人骗将来也会被别人骗。挣了50万没想着孝顺一下父母，结果都孝顺给败家女了",1,FALSE
"",0,FALSE
"勝則重，敗則灣，蔣家絕對是信這條，所以2013統獨辯論開局，四川就是重點",0,FALSE
"接触异性少，把恋人理想偶像化，两性关系简易化。滋生了过多不切实际的幻想虚妄——爱情务必如此这般，婚姻天生这般如此。。 奈何现实波诡云谲，遇人不良不淑。于是乎，精神世界轰然崩塌，难以承受。 有人说，要爱人先爱自己，显然这是形而上的思维意识层面。从操作层面来说，就是多性交，多皮肉接触。 有诗云： 与其诉诸修辞法，不如脱裤子就啪。 欲求无碍宗主境，先得渡劫情欲性。",2,FALSE
"渣女遇到渣男才是最好的",1,FALSE
"老梁说的通透啊，比王局更通透",2,FALSE
"不仅说男而且说女，人不分男女，只分思想。",0,FALSE
"最大的新聞就是：一個零零後玩遊戲兩年掙了50多萬！",2,FALSE
"好人眼前可能会吃亏但是可以持续，坏人眼前得利但是没有未来。",1,FALSE
"好久不见",0,FALSE
"太喜欢老梁的时事评论了",0,FALSE
"老梁现在做的根本不算是新闻节目，一会聊电影，一会讲历史，能先把新闻事件梳理清楚吗？比以前的老梁观世界差十万八千里。",0,FALSE
"没办法，几千年的文化传统就是这样，女的相夫教子，男的赚钱养家。。。还有这个社会绝大部分都是女的骗男的钱，男的骗女的钱那是少数。。绝大部分中国女人在对待男人方面都是一副优越感。。",0,FALSE
"我们都年轻过，都有过类似的这种经历，到这么严重极端的还是不多。没有走出来，这是命",3,FALSE
"王局水平有，但是坏，很会鼓惑人",0,TRUE
"说的很有道理， 事情剖析的很到位， 感谢分享",0,FALSE
"这事本身就是性别对立问题，聊个人性格没意义的。男女之间在恋爱里的不平等是事实存在的现象，女向上求偶也是普遍现象。如果最后的结论是男女都有可能发生，这个结论就很不负责任。当然，老梁的知识局限性就摆在这，阅历不会让上一代知识分子了解更新的知识体系，何况老梁只是说书人",0,FALSE
"胖猫事件有其更深层的社会原因---即社会中男女的不平等性，为什么男女交往中男方要承担一切经济开支？女方花男方的钱似乎成了天经地义的事。还是王志安说的对，那些小公主不是在争取女权，而是在给自己争取特权！",0,FALSE
"梁智強導演應該拍《那個不夠2》，以胖貓譚竹案件作為故事靈感來源。 這個事情引起大家反省女權運動是不是做得太過火了，還有錢能不能買得到愛情嗎？愛情的本質是什麼？所以，梁導可考慮這個故事題材。",0,FALSE
"男的入戏太深了",0,FALSE
"在我这里见父母这个一般都是谈的差不多想结婚了才会要求见父母的（除非是相亲）。",0,FALSE
"哎，老梁你说这么多 其实爱不爱自己，心里清楚得很 你说对了，一个就是他们不愿意撒手，舍弃这段感情 只是不愿意面对 面对自己被抛弃的结果而已。并不是不知道，也不是分不清所谓的暧昧不明。鸵鸟罢了",0,FALSE
"课代表来了：暧昧不确定，说话不算数，有事才找你，屏蔽朋友圈",1,FALSE
"反正我觉得每天那么多事故每天死那么多人。。我管你什么胖猫。",0,FALSE
"沉没成本，不好抽身而退。",0,FALSE
"看过以前这么多的恋爱博主，还不如老梁这一番话",2,FALSE
"完全赞同老梁的观点。",3,FALSE
"我认为对于事情本身老梁没说到点上，这个事情本质是诈骗，女方谭竹明明是女同性恋，根本就不喜欢胖猫，这个故事从头到尾都谭竹的骗局，目的就是为榨干胖猫的钱",0,FALSE
"“照顾得无微不至”吗？",0,TRUE
"你以为呢，你以为进去只关几年么？",1,TRUE
"老梁分析的很有道理",1,FALSE
"梁老师，注意言辞，“x丝”是脏话吧……",0,FALSE
"人生处处有“止损“",2,FALSE
"您讲的同一题材真的比王局好太多了",6,FALSE
"这种内向孩子缺乏情商，父母需要多花时间教教他们人情世故，多给他们点爱。",0,FALSE
"梁老师的话管用",1,FALSE
"",0,FALSE
"优秀生",1,TRUE
"沉没成本，不是成本。",1,FALSE
"什么时候梁先生可以来温哥华就好了",0,FALSE
"夏迎春差点听成了叶迎春 叶迎春，不是跟康师傅有一腿吗？",1,FALSE
"爱情只是生活的皮人与人之间一场游戏。更何况这还不是什么爱情只是单纯的利用 这个年代还有什么爱情？",2,FALSE
"老梁，真希望你常常更新",1,FALSE
"分析事件的透彻性，国内唯独老梁大哥",1,FALSE
"一个男的被骗要上新闻，女的被骗被渣被拐被杀是日常，神奇的国度",1,FALSE
"沉没成本不是成本！",0,FALSE
"第四条是不允许见朋友爹妈",0,TRUE
"，可能连自己都不爱，更没有余力爱别人。",1,TRUE
"王菊学术派 老梁人精",0,TRUE
"以你的智力确实不理解什么是正常人UAStudent",9,TRUE
"他父母离异……",0,TRUE
"直接打电话质问就是了",0,TRUE
"……",0,TRUE
"这才是正常正确的三观",0,FALSE
"精辟",0,FALSE
"爱情，众水不能熄灭，江河也不能淹没。若有人拿家中所有的财宝要换爱情，就全被藐视。「圣经」(雅歌 8:7 )",0,FALSE
"河南駐馬店，湖北武漢和重慶這仨地方出來的人絕對是人類道德楷模",0,FALSE
"老梁还是比王局强，同样的话题，老梁评论的比王局好的多",0,FALSE
"可悲的是，往往冷静理性的人才能听懂老梁的话，陷入恋爱的人处于一种病态，是听不进去这些的。",0,FALSE
"老梁的金玉良言啊！",0,FALSE
"就是恋爱脑",1,FALSE
"挺烦大家在网上吵这件事的。还是老梁的评论公正。 这四条太好笑了。也太准确了。。。基本一直处在这样对别人或者被别人对待的状态。不过真的不是眼光高或者渣，是没遇到绿豆叭哈哈。",0,FALSE
"这些年你的情商课让我受益匪浅，感谢",5,FALSE
"梁老师是当代几个最值得尊敬的文化人之一，还有袁腾飞老师，易中天老师，崔永元老师。",0,FALSE
"感谢老梁这番话，我也是最近陷入感情问题走不出来，各种怨气也有自责，很多不甘心，听了您的讲述使我豁然开朗",63,FALSE
"胖猫有心理疾病的症状，这事父母有责任！",0,FALSE
"人是不会变的，男女无非是财色交易，爱情对绝大部分人根本不存在",0,FALSE
"确实讲明白了",0,FALSE
"受益",0,FALSE
"男人圣经！",0,FALSE
"这期视频是说给我的，我山东农村小伙 ，在上海谈了个小我6岁的上海女朋友，他是高中没上完， 年龄小，不懂事， 我带她过年回家，我家人给见面礼给红包，到现在分手了，我没见过她家里人，她身份证号还对我隐藏！！ 伤透我和家人的心，，，",3,FALSE
"加油良老师",0,FALSE
"给菊花洗得可不少，这种人离远点，怕打雷连累到",0,TRUE
"高速应该是谁的责任",0,TRUE
"话说回来，21岁年入50万，真的好牛逼",1,FALSE
"老梁还是活得明白，头一次见人在胖猫这件事上说的这么好的。不煽情，只讲为人处事的道理，能听进这些道理真能少走很多弯路。",9,FALSE
"看来视频比文字更有利传播普世价值",1,TRUE
"如何避免成为“胖猫”？ 变强就好了 兄弟们咱一起来练葵花宝典啊",0,FALSE
"像中国的婚姻",0,FALSE
"昨天看到一个理论，说女人的快感来自能量的消耗（在山洞里处理食物和物资），男人的快感来自能量的掠夺（在野外狩猎），所以女人天生贪婪，占有的物资和能量越多越好。",0,FALSE
"及时止损",0,FALSE
"老爷子你懂啊",0,FALSE
"这话太对了明知没未来，也当作饮鸩止渴，混一天是一天了，但那不是沉没成本的事儿，单纯只是喜欢的感觉很难消散",0,TRUE
"及时止损",0,TRUE
"能做到即拥有人生大智慧还能够轻松幽默地讲述给他人听的人，除了梁老师真想不到别人了。",1,FALSE
"越拖年纪越大，早下车早换人",0,TRUE
"初次听说，不过的确在推特遇到的重庆出身的都很容易人身攻击、外貌羞辱。我对重庆的人没有偏见，只是叙述自己的经历而已。相对重庆的人来说，其他地区的人，骂街的几率小",0,TRUE
"那些人都没啥阅历吧",0,TRUE
"没错比其他讲人际学的好懂、好操作",0,TRUE
"理解，我也是。我带他来我家见我母亲，他可不会，就连他一起打网球的朋友，应该都不知道有我这个人的存在",0,TRUE
"额其实他这段说的和他自己以前讲的也有矛盾。成年人完全放弃改善自己的努力肯定是不可取的。我的理解是这一段的语境仅限于感情问题和短期效应，不能任意延伸到更大的维度上。",14,TRUE
"看到最后、你这是第一条最关键",0,TRUE
