"text","likeCount","reply"
"老梁说的 这次 我不支持。 瞎掰",1,FALSE
"为什么死1胖猫的新闻铺天盖地，梅大高速塌方死50人的新闻确销声匿迹？",2,FALSE
"老梁的这几年的有的观点真的不敢苟同，说胖猫也是在理性算计，是一种沉没成本的算计，如果胖猫已经认识到这是个沉没成本的问题话，就自然会选择即使止损放弃追求这个女孩，甚至最后选择报复这个女孩或者报警说自己被骗了，而不是把最后几万块钱转给她还搭上自己一条性命，这恰恰说明胖猫根本没意识到这是个沉没成本的问题，而是已经深陷单相恋的漩涡中不能自拔，最后轰轰烈烈的一跳说不定也是为了给女孩看的，以此证明自己对她爱的坚定。 还有一个点说爱情都是突发的，而不是越积越厚的，这一点也难苟同，我们都知道有一见钟情的爱情，当然也有日久生情的爱情，两种情况在大千世界都大量存在，为什么非说后期越积越厚的才是友情呢，实在是匪夷所思。",2,FALSE
"爱人先爱己",1,FALSE
"不做改变只做筛选，金玉良言相逢恨晚啊",0,FALSE
"你在国内，你说说看，你真的是站着说话不腰疼，这样说，他封杀甚至更严重的后果，不是更得不偿失吗？哦，让别人冲锋陷阵，你坐收渔翁之利，然后拍手说 挂的好。你咋这么自私无耻！",0,TRUE
"你去说呗，就缺你，你是人才，你咋不去当主持呢？还用马甲号，哈哈哈",1,TRUE
"阴谋论还是大行其道",0,TRUE
"人人都有可能成为胖猫，福原爱夏天的爸爸夏克立汪小菲都是胖猫。",0,FALSE
"还是接触的女人太少了",0,FALSE
"就是没谈过恋爱，陷入一种极端恋爱状态，其实每个人第一次面对所谓的爱情都可能出现情感极端。只不过对方不像胖猫事件那女的那么无耻，让男的就心死了。这个女的无耻就在面对一个情窦初开的男孩，选择挑逗而彰显自己所谓的魅力虚荣心。",1,FALSE
"对的",0,TRUE
"其实网友说的非常对: ""不能当舔狗""",0,FALSE
"无房贷车贷 下一代 不在五险中",0,FALSE
"看来老梁也是个恋爱达人",0,FALSE
"应该多讲讲梅大公路塌方事件！",0,FALSE
"这个男的不光是游戏宅男好吧，关键是他是以帮别人打游戏为生的，和纯粹玩游戏的宅男还不太一样",0,FALSE
"老梁才是人间清醒",0,FALSE
"总有些痴情那女难以自拔，教不会的，由他们去吧",2,FALSE
"老梁你这节目出晚了，10几年前有个女的就对我暧昧不清，我付出太多，最后就没有了",0,FALSE
"",0,FALSE
"女人结婚，老公的工资不是都叫交给老婆手里？ 谈恋爱的时候一切花销不都是男人负责？ 那谈恋爱的时候女人有经济困难向男人尋求幫助有什麼不對？",0,TRUE
"胖猫但凡做几次水疗也不至于落到这个地步",0,FALSE
"婚姻就是一场交易",0,TRUE
"留在美国做什么？",0,TRUE
"牛逼克拉斯",0,FALSE
"你最后一句话把我逗乐了，“一直没遇见绿豆”那自己不成王八了",0,TRUE
"-lo4yl 本来就是自嘲啊，确实不是什么优秀和伟大的人。",0,TRUE
"老梁你的观世音怎么没了",0,FALSE
"-lo4yl 我总不能说没遇到王八?自嘲可以，骂别人不礼貌啊可",0,TRUE
"看了老梁这期节目受益匪浅。刚刚结束了一段类似的感情，好在及时抽身了。谢谢老梁。",0,FALSE
"都敢自杀了还不敢拉捞女一起黄泉路上做个伴",0,TRUE
"人生多交点学费很多东西就懂了，而且一通百通了。",0,TRUE
"老梁对【物化女性】的解读真是精辟，一句话就说明白了",0,FALSE
"还是1.25倍速看起来舒服",0,FALSE
"我感觉是这个21岁的小孩被人家抓住什么小辫子了。",0,TRUE
"最中肯的还是老梁了，太多博主一边倒和蹭流量，都把我看吐了",0,FALSE
"-v3n 99%的人都是平凡人，一副空皮囊。不好意思啊兄弟，我也是开个玩笑，见谅",0,TRUE
"-s4h 认同",0,TRUE
"讲的好",0,FALSE
"受害者有罪呗！",0,FALSE
"说话不算数也是分情况的，有些要求根本就不是人家自愿答应的，而且本身就不合理",0,FALSE
"和翟欣欣一个套路",0,FALSE
"这年头，渣男渣女们 都互相多切磋吧、真的别祸害老实人了",0,FALSE
"不做改变只做筛选",0,FALSE
"极度深刻，绝对高人。",0,FALSE
"我怎么感觉这个胖猫事件是为了转移梅大高速塌方事件的公众视线",0,FALSE
"重點“選擇”",1,FALSE
"大真话",0,FALSE
"大真话",0,FALSE
"缺爱 家庭原因",0,TRUE
"说到底就是及时止损很重要，也需要魄力。",1,FALSE
"还得是老梁，其他一比就差了",0,FALSE
"我前几个月也是，让她睡了半年，半夜也得打车去，后来说她想结婚了",0,FALSE
"-lo4yl 可以刷碗和当饭托，老梁往餐桌一坐，老吸引食客了",0,TRUE
"我结婚3年了，感觉老梁说的我老婆多少都有点，咋办？",0,FALSE
"游戏服务行业还是需要团体组织，团体才可以帮助这样的个人不受伤害。",0,FALSE
"不管受伤的人性格怎么样，问题是在于这两件事里的女主角都是有预谋的，有计划的，就是奔着钱去的。就是诈骗。跟正常恋爱不一样啊！",0,FALSE
"说破大天人家是自愿的",2,FALSE
"我也遇到过这种女的，还不止一个，好像男女谈恋爱，男的必须多付出，这时候不讲平等了",1,FALSE
"自古深情留不住，唯有套路得人心。长个心眼吧哥们，爱情本质上也是一场博弈，一开始就投降的人只能是战俘，你还指望不上日内瓦公约。",0,FALSE
"胖猫的爹妈怎么活？！",0,FALSE
"算是有事(付款)才找你的一部分",5,TRUE
"说的句句在理,可不好抽身啊",0,FALSE
"-j5r9o 親情也是情",0,TRUE
"從公眾利益角度來看，該熱的都不是肥貓，肯定是梅州高速...",1,TRUE
"感情上的沉没成本不容易放弃，这里的沉没成本包含时间和机会，这都是人生最宝贵的成本，再多的钱也买不来青春和感情。沉没成本在经济决策上比较容易，因为钱没了可以再挣。",0,FALSE
"见了两面吃了一顿饭就成了男女朋友了？咋成的？老梁你咋认定的？",2,FALSE
"见了2面吃了一顿饭，然后把自己的钱都给了对方。只能说明他是个傻叉。虽然可怜 但是实在没法同情。",14,FALSE
"你等一句话错了。 改变自己一定比改变别人容易可是那是比出来的。改变自己也很难。老梁在视频里就没拿这两件事作比较。",0,TRUE
"老夫信心满满从不操之过急",0,FALSE
"尼玛，还有这种人才？",0,TRUE
"老梁多发发作品哇，速度跟上来",0,FALSE
"老梁在这引入沉没成本这一经济学概念来解释情感世界的问题本身就很牵强附会，生搬硬套，说实在的真没有过去的评论那么犀利了，而且缺乏一个很重要的视角就是从整个社会环境文化氛围以及胖猫个人的家庭和成长环境去分析事件，没有说服力。试问天下父母在抚育自己小孩的过程是否也会很理性的考虑以后的收益问题吗？或许有，但不是主要的，这种爱都是出于一种生物本能的反应做出的行为。",1,FALSE
"钱和机会成本是最重要的， 感情对小年轻最重要，胖猫绝对是感情受不了，而不是钱。 说实话，我最心疼他的钱，因为是 成年人了",0,TRUE
"还有一个点我想不通， 为什么日常很正常，或者感觉人品不错的女孩。 当有男生追她， 她就对这个男的自私自利呢？ 男的也没伤害你，对你好， 为什么要伤害他？ 男的开始追你，一定是先观察了一下，觉得你人品还不错，才追的你。 为什么最后你和他预想的不一样呢？",0,FALSE
"国服T0不削不能玩",0,FALSE
"涉世不深的纯爱男孩遇到吃人不吐骨头的捞女",0,FALSE
"爱自己最重要",0,FALSE
"老梁判断是否是备胎的四征兆：1暧昧不确定的关系；2说话不算数（轻易的答应不兑现）；3有事才找你（我需要你才见你，你需要见我对不起...）；4屏蔽朋友圈（从不带你认识自己好友，甚至不拿你发朋友圈）",9,FALSE
"",0,FALSE
"我觉得这跟赌博的心理差不多 我投了一万输了 不再投一万 我前面的那一万亏了 往下循环 越投的多 越放不下",0,FALSE
"-lk1yq 活到现在也就遇到这一个，身边都是正常人，所以一直难以理解他的行为，现实当中这种人还是少数，我只是运气不好遇到了而已。",0,TRUE
"就是买股票被套了",0,FALSE
"说啥你听啥，还点上菜了，你掏钱了？",6,TRUE
"说的真好",0,FALSE
"改变自己和做选择当然是全都要了，只是短时间很难改有选择的时候就赶紧选",0,TRUE
"感谢这里相遇",0,FALSE
"翟欣欣第二!",0,FALSE
"胖猫对自己姐姐400都不舍得花，给只见面过2次的人总共转了51万，你说胖猫值得同情吗",0,FALSE
"女的比男的早熟 知道自己有性别优势 品行不端的女孩就暴露了 真正的好女孩不会那样的。",2,TRUE
"能听懂的不用你说 听不懂的 你说也没用 就是这么神奇",0,FALSE
"去看看老翟聊的",0,FALSE
"现在社会渣女特别多！一点要当心！男孩们记住 钱要花给自己让女的看，一味付出不值得！",0,FALSE
"老粱应该是被坑过",0,FALSE
"孔丘在战国乱世看清世道的混乱，人心的背离，女人不许上桌这是有道理的，是受到当时社会的发展局限切身感受，得出来金玉良言的真道理，孔圣我终于领会了您的教诲，儒家思想万岁！！！",1,FALSE
"就像你说的一样，平时相处不错的女生，你一开始追她，她的要求就变多了，而追求时无比热情的男生，把女生追到手之后态度渐渐大不如前，这两种情况都很常见，这是个很复杂的问题，我只能说出比较简单的理解，我觉得因为男性普遍工资更高，工作强度更大，加上各种复杂的因素，目前普遍还是女性和家庭绑定更紧密，男性相对来说经济生活更独立，所以女性和男性比，在进入两性关系时会更慎重，确认关系前女性会花大量时间和精力去考察甚至是折腾男方。考察另一半我认为无可厚非，但具体到如何考察上，我也不认为那种故意刁难是正确的，我自己可能会计划两个人一起去旅游，在这个过程中观察对方是否是个有计划有主见情绪稳定的人。就胖猫这件事来说，我觉得这女的算的上杀猪盘搞诈骗的，就像老梁说的，这事和男女对立反而没太大关系",0,TRUE
"首先要爱自己！！！！！",0,FALSE
"听了10来分钟，真听不下去，首先，纯爱战士不是屌丝！再有，你拿沉没成本往感情里套啊？？？？你不用说什么和性别对立无关，性别对立不是你说不对立就不对立的，未来的性别对立必然越来越严重，这趋势是你风轻云淡就好使的？？当年日本又如何？？就像几年前你信誓旦旦的说俄乌不可能开战一样，瞎分析啥在那？以后情感的事你少分析",0,FALSE
"梁老师能给科普一下美国那个反犹太主义意识法案咋回事不？",0,FALSE
"精彩人生理解",0,FALSE
"您是我的老师",0,FALSE
"说的真好",0,FALSE
"存下来给我闺女看，祝老梁油管粉丝今年破百万！",0,FALSE
"互联网上的云老公",0,FALSE
"-r6y 矫枉要过正",0,TRUE
"哎",0,FALSE
"老梁说的太好了",0,FALSE
"這個世界還有所謂的愛可信嗎？我個人認為好像只有親情相對最可信！",0,FALSE
"老梁，能出一期2022世界杯决赛的点评吗",0,FALSE
"沉没成本再高，也不是放弃生命的理由，这个解释有点牵强",0,FALSE
"非常同意。",0,TRUE
"同样的经历哈哈哈，国男做题家必经之路呀",3,TRUE
"梁老师和王局同时做了胖猫主题的节目 梁老师完胜",0,FALSE
"你是啥玩意你搁这叫唤",0,TRUE
"说得太好了！",0,FALSE
"你国网络删帖封号禁言，这么心虚吗",0,TRUE
"自己死都不怕了还怕啥？起码也让他鱼死网破…甚至多带几个…",0,FALSE
"相信我，她和别的女生不一样",0,FALSE
"这种屁事竟然把高速塌陷死亡四十人的事故掩盖了，现在几乎全网都不再议论高速塌陷了全关注这种屁事？而且胖猫早在四月一几号就死了没几天就火化了，现在突然全网都知道了？一看就知道是为了什么，最后高速塌陷跟温州高铁一样的结果不了了之",1,FALSE
"稳如泰山，老梁不愧是人生导师",0,FALSE
"这叫为爱化蝶，，，，，，",0,FALSE
"不吃豬肉可以，但是一定要多見豬跑",0,FALSE
"哪一个面临坐牢的人会吓到跳楼？",0,TRUE
"自己以为的“无微不至‘’。你父母也照顾你无微不至，你是不是觉得很烦想离开原生家庭？",0,TRUE
"这事分析的很有水平",0,FALSE
"我感觉人难以改变的是内在。。。外在的东西花点心思还是很容易改变的，直接摆烂还是不行；外在可以折腾一下",0,FALSE
"学会了，这就去谈恋爱",0,FALSE
"本人多年前我就有他类似的经历，不过我比较幸运能走出困境。当时本以为尽量满足她的需求就会得到她的肯定，最后建立美满幸福小家庭没想过她从头到尾只是把我当成提款机。身边朋友们（包括现任太太）曾多次提醒都被忽略，直到弄得遍体鳞伤才悔不当初还要背着债务，万万没想到原来真正爱我的人早就在身边守护着我默默的陪伴从没有抱怨过一句。 她的包容让我慢慢回到正轨，后来我们结婚开始创业起初生活过的艰难我就要放弃出去找分工作养活她们母子。她又鼓励我别放弃，还没坚持到最后就不能服输，还挺着大肚子天天帮我打点家庭事业。看她都累坏了心里满怀愧疚。后来事业慢慢好转稳定， 三个儿女渐渐长大都快要读高中。我无疑是最幸运的人。但愿有类似经历的人能够早日走出阴霾迈向更好的未来。",89,FALSE
"要懂得及时止损，你在机场永远等不来一艘船。。。",0,FALSE
"说了也白说， 中国女性已经这样了 没救了",0,FALSE
"21岁小处男太可怜了 但凡早生10年前 2012年前去次洗浴 都给你安排的明明白白 现在的小处男很容易被捞女糊弄 以前就很少这事 你去洗浴人家看你小伙子发育了 直接就给你楼上贵宾一位 各种姿色身材的随便你挑 古代有钱人家为了防止家里儿子被女的迷惑 都是十二三岁早早都给安排女的给同房",0,FALSE
"老梁说得太对了，那就是我的经历啊！28岁认识，3年花尽积蓄还有一屁股债，然后被渣。32岁人生低谷她出现了，一起工作帮我还债，现在我们结婚育有两女一男，做点小买卖，没有大富大贵但也两餐温饱。温馨幸福，孩子可爱，我真是太幸运了，感恩！",20,FALSE
"就安静听着，你算什么？还点评这儿那儿的",3,TRUE
"理解不了，任何关系都是双方的",0,FALSE
"說的太好了，感覺視頻裡都是在罵我，戀愛期間結婚後的鮮明對比完全應驗",0,FALSE
"一直喜欢老梁的节目，不知为啥没了",0,FALSE
"為什麼不聊近期中國在災難往生的50餘人呢？",0,FALSE
"看社区IP在美国呢 应该就在美国了",1,TRUE
"对不起 我觉得是 自卑。 然后被利用和伤害。 我曾经这样过 永远也再也不这样了 很多关系不平衡的时候是很恐怖的",0,FALSE
"我是当年还没有朋友圈这玩意，前两条都占了，第三条有事都不找我，最后还是成了。",0,FALSE
"古代中西方社会普遍都存在性别问题，种族问题。现代社会只有三观问题，其他都是借着一个个个案非要去宣扬所谓性别问题种族问题。老梁说得特别好",0,FALSE
"什么爱，其实就是一种病",1,FALSE
"我看是父母没给够爱的问题",2,FALSE
"这几天日本有个新闻，一个50多岁的男的被陪酒女骗了钱之后直接给对方一记千鸟送她见耶稣",0,FALSE
"老梁这是给你一个heads up。因为很多人觉得改变自己很简单，恋爱时努力，结婚了就开始摆烂。人家目的不是叫你不要努力了。你要为自己改变自己，不要为了别人。",1,TRUE
"肥猫事件天天上演！",0,FALSE
"年轻的时候对爱情理解的太浅而又盲目深情 太年轻经历的事情太少 男孩子可惜了 天涯何处无芳草",0,FALSE
"-i3b我是女的 感情的事情不可勉强 强扭的瓜不甜 你应该心态放正对自己的正缘女孩付出 不是这种不爱你还接受你钱财礼物的绿茶婊子 正常好女孩或者是家庭教育好的家庭不会叫自己闺女接受自己不爱人的钱财礼物的 难免会招来无妄之灾",0,TRUE
"看胖貓 ，梅大不見了。",0,FALSE
"好有道理啊! 爱情都是突发的, 友谊才是积累的.",0,FALSE
"我小学有个同学就叫夏迎春",0,FALSE
"往国内男要彩礼往死里薅羊毛，嫁国外免费",0,FALSE
"老梁知识面广，语言表达流畅，立场观点明晰，视频观赏、获取性极强，值得订阅，我天天赏阅",0,FALSE
"一般這種人是情商底 Asperger's症 一根筋 不懂得變通 任何性別都有可能 這種一根筋的優點是在某些專業領域可能會比較成功 但容易在其他方面有盲點",0,FALSE
"自己笨怪雖",0,FALSE
"两人字：理智！",0,FALSE
"如果可以了解胖猫的原生家庭..他对大6岁的女友无底线付出的行为，似乎在付出的同时获得存在的价值吧，或许他在养育中缺失母爱、或者亏欠了某位年长女性？胖猫这样做，是潜意识的驱动力，也是曾经创伤的重复呈现。胖猫，内外冲突走向极端。",0,FALSE
"会不会是意外失足",0,FALSE
"很悲哀，感覺現在的年輕人的心理承受能力，或者稱定力怎麽這麽差，五大三粗的男人一個個活得像他niang的林黛玉；想起學現代史時老師講二戰結束時很多日本人自殺，這是軍國主義的毒害，傲慢的幻想承受不住失敗的打擊；那我們的年輕一代是怎麽了？",0,FALSE
"嗨，问题是现在的人很难听劝呀，都认为自己掌握了真理。",1,FALSE
"讲的好啊老梁！",0,FALSE
"沉默成本太大，已經付出太多，但如果胖貓去屠戮潭竹全家在自殺，才會引發社會反思，病態得索取愛情文化，現在這樣頂多是讓人感嘆胖貓太傻太癡情",0,FALSE
"那个不是it男 是it公司老总好吗",0,FALSE
"刚刚在洛杉矶参加了老梁的活动",0,FALSE
"抓紧挣钱，多学习",0,FALSE
"这主要是性格 我也是游戏宅男 也遇到过渣女 就坑了我几千块就拉黑了 主要是胖猫性格 太过执着",0,FALSE
"讲的真到位。",0,FALSE
"这样的女的 在中国实在太多太多了，她们杀人不见血，并且无需付出任何代价逍遥法外，换个身份去享受世界。翟欣欣、都美竹、刘静尧、张薇。。。。。。互联网其实没有记忆。",0,TRUE
"沉没成本也适用于那些退婚不退彩礼这些问题，导致女方被灭门的事情也不少",0,FALSE
"娶川渝女孩 享背时人生",0,FALSE
"网上有一大堆女PUA杀猪盘捞女导师，需要立法机关介入才可以。这不是男女对立，而是违法行为与受害者间的关系。",1,FALSE
"老梁是胖猫咪",1,FALSE
"老梁还是厚道人啊，，这根本就不是两个人谈恋爱的的问题，这是有目的的诈骗！",0,FALSE
"人生就是如此，活得通透一点，就会开心一点",1,TRUE
"我觉得胖猫这种人虽然可怜，但不值得同情啊",0,FALSE
"先睡了再说",0,FALSE
"就跟炒股一样，要懂得止损。不懂得止损的人，只会赔得什么都不剩。",0,FALSE
"我能理解这个男孩子的行为，我曾今有很多次一个人独处的时候，有跳楼的念头，那个时候心里是空的，感觉自己做的事情毫无意义，想到死亡的时候，居然让自的内心无比的放松，那是我无比接近死亡的时候，但幸好又从这个心境里走出来了。 胖猫的内心是干净的，是单纯的，心太单纯让他一旦失去了这个单纯的生活目标，世界就坍塌了，这时，死亡是可以让人感到愉悦，那种愉悦感让人有种如释重负，逃出生天的感觉，并不是我们理解的“想不开”，恰恰它是一种答案，一种大部人无法理解的答案。 以上纯个人感受。",6,FALSE
"及时止损，放弃沉没成本",0,FALSE
"老梁总结的4条几乎是绝对真理，是厚重的人生经验，观众们有年轻的朋友，一定要拿这把尺子量一量，发现吻和了，千万别犹豫不定。过来人一眼就能看明白男女这些事，不要再犯傻是真格的。",0,FALSE
"老梁是从人性博弈的角度来看爱情，太赞了，都直接支招了，傻子看到都明白！ 很多网友都骂胖猫傻*，其实这的确是他家庭、工作给他性格上带来的弊端，但是他终归是一个善良的人。换句话说，在人性的角度来看，这个社会很多人都是有问题的。不能因为他弱就连死都遭受看客们的嫌弃和唾骂。如果法律能够在这些方面给与足够的支持，我相信欺骗是可以阻止的，不管是金钱还是感情方面。就是因为钓鱼的成本太低了，感情里面也应该有诚信。失信和玩弄别人的人更应该遭受到法律的严厉制裁。",0,FALSE
"这才是真正的新闻评论，皇冠的明珠",0,FALSE
"好想拿上这个视频把胖猫一把拽下来给他看",0,FALSE
"老梁真是个智库，今生没有您这个人生导师来指导人生，真是遗憾呢。",0,FALSE
"沉没成本 套用在胖猫事件上，总感觉怪怪的，感情这事真的，可以这么套用吗？更愿意相信，他是被PUA了，或者真爱她。后面的4个点，确实好用。以后讲给朋友。",0,FALSE
"梁老师讲的好",1,FALSE
"你叫梁老师 老梁？",0,TRUE
"可以看王志安的",0,TRUE
"老梁厲害",1,FALSE
"老梁说的太好了，给大家总结一下：1、暧昧不确定；2、说话不算话；3、有事才找你；4、屏蔽朋友圈。大家一定要珍惜生命，远离渣男、渣女啊",12,FALSE
"每个悲剧的背后都有一个失职的母亲，要别人这么对我，早不理了，自尊心都不允许我求别人爱自己。自己赚钱自己花不香吗？ 我妈说了，平等的基础上才有健康的爱情，不平等的爱最后都是悲剧",0,FALSE
"国内互联网男女对立已经到了变态的程度，很需要老梁这样理智的声音，可惜理智的声音在国内互联网容易被封杀。。。",0,FALSE
"",0,FALSE
"咎由自取",0,FALSE
"老梁",0,FALSE
"智者。比崔梁王之类水平高一千倍",0,FALSE
"这种事情几乎天天都在上演,要么自己轻生,要么把对方弄了.",0,FALSE
"一直以为时存货，没想到时大活人！",0,FALSE
"的确，爱情都是突发的。爱情都是一见钟情，结婚才会慢慢处，慢慢挑。",0,FALSE
"的确，爱情都是突发的。爱情都是一见钟情，结婚才会慢慢处，慢慢挑。",0,FALSE
"赞同老梁，这不是一个性别问题，根本上还是“杀猪盘”以及恋爱心理的问题",1,FALSE
"父母不爱，捞女来踩。",0,FALSE
"为什么只能点一个赞，我想给您点很多个赞。",0,FALSE
"听完了之后醍醐灌顶，感谢梁老师",4,FALSE
"梅大高速2天定案。。在互聯網中從此失蹤。。一個4月份已經定案調解的姐第戀，事主已經退錢獲得諒解的情況下。在5月重新翻炒。。大國詭異的讓人背後發涼。。",1,FALSE
"看到老梁我就开心了",0,FALSE
"盐碱地容不下真话",0,FALSE
"胖猫没有及时止损",0,FALSE
"说的太好了",0,FALSE
"老梁乃感情大师",0,FALSE
"还是丁胖子金牌讲师说的到位啊。问君能有几多愁，恰似包月洗脚上二楼。",0,FALSE
"一直喜欢听老梁讲",0,FALSE
"老梁分析得很清楚！有理！",0,FALSE
"追出租车那段笑死我了，真•屌丝",0,FALSE
"胖老头子太可爱了。我有不可抗力，不能见面。",0,TRUE
"高水平的厚道人 老梁 安好",0,FALSE
"03年 每月1500块 妥妥已经是土豪了， 那会2周生活费 120 每个月250 差不多。",0,TRUE
"不可惜，自找烦恼……什么几把游戏代练，下说",0,FALSE
"我对钱比较敏感，我一般都是看对方没有暗示要钱",5,TRUE
"1.暧昧不确定 2.说话不算数 3.有事才找你 4.屏蔽朋友圈(拒绝见亲友)",0,FALSE
"不要那么狭隘，单纯是感到捞女极度无耻",1,TRUE
"梁老师讲的真好",0,FALSE
"说老梁是人生导师一点不过分",0,FALSE
"老梁情商真高 , 说的真客气",0,FALSE
"这种事很常见，底层婚恋文化导致的",0,FALSE
"亲身经历的经验是： 大部分女性和母亲都能非常敏锐的洞悉与她儿子交往女人的动机和意图，所以如果原生家庭没有这个言传身教的条件，那就去自学一些心理学知识吧(比如《社会心理学》、《亲密关系》等)，如果也没有能力自学，仅凭陌生人的几句话就能得到拯救的人极少。",1,TRUE
"亲身经历的经验是： 大部分女性和母亲都能非常敏锐的洞悉与她儿子交往女人的动机和意图，所以如果原生家庭没有这个言传身教的条件，那就去自学一些心理学知识吧(比如《社会心理学》、《亲密关系》等)，如果也没有能力自学，仅凭陌生人的几句话就能得到拯救的人极少。",1,TRUE
