"text","likeCount","reply"
"莫名其妙啊！我從小到大男人都是被嫌棄的！女人都是寶貝啊！我不明白為什麼事實不能夠公開？",2,TRUE
"我哪裡提到事實不能公開...... 你看到了什麼?",1,TRUE
"現在不是穿丁字褲道歉,比較有誠意",0,TRUE
"对",2,TRUE
"胖貓一路好走",0,FALSE
"好人",0,TRUE
"現在記者門檻真低，這女生不是本人都不會查證",1,FALSE
"論噁心 比不過我們的貓貓",0,FALSE
"87",0,FALSE
"爛東西94爛東西_",0,FALSE
"這種就是標準綠茶婊 高手是孤獨的 千萬不要被這種狐狸精型的騙 愛慕虛榮的一堆 挑個醜的心地善良的就好",0,FALSE
"稀有種了，現在多的是影片中的那種女生",1,TRUE
"我說這其實跟當年一胎化有關. 蘇享茂更扯, 可以google看看.",0,FALSE
"台湾人也说视频吗？",0,TRUE
"不是人都走了才出來道歉 有個屁用 道歉是要跟當事人 影片道歉是為了甚麼 腦袋真的有",0,FALSE
"豆菜底",0,FALSE
"這假的",0,FALSE
"東山再起過得比負心人更好才是對負心人最好的復仇",2,FALSE
"災胞真是感動人心 肺腑之言 我想跟你和好 繼續用你的錢",0,FALSE
"要錢一定是假的",0,FALSE
"交往過程,要錢就是有問題",0,FALSE
"她會有報應，等著下地獄吧",0,FALSE
"小心支語警察",0,TRUE
"現在不都是這樣嗎？利用完了就可以滾了",0,FALSE
"逆天發言",2,TRUE
"主要是得想個法律給她定個罪，最少也得把錢都要回來",0,TRUE
"記者都不會求證",3,TRUE
"我之前在Telegram app 被騙去當詐騙集團，被告我是被冤枉的。",0,FALSE
"這就是情感老師常常拍影片說的男生不要當舔狗 不要當供養者 等到結婚以後才付出，結婚前基本請客吃飯雙向感情付出才是王道不然就是流氓 還耍冷暴力？",0,FALSE
"中國人殘暴無情，自求多福吧。",0,FALSE
"恭喜這個外遇女友出名了！一大堆人知道這個壞女人惡行！",0,FALSE
"印象中死者父母和姊姊已經出面澄清不會跟胖貓的前女友和解，這個前女友利用兩年感情時間從胖貓的家裡獲得51萬元人民幣，已經走法律途徑要求胖貓的前女友照價賠償受害者家屬的損失。",2,FALSE
"這位胖貓的前女友道歉表現，別說中國網友不買單，連我都無法原諒胖貓的前女友。",0,FALSE
"幾年前抖音沒傳入台灣的時候沒人在講視頻呵呵",0,TRUE
"這ai",0,TRUE
"要道歉先把濾鏡關掉妝卸掉吧？",0,FALSE
"舔狗",0,FALSE
"這很中國",0,FALSE
"網路就是女的騙財男的騙色只有傻傻的那幾個才會認真",0,FALSE
"看太多這種故事，同樣套路。但永遠有人被騙",0,TRUE
"不該利用別人的善良來滿足自己的私慾。胖貓弟弟是善良的，在最後寧願付出所有，選擇自己結束而不是憤恨去傷害女生，很多類似案件都是寧為玉碎不為瓦全的。",0,FALSE
"我女生朋友很多，基本上都是这样的。我是恋爱脑，都是被男人骗钱。现在感情已经变成零和博弈了，不去骗人就要被骗哎，但我还是相信真爱的",0,FALSE
"女人都愛帥的 帥的又有幾個專情的 被渣完再來討拍拍",1,TRUE
"把女生寵到天上去，以後便只能遙望",0,FALSE
"哈哈...男生真的要好好保護自己 尤其是宅男",0,FALSE
"後悔是....應該要讓金主活著繼續當她的ATM嗎",0,FALSE
"陸女都一個樣",0,FALSE
"中國官方一定要把這個女的抓起來吧，詐騙犯無恥之徒跟我們的爛菜政府一模一樣！",0,FALSE
"，不能說視頻嗎？",0,TRUE
"日本化妝 中國濾鏡沒聽過嗎",1,TRUE
"沒聽過",0,TRUE
"視頻 我說了 開不開心",0,TRUE
"時代會變的",0,TRUE
"應該要判罰 不然社會不會有警惕",2,FALSE
"這我太有經驗了，瀨聊一下就去洗澡，洗了10年",0,TRUE
"绿茶女",0,FALSE
"我們稱為叫仇恨值高",1,TRUE
"我擦，都传到台湾去了",0,FALSE
"同意，织女真的恶心。如果她真的有良心的话一开始就不会有这种事，她根本就不是真心道歉，根本就是被网暴被迫道歉的",1,TRUE
"Porque existen mujeres asi tan crueles, Espero que siempre viva infeliz, una gran manipuladora, odio a esta chica",1,FALSE
"岂止，全球传播了。",0,TRUE
"中国政府： 前女友无罪，死者姐姐 把聊天记录发到网上，侵犯隐私。 全网封杀，并判罚。 这就是共产党",0,TRUE
"你想多了，大陆女生都是这样的，网上线下都一样",0,TRUE
"无罪了，反而还把胖猫姐姐封了，说她侵犯谭竹的隐私权哈哈",0,TRUE
"无罪了，反而还把胖猫姐姐封了，说她侵犯谭竹的隐私权哈哈",0,TRUE
"哈哈，恋爱脑女的",0,TRUE
"太可悲了",0,TRUE
"警察不仅没抓谭竹，反而把胖猫姐姐和她家人都封号了，哈哈，太幽默了",0,TRUE
"他从17岁开始被骗，被PUA3年，父母还离异，太惨了",0,TRUE
"他父母都离婚了，不然你以为为什么他这么缺爱容易被她骗",0,TRUE
"不仅活下来了，而且重庆警方还把胖猫家人的账号全部封了",0,TRUE
"谭竹到现在都没道歉，警察还很善心帮她挡人肉搜索",0,TRUE
"现在大陆女的99%都只想偷男的钱跑路，因为国家支持合法彩礼抢钱",0,TRUE
"不用他也是，国服巅峰玩家",0,TRUE
"是17岁就开始被打击了",0,TRUE
"哥們你看完新聞了嗎就亂説話",0,TRUE
"-xw4cw 又一个看不懂春秋笔法的，接着跪舔重庆警方吧",0,TRUE
"漂亮？把妆卸了就是个波刚",1,TRUE
"道歉就能挽回一個小孩嗎，",0,FALSE
"沒交過女友，找真心",0,FALSE
"feminist in china",0,FALSE
"，坏事传千里。这下都知道这边有龟公了。",0,TRUE
