"text","likeCount","reply"
"亲身经历的经验是： 大部分女性和母亲都能非常敏锐的洞悉与她儿子交往女人的动机和意图，所以如果原生家庭没有这个言传身教的条件，那就去自学一些心理学知识吧(比如《社会心理学》、《亲密关系》等)，如果也没有能力自学，仅凭陌生人的几句话就能得到拯救的人极少。",1,TRUE
"亲身经历的经验是： 大部分女性和母亲都能非常敏锐的洞悉与她儿子交往女人的动机和意图，所以如果原生家庭没有这个言传身教的条件，那就去自学一些心理学知识吧(比如《社会心理学》、《亲密关系》等)，如果也没有能力自学，仅凭陌生人的几句话就能得到拯救的人极少。",0,TRUE
"亲身经历的经验是： 大部分女性和母亲都能非常敏锐的洞悉与她儿子交往女人的动机和意图，所以如果原生家庭没有这个言传身教的条件，那就去自学一些心理学知识吧(比如《社会心理学》、《亲密关系》等)，如果也没有能力自学，仅凭陌生人的几句话就能得到拯救的人极少。",0,TRUE
"亲身经历的经验是： 大部分女性和母亲都能非常敏锐的洞悉与她儿子交往女人的动机和意图，所以如果原生家庭没有这个言传身教的条件，那就去自学一些心理学知识吧(比如《社会心理学》、《亲密关系》等)，如果也没有能力自学，仅凭陌生人的几句话就能得到拯救的人极少。",0,TRUE
"亲身经历的经验是： 大部分女性和母亲都能非常敏锐的洞悉与她儿子交往女人的动机和意图，所以如果原生家庭没有这个言传身教的条件，那就去自学一些心理学知识吧(比如《社会心理学》、《亲密关系》等)，如果也没有能力自学，仅凭陌生人的几句话就能得到拯救的人极少。",0,TRUE
"亲身经历的经验是： 大部分女性和母亲都能非常敏锐的洞悉与她儿子交往女人的动机和意图，所以如果原生家庭没有这个言传身教的条件，那就去自学一些心理学知识吧(比如《社会心理学》、《亲密关系》等)，如果也没有能力自学，仅凭陌生人的几句话就能得到拯救的人极少。",0,TRUE
"精彩",0,FALSE
"哈哈哈",0,TRUE
"和王局的观点基本一致",0,FALSE
"胖猫事件是四月份公安局参与已经解决了的，为什么五月1号梅州特大事件出现后又被拔出上热搜。是人都知道怎么回事",0,FALSE
"见识少了吧，查查那些跳楼的市长你就知道了",0,TRUE
"要是我能在早二十年前听到这些就好了。",0,FALSE
"家长总教女儿防狼，忘了儿子要防狐，有儿的家长借鉴，世上是真的有坏人啊",2,FALSE
"广州某女说中年男偷拍她事件，胖猫事件，还有众多的以女性为突出点的事件，折射的是中国女性地位过高过偏的畸形社会形态，一边呼吁男女平等，一边又刻意性地惯着女性，让女性有优越感，而男性是压抑感，当代的中国，见怪不怪了。",1,FALSE
"不爱一个人! 不需要去欺骗他人感情！ 也不该拿不属于你的钱！ 这魔女，该时候让人类把它消除掉！ 多么渴望遇见你的是我！ 人，不分男女！不分高低！ 一个字，良心！",0,FALSE
"月落无声老网友听了很多年了老梁的节目，甚至体育评书我都翻来覆去的我听过。好多年没听老梁了，现在来听真的是有一种。回味无穷的感觉，老梁不火，天理难容，永远老梁的粉丝，老梁永远是我老师，一日为师，终身为父，父亲大人祝你身体健康",1,FALSE
"及时止损很难，但是很关键",0,FALSE
"老梁竟说大实话",0,FALSE
"可以留言吗",0,FALSE
"梁老师是战友",0,FALSE
"学会了、今天起不刻意减肥了按照梁老师的说法减肥是一辈子的事情、不是为了搞对象",0,FALSE
"唉…就觉得哪怕是有人陪陪他，就听他吐槽抱怨也好哇！熬过最初的难过期，就像“飘”里的郝思佳所言，明天又是新的一天！ 或者换个地方重新开始，我知道这很难。树怕伤根，人怕伤心。愿世上不再有伤心的人失望离开！",0,TRUE
"4也不准，没屏蔽也可能是对方根本不在意",1,TRUE
"代练这么赚钱？",0,FALSE
"死有余辜，一个人，尤其男人。既要善良不伤害别人爱别人。也要有能力保护自己，拿的起也要放得下懂进退。没有钱没有事业硬舔就有病。我也喜欢过女人我也尽力了，但是没成功那我无遗憾了。这就是一个健康正常的人该做的事。",0,FALSE
"说的太好了",0,FALSE
"我也当过胖猫这样的人。好在我有自觉性。见面三次赔进去一部六千块诺基亚手机。这女的就再也没第四面了。无巧不成书。事隔三年。经一个同学热心介绍。又给我找一个女友。一说对方手机号。我当时就觉得我人生巧合性高于任何人。那个诺基亚机主又他妈的跟我见面了。但这次我一直没见。因为这女的还是那德行。一约会就恨不得一次吃死你。可惜。这女的还不是穷苦人家。父亲还是个共和国烈士。可悲",0,FALSE
"不敢苟同，老梁看问题的角度很自我，而且与当下时代距离较远，透露出人格并不完整，有一定缺陷，主要还是老了，没有虚心理解现在孩子的心理情况",0,FALSE
"这四点总结得太好啦！谢谢梁老师！",0,FALSE
"这四点总结得太好啦！谢谢梁老师！",1,FALSE
"老梁说得好不过胖猫基本没有意识到沉默成本，即便有也是最后2个月的事，他就是太幼稚加上一头钻进去了",0,FALSE
"女方肯定也有相当的PUA技巧，宅男也不是完全傻",0,FALSE
"一直很喜欢老梁 可胖猫这个事不是沉没理论可以解释的 胖猫的付出是可以讨回的 而且他最死前还把最后的钱以捐赠的形式给了这个女孩子 他不在乎那些钱的 说的难听点 胖猫这个男孩子有严重的心理偏执症 说好听呢 他是个对爱非常纯粹的人 这个世界容不下他 折中的说 胖猫并不是一个普通的正常人",0,FALSE
"感恩",0,FALSE
"说的对，但有一点小，胖猫他是帮游戏玩到通天带的人，2年能靠带打训50w，为了目标帮生活过到这么极致的人，在游戏里面能预判对手预判的人，要是论算计那个谭某算不过他，他应该早就知道了，就算一开始不知，中途也知道了，他只不过是想追求纯爱，或者说不愿意相信而已，不相信心中那个愿景和光的破灭，宁愿重启也不相信自己输了，这件事并不能单纯的沉默成本来形容，杀猪盘经济诈骗 偏重",0,FALSE
"说的对，但有一点小，胖猫他是帮游戏玩到通天带的人，2年能靠带打训50w，为了目标帮生活过到这么极致的人，在游戏里面能预判对手预判的人，要是论算计那个谭某算不过他，他应该早就知道了，就算一开始不知，中途也知道了，他只不过是想追求纯爱，或者说不愿意相信而已，不相信心中那个愿景和光的破灭，宁愿重启也不相信自己输了，这件事并不能单纯的沉默成本来形容，杀猪盘经济诈骗 偏重",0,FALSE
"听说老梁出来了，非常喜欢听你的节目，每天这样做节目，其实大家都非常期待。",0,FALSE
"但是无法反驳老师的建议和处理方法赞同",0,TRUE
"其实如果人们在看沉末成本的同时也看看机会成本就可以理性的分析情况了.别看太多煽情的媒体，知道怎么样去理解自己的价值，那才会有机会收获真正有营养的两性关系.",0,FALSE
"可惜了 胖貓是個有理想善良的孩子",0,FALSE
"亚女基本盘太差",0,FALSE
"古人婚姻 所谓的父母之命，媒妁之言，是智慧和大道理。婚姻不是爱情，是责任和负担。而古人的爱情在青楼，有妾，有通房丫鬟。感情世界比现代人精彩更多，只是任何人的获得都是建立在其他人付出的基础上，于是女性成为牺牲者。胖猫本身就是两性教育缺失的极端例子，昨天有，明天还有。建议，大家都应该参与和学习金融交易，不求回报，只要能知道，理解和敢于止损，那么未来人生就会顺遂很多。",0,FALSE
"老梁这次没说到点子上。最关键，我们的家庭教育，自我教育，学校教育，社会教育，都要在第一时间，教会每个人：人生最重要的，是要爱自己，是在不损害他人的前提下，全心全意的爱自己。其次重要的，才是在自己有余力的条件下，去爱家人，爱朋友，爱社会，爱国家。",0,FALSE
"梁老师，像极了对孩子苦口婆心教诲的长辈！",1,FALSE
"这种小事大炒特炒就是为了掩盖梅大高速事件的热度.",0,FALSE
"正所謂，及時止損",0,FALSE
"还是要学会断舍离",0,FALSE
"学会及时止损",0,FALSE
"说的不错，对迷茫中的年轻人帮助很大",0,FALSE
"这讲的不光是恋爱，工作，婚姻，投资，等等都是这个道理。",0,FALSE
"选择错误或单方面痴情归情感损失和精神损失，但那个叫谭竹的女的属于洗脑操控谋害他人达成自己经济目的，法律上来说其实强制她去守夜和祭拜道歉。",0,FALSE
"家庭教育和社会教育真的很重要",0,FALSE
"说的理性客观，还有很多干货，听着有劲！",0,FALSE
"情圣老梁",0,FALSE
"情到深处 难以自拔 否定反抗自己不是件易事 人在特殊情况下 很难拥有理智",0,FALSE
"他会跟猴子献宝似得。。。。莫名喜感",0,FALSE
"老梁你有所不知，現在的確是女舔男少的多了，而網上大把教女人做撈女的課程。這就是性別對立，中國畸形的兩性關係給女性帶來的特權才給了她們作惡的先決條件。",0,FALSE
"算计来算计去把自己算轻生了",2,FALSE
"老梁何不食肉糜了 没被爱过得人 知道什么算是被爱吗 他可能觉得这就是爱 就巴普洛夫犬了",0,FALSE
"这事只是最后一根稻草而已",0,TRUE
"梁老师人家清醒",0,FALSE
"一生只爱一个人、那个人应该是自己！",1,FALSE
"看到一句话，非常精辟....男人的钱是给女人看的，不是给女人花的...具体操作可以这为原则 上下波动",0,FALSE
"我就要逆天改命",0,FALSE
"我04年出生的，小时候天天山西卫视听老梁的节目",0,TRUE
"确实普遍了。非常普遍。可以说10个有9个",0,TRUE
"老梁说的也很对，不像那个王局，直接上升为性别对立，太可恶了",0,FALSE
"其实不用总结，沉没成本这个说法就是最正确的，对方爱不爱自己，自己真的要靠对比总结才知道？",2,TRUE
"有人这新闻是编的，主要是为了转移视线",0,FALSE
"虽然我遇到这种事永远不会栽跟头，但我还是认为这种事基本无解。一个宅男遇到一个温柔的女人，那是很难抵抗的，我遇到过，我从认识那个女的开始就知道她想做什么，但我就是愿意和她交往，我之所以没栽进去，第一是没那么多钱，她一提钱我就摊牌了，结果她把我拉黑了。第二是对面没有加大骗我的力度，如果她铁了心要骗我，我铁定甩不开，特别是确定关系后，那怎么可能没有金钱往来。我不信胖猫不知道这女的就是骗子，但他愿意被骗，最倒霉的是，他是真付出感情了，我不付出真感情都觉得自己在沦陷，他这样的，遇到渣女基本就等于自杀了。其实遇到渣男渣女，最好也是唯一的办法就是尽快找一个正常人谈恋爱。那些有钱人永远不怕渣女，因为他们可以同时跟N个女人玩，渣女永远玩不过他们。胖猫根本就找不到人，所以他才这么认真。另外，想预防渣女最最最最重要的是，永远不要让人知道你的真实收入，当然了，收入低例外，比如我，我永远不会被渣。我的微信经常莫名其妙的被陌生女人加好友，聊两天就开始想让我投钱做这做那，我没钱，兜比脸干净，然后她们就不联系我了",0,FALSE
"这不就是诈骗吗？",0,FALSE
"要是这心态炒股不得亏死，死都不止损，最后死了。",0,FALSE
"我更好奇什么游戏代练2年能攒50万 这50万我也想赚",0,FALSE
"老梁講的很好啊，喜歡你的女生，你說什麼都是星星眼，不喜歡你的女生，你說什麼都是冷漠顏，沒必要硬貼",0,FALSE
"最近找工作 感觉也有类似体验 不要总是找自身毛病 不行就换",0,FALSE
"梁老师最简单的就是你要知道你付出要有回报，没回报留他过年吗？",0,FALSE
"原来老梁另一面是个情感大师",0,FALSE
"时时刻刻都有胖猫，为何这次这么热？是道德的沦丧还是人性的泯灭",0,FALSE
"我的小王八在哪呢",0,FALSE
"我太喜欢听老梁讲话了，能收获不少",0,FALSE
"重庆的女人还是躲着点吧",0,FALSE
"四年前阴差阳错刷到梁叔的视频，一发不可收拾，看了很多，只有梁叔的作品我愿意付费看。梁叔说话接地气，幽默，用聊天的语气讨论，很难走神，再深刻的道理也容易听懂。长这么大，对我启发最大、让我脑袋开窍的人们，除了古代先贤，就是梁叔，其他身边的亲朋好友，父母师长，基本给不了啥启发，越来越聊不到一块儿去。回头看，能看到梁叔的作品，真是幸运。祝梁叔身体健康，晚生拜谢。",17,FALSE
"说的真好，",0,FALSE
"很多年轻人都会经历类拟的事情，我也经历过，但挺看不起“胖猫”的，过不去就用自杀来解决问题，伤害最深的是父母。人活着不能太自我，很多时候要“身不由已”，多想父母孩子身边的亲人，而不是一死了之。很多事情过去后回来再看，都会发现曾经你以为的天塌下来的事，其实不过是你在屋里没有走出来，自已就像井里的那只青蛙。",1,FALSE
"非常赞同！ 我能感受到你的善良，只是如果我们不主动提升自己，我们还会再次遇到甚至是主动寻找这类会再次伤害我们的人，因为这类人对我们极具吸引力。",0,TRUE
"说得很好",0,FALSE
"，mind of u own business",0,TRUE
"03年每月1500是土豪？呵呵，普通人而已。",0,TRUE
"我有个同事，好像也是见过2次面，然后连续两年各种网贷60多万给女孩儿花了，到了年底被催债电话吓得跑回家多一个月，手机也关机",0,FALSE
"已经七八年没有经历过爱情了",0,FALSE
"人间清醒",0,FALSE
"幸好我是基，不會碰到渣女被騙彩禮錢。最多孤老罷了",0,FALSE
"「譚竹」未來的代價是什麼？恐怕會換到一生的《守墓者》。",0,FALSE
"日文里，“爱”是相互的情感才能被称作为”爱”，这种单方面的，只能叫喜欢，我喜欢这个定义… 没有被爱过的人，怎么可能分辨得出什么是“爱”？不过是会在人群中找出最像他父母的深井冰，去重复潜意识的情感舒适区… 自从我意识到后，最近我对一个人说：这些事，在我眼里会是问题，但可能在别人眼里就不是问题，分离是成人世界的一部分，跟吃饭睡觉一样正常…”",0,FALSE
"老梁还是厚道善良的，很多时候不好判断呀，尤其是男生还想着自己要负责任呢",0,FALSE
"沉没成本太高，其实是自己麻痹自己继续付出，兴许对方会回心转意",0,FALSE
"同性之间也会发生",0,FALSE
"也算为爱而死，在他内心她就是他的全部的爱",0,FALSE
"总之就是社会道德的沦丧。",0,FALSE
"唉…他已经走了。人无完人。我不了解他, 所以就不评论他是否有错了。",0,TRUE
"我们不做改变，只做筛选",0,FALSE
"坏人不分男女",0,FALSE
"老梁的剪辑后期可太省事了，根本不用剪啊，一镜到底",1,FALSE
"我觉得总结成老梁这样是好的，因为更加清晰且明细了。",0,TRUE
"他怎么那么看轻自己 觉得自己worthless",0,FALSE
"自己要送錢的 又不是女方逼得.中國真是女權低落 噁爛男 把女性想得太簡單了.女生不是用錢就能打發的.錢才不是重點呢 更何況 沒結婚 分手又沒問題.死殘爛打的噁爛男 才有問題好嗎 ! 這事情跟欣欣案一樣 受害者永遠是女性 哀 ! 潭竹加油 快點平復心情 !",0,FALSE
"我觉得因为这件事受害人是男性，又因为年纪轻，诈骗金额不算小，所以才轰动。实际生活中被骗财被骗色的大多数是女性。而且很多女性被骗后选择忍了不发声。",0,FALSE
"目前我听到最中肯的评价。肥猫也是奇才，二年当陪练赚50多万。遇人不淑，肥猫太年轻了，人活着你不爱自己有谁会爱你。",0,FALSE
"爱情都是突发的，只有友谊才是随着时间逐渐厚实起来",2,FALSE
"改变自己更难，自私是本性，改变自己的人都有强大的理性思维并且欲望不高。",0,TRUE
"读过很多书，最崇拜一个人，那就是贝叶斯，他的理论完美解释了世事纷纷无穷尽，茫茫天数不可逃。",0,FALSE
"星期六是周末，星期天是一周的第一天。",0,FALSE
"傻孩子真的以为、能為女孩子花钱才能表达真心愛所以無至境的投入金钱想打动对方的心，可是一无所获，最终选择用生命来表达自己真正的爱",0,FALSE
"老梁还一点你没有提到 就是：“舔狗或者备胎他们自己脑子会自我洗脑自我麻痹自我幻想，在这场情感斗争中他们会自演自导，万一对方喜欢我呢希望对方是自己幻想的剧情发生”。舔狗也有一半理性，但他们有赌的成分，一个（万一）让舔狗万劫不复",0,FALSE
"一個老頭懂什麼，全憑一張嘴，大家看看就好。",0,FALSE
"不听不听，我就恋爱脑",0,FALSE
"还有一句话叫：成年人之间只做筛选不教育",2,TRUE
"又看到老梁了很开心，祝老梁身体健康",0,FALSE
"怎么，他作为新闻人能点评热点，我作为普通观众就没有发表评论的权利了？哥们你双标是有一手的",0,TRUE
"-r5n 他是你谁啊，容不得一点反馈",0,TRUE
"存起来干点什么不好",0,TRUE
"谭竹对胖猫的态度跟百度副总裁对员工的态度差不多，都是纯利益至上，区别就是百度副总裁会给钱",0,FALSE
"知乎上看的，说假如一个女人真的爱你，她一定会给你花钱！",6,TRUE
"终于等到老梁了",0,FALSE
"老梁分析很到位！",0,FALSE
"现在在中国我都不敢谈恋爱",0,FALSE
"比王志安厉害多了",0,FALSE
"现在的人找对象找什么？对于配偶美德的标准是什么？现在找对象无非是钱和外貌，所以说是各取所需，至于一个人的内在好不好，不重要，反正不是他们找的",0,FALSE
"说的太好了",0,FALSE
"因为偌大的中国容不下说真话的人，我以前关注的好几个讲真话的都被封杀了。",0,TRUE
"恋爱宝典",0,FALSE
"老梁是过来人啊，分析的很到位，有实操性",0,FALSE
"分析的对，来支持一下！",0,FALSE
"像硅谷101 脑洞乌托邦都研究巧做标题党，梁师傅这标题好像不那么吸引人 但是个人气质有觉得不简单",0,FALSE
"五浊恶世",0,FALSE
"最惨的是内敛的，东北骂大街的反而还好。",0,FALSE
"不经意间的肢体动作，不可能完美藏住，一次不漏",0,FALSE
"从小就看老梁讲故事和道理长大的 胖猫事件老梁分析的很深刻 支持",0,FALSE
"大陸到處有攝像頭、有人跳江、怎麼沒有這條新聞",0,FALSE
"金玉良言",0,FALSE
"梁老师说的一如既往的好，解答了心中多年的困惑",0,FALSE
"严重同意！",1,FALSE
"都是雄性荷尔蒙惹的祸。",0,FALSE
"两年五十多万，挺能赚钱啊。",0,FALSE
"刚刚披露是假的，姐姐记录都是P的",0,FALSE
"说到底，无论男还是女，只要颜值高，就是最强大的生产力，就是再穷，追你的男女都是一大堆",0,FALSE
"吃飽撐的",0,FALSE
"所以老梁你是怎么征服你老婆的，靠嘴皮子？",0,FALSE
"。断了这遗传基因。目前人类社会不需要这基因了。",0,TRUE
"老梁才53 歲，正值壯年",0,TRUE
"这其实就是一个人把另一个人吃干抹净的事，跟性别没多少关系，但把这事和男女对立结合起来可以让自媒体获得巨大的流量背书，冇的法，要恰饭啦。",0,TRUE
"没说到重点关键点是“捞女‘以各种渠道索要钱财这与诈骗有什么区别？",0,FALSE
"这经堂木拍的有水平",0,FALSE
"你这段话看得让人不禁感动，如果你老婆能看到你这肺腑之言，相信她一定会更爱你的",7,TRUE
"深刻通透，我要是能早点知道这些就好了，感谢老梁！ 也对我在方法论上提供了一定的指导，有时候不能被感性冲昏头脑，拿客观理性的几条标准衡量，真假立现，相信科学！",0,FALSE
"四条说得好准",0,FALSE
"难听的话 就是 500块能解决的问题 非要用50万",0,FALSE
"死者也可能是解脱了 所以不可惜 自杀的原因千千万万， 我朋友哥哥的儿子三年前跳楼自杀了，念高三的孩子。都不敢多问， 总之那孩子死之前把各种游戏账号，电脑密码等，都写在了日记本里 让别人知道。",0,TRUE
"不给看身份证那怎么能叫不懂事呢？ 社会人啊。 处好几年，处成那样，不懂事儿的是你吧",0,TRUE
"-Villes 当然是可惜的，我只是能一定程度的理解他。",0,TRUE
"上过没有？",0,TRUE
"嚯cao 21岁还几吧是孩子 他懂得事都比我多",0,TRUE
"并不是。 正常家庭应该把钱花在共同家庭上， 而死者把钱只花在那女人上， 更深的一层是，其实死者乎活在自己的世界里。",0,TRUE
"家里就那点钱啊？",0,TRUE
"姐姐妹妹的爱，与女朋友的爱是不一样的。",0,TRUE
"20年前胖猫1岁。 说了能听懂吗",0,TRUE
"我们在学会及时止损",0,FALSE
"我认识的一个渣女，她亲口告诉我：不懂什么爱情，只懂你给我花了多少钱后来盆友给她介绍了一个中科院在德国搞农业的博士。在这之前我给她介绍了一个美国人，她告诉我，唉博士太抠们，我跟他分手了。然后美国人跟她结婚了，每个月给她寄1000美元的生活费。但是我发现她还挎着博士向博士要东西……",0,FALSE
"-c8t 破逻辑",0,TRUE
"梁师益友啊",0,FALSE
"我看那个捉妖记2，看到一半直接走。",0,FALSE
"四条一条也没有，但是还是受不了了，吃饭时候我实在不想看有那英的节目，她非看不可。看我不喜欢的我也能接受，但是别看我恶心的就不行吗？活着容易吗，做完饭了刚把菜端上桌，先来一段让人反胃的歌……我造了什么孽呀",0,FALSE
"有一点忽略了，这个男的一开始并没有去追女的，而是女的主动找他追他说喜欢他骗他，男的经验不足就认真了",0,FALSE
"所以谈恋爱先上床再说 ， 然后先生孩子再说， 慢慢的付出",0,FALSE
"如果在爱情里投入了大量时间金钱 在对方身上，发现对方很垃圾，就因该立即止损",0,FALSE
"五一这个为什么会大热？难道就没有想过这是一个烟雾弹呢！为了掩盖另一个事件呢！",0,FALSE
"",0,TRUE
"确实是掏心窝子的话",0,FALSE
"希望老梁可以点醒生活中的很多人吧。讲的很透彻",0,FALSE
"老梁简直适合做感情咨询",0,FALSE
"一個願打，一個願挨",0,FALSE
"一开始还行，后面的观点我不太同意。一代人的价值观出现偏差必须要一代人的人生来偿还。现在的男女对立是全方面爆发了，不经过类似日本当年泡沫破裂的血泪洗礼，适婚男女双方不会如你建议的那般达成共识",2,FALSE
"金文声的爱徒，和郭德纲师出同门，水平是肯定有的",0,TRUE
"在中國代練 算好賺嗎?",0,FALSE
"看了这么多对这个事的评论，还是老梁这段讲的最好。现在的男孩子有点过于乖巧了，很多都是挫折教育长大的，很多都阴郁自卑。认为自己配不上如何如何，成为 pua的对象。家里有男孩的，需要注意，一定要让孩子自信起来。本来就不比任何人差。又能力赢得别人的尊重和爱。何必生活在别人的阴影中。",9,FALSE
"虽说不是性别大战的问题，但现实中被报出来的，似乎总是男生被女生欺骗的比较多。比如之前看过一个视频，一个男孩当街被女孩打嘴巴，旁边大爷看不下去了，上前阻拦，结果挨打的男孩对大爷说“你别管”……。我很讨厌郭冬临在小品中扮演的怕老婆的角色，动不动就要给老婆下跪之类的。我觉得严重带歪了这个社会的风气。从古至今，我听说过男尊女卑，也听说过男女平等，但从没听说过女尊男卑，这种是不可能有的。但郭冬临小品却恰恰反复体现了这种女尊男卑的情况。带歪社会风气。我甚至看到过大街上有男生给女孩蹲地上系鞋带，我真的很不能理解。相爱是两个人的事儿，当然一定是有一方付出大于另一方，互相包容，彼此关爱。但现在这个社会风气，包括为了卖房就宣传男人结婚要有房等等，都在把压力不断往男人身上转移，让女人的优越感越来越大。恋爱时，男人一定要头脑清醒，行就处，不行就拉倒，千万不要总是觉得需要给对方时间，需要给对方机会，如果总是这样优柔寡断，早晚会被对方骑到头上。就像视频中梁老师说的那样，一定要果断，别妇人之仁。长痛不如短痛啊。希望有情人都能终成眷属。",0,FALSE
