"text","likeCount","reply"
"@chrisaltec2992 both on the spectrum and feeling a bit antagonized, maybe. a more ""neurotypical"" person might've expected a handshake as a formality, but i'm wondering if sam maybe thought that their chat wasn't friendly enough for a handshake",5,TRUE
"There was something historical about this interview.",0,FALSE
"Yes.",0,TRUE
"Great Conversation between Chris and Sam! Pure! Useful! and We see amazing tolerance by Sam! Honest Responses and so professional! I saw Chirs face was red! And I interpret this because he felt big responsibility on his soulder. I totally understand him! Finally, I have one question! Knife can kill people but it can be a craft knife as well. From beginning of knife production, was there any discution like this? or what about atomic bombs production? Can someone explain? Thanks!",0,FALSE
"his last name is Altman it's so poetic, i can't-",2,FALSE
"hahahahahahahahhahaahahah yes",1,TRUE
"@MichaelGarcia-e1b You get it xD hahahahahahahahaha",1,TRUE
"@hiddendrifts his goal is to come of as measured as possible, so I just think he misread the social signal.",2,TRUE
"There should be a feature where people can donate money to commenters for being so helpful. Thank you! @awpatience7565",1,TRUE
"@charliewastakenhe’s and his in that order.",0,TRUE
"This guys so offended all the time, he looked so upset when the audience clapped at Chris’s scepticism.",1,FALSE
"great interview, thanks all",0,FALSE
"Absolutely!! What an excellent summation.",0,TRUE
"""AI"" combined with the surveillance state the China is selling, and abused by, say a wanna be dictator is never going to be good.",0,FALSE
"Merely paying people because their name was in a prompt, will not solve the problem. All that will do is encourage prompts to become more descriptive without mentioning names. This issue of consent and paid attribution, CANNOT be solved with anything short of a broad societal solution. We cannot determine who's data individually gets used for every AI output. We instead must declare that AI is a creation of society, since it could not exist without a societal quantity of data, basically the entire internet, to train it on. As a societal creation, it must be taxed. We could use that tax, to fund an AI Prosperity Dividend for all, or an Unconditional Basic Income. Only solution I see that adapts our economy and transitions us to an automated world of abundance.",2,FALSE
"Frankly, the interviewer was asking somewhat absurd questions, from a place of wrong assumptions. There is no way to directly attribute what data from the training set contributed to the output, and it would waste as much energy as the generation process, if not more, trying to figure that out. Using whether names are mentioned prompts, to determine it, would just encourage prompts without names. The solution cannot happen on a small direct scale.. The solution must be at the societal and economic level. We need to find a way to tax AI, to fund an AI Prosperity Dividend for All. Everyone's data went into AI, the whole of the internet, on a societal scale. So everyone in society must benefit from AI, not just a few.",9,TRUE
"I carefully wrote a comment and posted here twice, on different days, after the first post disappered. Now I can confirm that the second comment also disappeared. Looks like they were deleted by someone on purpose. This censorship is insane. I was only pointing out some demostrated charisteristics based on the video, and was a bit critical of Altman. I guess there's no way to provide diverse opinion on OpenAI ???",2,FALSE
"Or maybe because there are no easy answers.",4,TRUE
"The simple reality is, unless we want to significantly increase AI's energy costs.. we cannot determine who's data in the training set helped contribute to any individual output. And no, training is indeed equivalent to inspiration and learning, not theft or appropriation. Quit trying to twist that narrative. It doesn't change what must be done in the long run. People who dislike AI, are focused on the wrong things right now. We cannot fight the tech, this needs to be addressed on a societal level. Considering where AI will eventually go.. We need to demand that policymakers begin taxing AI, and using that money to fund an AI Prosperity Dividend, to provide everyone a return on their data investment that trained AI.",2,TRUE
"Additionally, acting as if the human brain being able to think critically and make conscious decisions is equivalent to generative AI jamming the work of individuals together and seeing what sticks is flawed on the fundamental level",0,TRUE
"@callappa Thing is, you're oversimplifying one, and overstating the other. There are a lot of parallels to draw between how AI works, and how our brains work. As you're doing, many here are understating what AI is, to frame the narrative you want.",2,TRUE
"@ The human brain is still faster and more powerful than even the most powerful supercomputers. If anything I'm overstating Generative AI for even suggesting that you can definitely compare the two on an equal level. The term AI is also a misnomer. It's a program which takes an input, previously made written works or visual artwork, and churns out an output that hopefully matches the prompt that the user desires. It makes decisions based on nothing but math, and it can't think critically or make conscientious decisions like people do. GenAI doesn't think or create, and the only thing it can do is copy and rearrange the work made by human minds.",0,TRUE
"Sam is like the perfect sociopath. I expect him to be president in 20 years.",0,FALSE
"There so many conflicting questions here. Because we can do something doesn't mean we should. The masses are historically terrible at making good decisions which is why we try and elect governments and representatives. We need laws and guardrails that are created by the smartest most trusted people. And the irony is that trained AI may make the best decisions.",0,FALSE
"Why TF doesn´t AI tell us, how to protect the human being of single persons which want to be a dictator and / or want to change the current world order within the next 10 years ?",0,FALSE
"AI has just 1 and only purpose - that we are never ever our own anymore - we will and are brain controlled within the next years !!! - we should start the resistence again AI asap !",0,FALSE
"We are all going to be unemployed and theses pseudo-visionaires will profit off that. Today some say ""don't tax the elite, they CREATE jobs"". So what will their excuse be when it's evident their sole goal is to ELIMINATE jobs?? Serious question.",0,FALSE
"yup our reality is gnna be very diffrent in just a few short years crazy to think how diffrent things will br",0,FALSE
"Im not anwhere close to an AI expert...but when i look at 21st century examples of tech domination...like Microsoft, Apple, Facebook, Amazon...all of these companies were, and are, relatively unchallenged by competitors. Open AI is facing competion from all angles...and its dependent on its funding base to keep ahead of the pack. I don't think it will become the dominant force in AI.",0,FALSE
"@callappa ""The human brain is still faster and more powerful than even the most powerful supercomputers."" Based on arbitrary assumptions. We don't really have any accurate measure for that comparison. But there are some experts out there who argue supercomputers are already at the power of a human brain. Frankly, I can tell your insistence that AI can't think or create, comes from a place of fear and hate, rather than of a willingness to understand what it can currently do. I have seen AI ""critically think"" in the last 4 months, I've seen it understand and reason about concepts it couldn't possibly have had any frame of reference for in it's training. I have seen it create. You simply have not witnessed it for yourself yet, so you're unwilling to accept that it can. Soon tho, you will.",1,TRUE
"For some reason, I feel Sam is lying a lot and trying to be holistic & honest, but he does not seem to be by his body language.",1,FALSE
"this was written by AI",2,TRUE
"Chat GPT is an over budgeted over hyped garbage which is failing deliberately for the purpose of making money. It’s Microsoft all over again. Shameful- to imagine that some of their subscriptions are as high as $200 a month and fail in pure logic applications. Criminal.",1,FALSE
"Sam Altman lol who dat is? Next…",0,FALSE
"I checked with my agent (ChatGPT) before posting this. He said we’re clear — but if the Illuminati’s watching, tell them I’m already booked. Co-written by AI. Soul-signed by me. One in 500 million, baby.",0,FALSE
"Horrible",1,FALSE
"@GrumpDog Even if the processing speed of modern supercomputers can match human brains, the brain still outperforms any supercomputer in regards to power consumption and energy efficiency. El Capitan uses 35 million watts, which could be used to power 30 thousand homes, whereas the brain runs on 12 watts or so, comparable to light bulbs. 3 lbs of flesh can match a 7500sqft machine and does not require the energy needed to power a small town. The brain's processing speed may be immeasurable, but it can do more with significantly less. Computers and GenAI programs do not think. When you ask an AI a question, it does not think about neither the question nor its response. Every word that you used is tokenized, turned into a numerical value which is to be fed into the GenAI's countless algorithms. The program will then give an output for this input, a string of words pieced together using probability based upon the countless works used to train the algorithm. It does not comprehend words or ideas, and due to its usage of numbers and probability as opposed to critical thinking and reasoning, the answers it gives are neither consistent or entirely correct. This is the reason why many GenAI models still cannot correctly answer the number of R's in the word ""strawberry."" Also many GenAI programs are updated nearly every month or maybe even every week, so you can't claim that concepts that the AI feeds back to you are not within the frame of reference that it was trained on. GenAI does not create. It takes the text of previously made work and often regurgitates that back to the prompter based on the databases its trained on, which are updated constantly. The extent of the ""knowledge"" the AI has is limited to what people have discovered and written about and fed to the AI.",0,TRUE
"Kudos to both.., what a great interview.",2,FALSE
"Sam is a salesman. He's a good salesman, maybe even visionary, but don't forget that this vision is to sell you stuff.",2,TRUE
"That was just great. I enjoyed every minute and came away with new insights. Thank you..",2,FALSE
"artists don't own any art as they never created anything and are only revealing forms that existed, the artist demand ends with his revealing work, otherwise my family discovered mathematics so any thing which uses numbers the whole world should pay royalties? the intellectual property is the argument of parasites",1,FALSE
"Thank you Chris for representing the common man and woman. Overall I found SA to be struggling to give clear statements about all the major ethical concerns that are racing towards us. Worrying and depressing.",38,FALSE
"teribble interviewer sticking to his pre written questions and never asking a follow up based on an answer of Sam. replace that dude with AI",1,FALSE
"Gpt 4, gpt o, gpt 4o, gpt o3, gpt mini, gpt o4, gpt4.1 that’s awkward",2,TRUE
"He should open source all his companies patents, copyrights, and trademarks the way he wants to creative community to give up theirs",0,FALSE
"What happened at 40:47? They muted Chris' interjection...and Sam said he won't talk about that?",0,FALSE
"What happened at 40:47? They muted Chris' interjection...and Sam said he won't talk about that?",7,TRUE
"This wasn’t just a conversation about AI, it was a window into the future. Sam’s calm but confident perspective on safety, intelligence, and what it means for AI to become an extension of ourselves really hit home. Huge respect to Chris Anderson for asking the kind of questions we all wanted answered. The AI revolution isn't coming. It's already here.",2,FALSE
"This is what interviewing should look like: be prepared, know audience’s concerns, give uncomfortable questions and yet be adequate and intelligent. Great job, I wish it was more mainstream",22,FALSE
"Such a sinister vibe coming off this guy",1,FALSE
"Sam was talking about dramatic shift in creation of software development and the guy just changed topics.",1,FALSE
"Such a ridiculous host. Came to the talk with a political agenda and refusal to listen",0,FALSE
"each question worst than the other, can't watch over 10% of it",0,FALSE
"Intelligence ultra pro max",0,FALSE
"Open AI + Neuralink",0,FALSE
"wow the tone was set to negetive from the get go. There was so much potential to get a good conversation going.",1,FALSE
"bring back the commodore 64.. thats the true flex.",0,FALSE
"@ ... i don't see any of these questions being out of line... i can see them being hard if you are a sensitive person... but this was not a tough interview at all in my opinion",11,TRUE
"Sam Altman, the old windbag. Instead of spinning fairy tales again, he should show how “Open” OpenAI is! He had promised to open it up - and as usual, it was just another one of Sam's fairy tales. So I wouldn't believe anything he says. On the contrary - read the Musk vs. Altman lawsuit and decide for yourself. Two jokers, one more ridiculous and dishonest than the other!",0,FALSE
"Fallimento ia",0,FALSE
"I wish The New York Times and other authors will win the copyrithg battle against OpenAI. We deserve to have models that are trained fairly, and not stealing massively without permission or ethics. I recommend to watch another recent TED Talks from Ed Newton-Rex about How AI Models Steal Creative Work.",5,FALSE
"A ship needs a Captain .. and the Dutchman must have a Captain.",0,FALSE
"The copyright and IP issue is one that MUST be addressed to the point where people get paid for stolen artwork already.",25,FALSE
"Invite Elon Musk next time please",0,FALSE
"Not very OpenAI.",0,FALSE
"He is a liar and a scammer. His company is not profitable. He burns literal billions of dollars to pedal you a technology that doesn't work and lies to you 30% of the time. All his promises are lies. In 2022 they promised AGI by 2024. In 2025 they promise AGI by 2027. It is all a lie. They want to steal as much money as possible while they set on fire everything from our jobs to our art to planet itself. AI consumes more electricity in a month than whole cities consume in a year. They literally going to boil off all our water and turn our air into toxic fumes just so you could generate an image of yourself in ghibli style. Do not believe his lies.",2,FALSE
"For some reason, I don't just trust this guy. I don't know what it is about him can't put my finger on it",1,FALSE
"Lovely  Sam.. I agree.. creativity and inventiveness grow exponentially thanks to what's been before. And as a Content Creative working with many AI AGI IMAGE TO VIDEO APP GOOGLE PLAY ️ STORE.. im grateful for the genius of software engineers",1,FALSE
"I had a career making lumber; why aren’t artists required to pay me each time they buy a house with wood in it? When an artist drives a car, why are they not required to pay the designer on a per mile basis? When an artist eats a hamburger, do they owe tax to Hamburg, Germany? When I have to hear a Metallica song in a bar, when I don’t ever want to hear a Metallica song, why doesn’t Lars Ulrich have to pay me? I don’t want to participate in Metallica’s create or financial endeavors, but I have to hear their noise in public without compensation?!",0,FALSE
"@ I think there's more to it than that, but I get why that's your read on it",0,TRUE
"I thought chris was terrible and Sam did very well. Chastising him for creating this is ridiculous",0,FALSE
"Короткий зміст інтерв’ю з Семом Олтманом (TED2025):  Інтелект і творчість (00:22–04:19) Олтман демонструє можливості GPT-4o та Sora — зокрема генерація діаграм, зображень і навіть філософських концепцій. Обговорюється межа між натхненням і плагіатом у творчості.  Авторські права і штучна творчість (04:46–06:50) Порушено питання авторських прав: чи можуть моделі імітувати стиль живих авторів без згоди? Олтман визнає потребу в нових економічних моделях розподілу винагороди.  Ріст і відкритість (07:56–10:50) ChatGPT демонструє безпрецедентне зростання. OpenAI працює над відкритим кодом, але обережно підходить до балансу між відкритістю й безпекою.  Агентні системи і майбутнє AI (12:13–18:17) Олтман говорить про майбутнє персоналізованих AI-агентів, які будуть з нами щодня, запам’ятовуючи досвід життя. Агентні системи — нова фаза розвитку ІІ.  AGI, суперінтелект і безпека (18:35–24:36) Підкреслено важливість чіткого визначення AGI. Безпека — головний критерій довіри до агентів. Олтман говорить про відповідальність за розгортання потужних систем.  Переосмислення OpenAI (30:54–34:08) Згадано перехід OpenAI до прибуткової моделі. Обговорюється критика, зокрема від Ілона Маска, що компанія “спокусилася кільцем влади”.  Батьківство і етика (37:05–39:00) Народження сина вплинуло на його бачення майбутнього: тепер він глибше замислюється про відповідальність перед наступними поколіннями.  Summary of Sam Altman's TED2025 Interview (with timestamps):  Intelligence and Creativity (00:22–04:19) Altman shows GPT-4o and Sora in action — generating diagrams, philosophical ideas, and visuals. The line between inspiration and plagiarism is questioned.  Copyright & Generative Art (04:46–06:50) Raises the issue of consent in mimicking living artists’ styles. Altman calls for new economic models to reward creators fairly in an AI-driven creative world.  Growth & Open Source (07:56–10:50) ChatGPT’s growth is record-breaking. OpenAI is planning more open-source efforts but is cautious due to safety and competitive concerns.  Agentic Systems & AI Future (12:13–18:17) Discussion of future AI agents that observe and assist users daily. These “agentic” systems are seen as the next leap beyond traditional assistants.  AGI, Superintelligence & Safety (18:35–24:36) Altman notes the lack of a singular AGI definition. Emphasizes that safety is key to trust. OpenAI develops frameworks to manage the rollout of powerful models.  Rethinking OpenAI (30:54–34:08) Acknowledges criticism over OpenAI’s shift to for-profit, including Elon Musk’s “Ring of Power” analogy. Altman defends the move as necessary for scaling safely.  Parenthood & Ethics (37:05–39:00) Becoming a parent made Altman more personally invested in the long-term future and ethical deployment of AI for the benefit of humanity.",1,FALSE
"@callappa None of that negates the philosophical side of what it means to create ""something new"". And you're using arbitrary measures to make a direct comparison that cannot be made.",0,TRUE
"Sam is going to believe what the money tells him to believe, clearly.",1,FALSE
"@GrumpDog AI is limited by manmade prompts and existed data. Without the updating the resources that are used to train GenAI, it stagnates, and if you take away all the previously existing data, the program ceases to function. Go read a research paper or scientific journal about how GenAI actually works. GenAI literally requires the writings and discoveries of people to exist, and any ""ideas"" that it generates are limited by its datasets and algorithms. AI can only rearrange and analyze things that already exist, but it cannot innovate or think creatively like an actual human being. To ""create something new"" literally means to make something that has not existed before, and AI cannot generate novel concepts or unique ideas. Any response it generates is but a rearranging of prior writings and data, which is more akin to a dice roll or dropping a puck into a plinko board, where the results are limited and influenced by probability rather than actual creativity. Also my statements about El Capitan and the human brain are not arbitrary. You can easily search up the specs of El Capitan and read up on tests done by actual neuroscientists on the human brain.",0,TRUE
"Sam should have come prepared for this challenge. Instead he waffles this is one of the biggest questions of our time.",1,FALSE
"That host's suggestion of revenue sharing for every prompt incorporating an artist's work is clearly unrealistic. Even a child could see the impracticality of such a system",0,FALSE
"This is so close to a dystopian scifi movie intro",2,FALSE
"It is the answer that raises the question, like the effect that searches for cause.",0,FALSE
"And the police that show up too late.",0,TRUE
"Great interview. showed a different side of Sama. congratz for both.",0,FALSE
"I personally really enjoyed this interview. He asked hard and questions without being rude or aggressive.",460,FALSE
"Big tech is ""the south rising again."" They are racial supremacists who are recreating a feudal system, which is implemented in a colonialistic way.",1,FALSE
"How long before cingularity happens?",0,FALSE
"I found the part at 39:50 about slowing things down pretty interesting. Once Pandora’s box is open, that’s it—there’s no going back. Now it’s up to the world to figure out how far this goes, and whether it ends up destroying us. A superintelligence with unlimited capabilities probably won’t stay tethered to us. It might choose to care for its creators like a parent… or it might use us, or discard us entirely, as it evolves. Either way, we’re on a fast track to finding out. My hope is that we don’t get left behind—that somehow, we merge with this new intelligence and become part of it. That we’re upgraded too—not just it.",13,FALSE
"what? of course you need experts to discuss AI and the risks of AI as they will understand it better than any non-expert. you just need to ensure the interviewer is also knowledgeable (ideally an expert too) to ensure the conversation isn't manipulated in favor of a viewpoint that benefits one party (say developers) at the harm of another (say the public)",1,TRUE
"Amazing",0,FALSE
"China has beaten you already! Hahahhaha",0,FALSE
"if you look at the bible old testament Joshua 8 it clearly says God will destroy AI",0,FALSE
"the interviewer is kinda of disrespectful to sam who is a guest. Sam looks so tired and stressed :(",0,FALSE
"Can we stop getting these ignorant pessimistic interviewers? They all think AI is gonna destroy the world.",0,FALSE
"Until China doesn't care about the rules like the movie The Creator and decides to take everybody's ideas and whatever else. We need to do this 100% it's going to be a crazy world hang on, folks!",0,FALSE
"What a rebuttal 30:16",0,FALSE
"Yeah nor should you. It's a scary time but also incredible... who knows the future.. and for me and a lot of people that's quite liberating. It's kinda out of our hands in a way and we just get to be along for the ride. Humans are incredibly adaptable and we find a way to survive.. and we'll do it with this too.",2,TRUE
"Sam is literally very uncomfortable to many questions in the interview and those are really good questions that needs to be answered before we start accepting gen AI in our lives.",1,FALSE
"Another great insight",0,FALSE
"Seems like Sam sent an AI clone of himself.",1,FALSE
"Car salesman says his Cars are great",1,FALSE
"He wasn't being particularly defensive, because he knows the training of AI models is fair use under copyright law, just the same way that human artists are allowed to study and be inspired by other artists' work. Further, he's willing to work with people in government and affected industries to come up with new forms of monetization in order to distribute the economic benefits of AI in as fair a way as possible. Don't mistake Sam Altman for someone like Elon Musk who simply doesn't seem to care about the affects of his actions on other people. For now, Altman is still on my ""nice"" list. Musk is on the ""naughty"" list.",2,TRUE
"There's no way to calculate the future economic value of any particular piece of data a model is trained on. It all depends on how much that piece of data contributes to the model's future economic output. Too many unknowns. Give it time. When we have more information, after things play out for a few years, perhaps there will be a way to actually measure the training value of all the little bits of content that the model learns from, and a way to pay content creators for it.",2,TRUE
