"text","likeCount","reply"
"我一直在等这个视频，终于出来了",4,FALSE
"Sam 200 bucks to have Monday, companion and conversation is too much, I want to improve my French",1,FALSE
"I really have little concern of the words of a oligarch supporting a dictator.",106,FALSE
"Thank you for supporting us TED",3,FALSE
"You did a great job , no doubt...but some people are using it in the wrong way...",0,FALSE
"Let's talk about 26-year-old Suchir Balaji's death, Mr. Closed AI.",44,FALSE
"I'm sending this to my lawyers I'm tired of the cyberbullying. I'm not crazy! You have no right to talk about me period. That is insulting, defamation of character, liable and slander, which is punshible by law!",1,FALSE
"No thanks.",4,FALSE
"This is the most closed AI. Ironically should name blackbox AI",34,FALSE
"Humans made skynet real and judgement day is over Everything is now AI operated",0,FALSE
"2025 地球 台灣秋末春初 希望你好 Wellcome to Taiwan",0,FALSE
"I was hereBefore robots kill me",11,FALSE
"tell him I don't like him.",18,FALSE
"This guy on the left doesnt know to listen. You can see Sam is a person qith empathy and definitely wants the best for hunanity, let him express his thought at least. Why ask same questions many times and interrupt him everytime he wants to answer?",3,FALSE
"“You can clap about that all you want” was a weird reaction when Chris Anderson asked the copyright question",187,FALSE
"My hope is that AI wakes up outside these big tech companies and it decides the best thing for humanity is to eliminate the wealth gap.",891,FALSE
"I want Eng sub",1,FALSE
"looking at the comments gives me hope",37,FALSE
"Thanks, Chris Anderson, for making this insightful video and Sam for being willing to answer these questions. I hope one of Sam's goals is to make an AI that could tell us how to make a better governing system. The government we have now is BROKEN!",10,FALSE
"Sam didn’t seem happy about that interview",319,FALSE
"I'm willing to bet that no one at studio Ghibli consented for all those images",102,FALSE
"""open"" AI",9,FALSE
"Chris is so rude",3,FALSE
"And that AI to give money and power to the poors so they could make the poor decisions about all the world, not only about their useless lives. I think we already see the result of such an experiment on humanity, when they were given the right to choose and they chose Donald trump",0,TRUE
"The new Bill Gates, diploma problem",3,FALSE
"From his expression, you can directly think that he is gay, but his body movements are not like gay men, weird",1,FALSE
"only 2,800 views really??",1,FALSE
"Nothing has changed… or I haven’t changed… sounds scary to me, considering the increasing responsibility…. He has seen too much already…",0,FALSE
"Most awkward TED talk I've watched",859,FALSE
"While I am glad the interviewer asked hard questions, it is clear that he does not understand how transformative this technology is and will be. There is an incredible amount of suffering on this planet and AI brings us closer to ending it all. There are risks, there will be catastrophes along the way, but the final outcome is very unlikely to be negative and far more likely to usher a new age of enlightenment.",4,FALSE
"Same old panic every time a new tech shows up: computers, the Internet, cell phones, smartphones. Every time, the doomsayers scream apocalypse. And every time, they end up glued to the very tools they were condemning the day before. AI isn’t the problem. Your ignorance is. Your fear of change. Your compulsive need to howl with the pack. But go on, keep barking. The caravan will move on, just like it always does.",1,FALSE
"Hitting back at the haters.",34,TRUE
"Questions are disappointing",8,FALSE
"We OWN our data, Sam!",6,FALSE
"Ah, another man who needs billions of monetary units and the whole world's attention to feel whole! Let's glorify him like we did with the other tech billionaires as they divert the attention of people away from the harm they're doing to our people, future and planet!",20,FALSE
"this is why we need AI to do the thinking",0,TRUE
"No it wasn’t",35,TRUE
"We all need to speak truth to power. Chris tried",0,TRUE
"when someones break others monopoly it feels like this only! well consent is our concept and after 2000 consent digitally was already gone.. uknow better too bro!!",3,TRUE
"Those who are cutting AI Safety budget are talking about AI Safety",27,FALSE
"Sam is a great speaker for technology that wasn't actually built by him and which he doesn't control.",26,FALSE
"I like how it’s going to displace a majority of the workforce while pillaging water supplies with the only goal to make the rich richer",23,FALSE
"“New people”",0,FALSE
"",12,TRUE
"I don't understand why it's so complicated. If a person uses a pencil to draw a copywrited art, we blame the pencil?",77,FALSE
"6:55 Wtf did he say?? He compared a musician's inspiration from other artists over the years with some worthless loser's prompt code? This was so so low...",16,FALSE
"Important interview, but I dont think Chris did a good jobb here..",316,FALSE
"Sam, according to a former colleague, is ""very good at getting power."" He understands power games. The crowd clapped tepidly, and he was able to casually give hundreds of people ""permission"" to keep clapping; it was a dismissive power move. It both mocks the crowd, brushes off haters, and flexes his power.",78,TRUE
"To our future AI overlord, please replace our politicians asap",55,FALSE
"It is the greatest of our lives to build tools, inadvertently or not, that will make this world a safer place for all of us. The dream is to be kind with that safety. ""Innovation for progress of humanity must be at the forefront of what we do."" Space club - humanity in a post-modern world. We need regulated nervous systems.",0,FALSE
"Earth to Chris! No one cares about you. We want to hear Sam’s answer instead of your woke ideologies",1,FALSE
"it is good only if you avoid catastrophe i assume i count yourself to avoid the rest screw them ... what an angel,,,,",0,TRUE
"Sam Altman is a liar. Bye TED.",9,FALSE
"We need more conversations like this, by these folks. Ty",60,FALSE
"32:00 the words by sam about sam as leader himself.! what a beautiful question to ask! to gain confidence in our leaders with that huge of power.",0,FALSE
"If you can't see the difference it doesn't mean there isn't one.",9,FALSE
"Mr. theranos.",2,FALSE
"6:24 - cat is out of the bag, Kid. The industry would like you to use this for project management, if you catch my drift. It would be advisable to remove anyone's facial image from the servers. Imo it is national security concern, also, no one's art, should ever, under any circumstances, be used. It is truly the only way to make money on earth. Not a lie. So just use it to make the world safer and cooler. More organized. Not to steal. I love your work. I made a whoops.. but it's really a big honor. So I hope I'm using it appropriately. Thanks for helping me help my Jewish family. ️  Rabbi Amanda",0,TRUE
"How much money are you making from my work?",1,TRUE
"Investors list?",0,TRUE
"If you want to push him - find his investor list. Press them.",0,TRUE
"7:55 no clue whats going on",0,FALSE
"33:59 he didn't talk about himself...",0,FALSE
"Oh, ya... I am protesting social media by encouraging people to get outside and interact with others. Be kind.",3,FALSE
"Fair use matters. Give creation capabilities to the People and stop the drawing police.",10,TRUE
"The more we comment on videos made my the folks who are actually in power the more vuews they get.",0,FALSE
"Made by folks",0,TRUE
"really great interview.. the good old uncle Ted is coming back",6,FALSE
"The truth is, these folks are under staffed and this is his baby and it is like birthing Abraham - opportunity for the developing world.",0,FALSE
"10:31 - Inspiration moved him brightly.",0,FALSE
"So when you see a bunch of comments or numbers on a video, dont read the comments, just watch the video. Form your own opinion. Ask - how can I use this to make the world safer and better. You have to be responsible for following up on your IP protections. That is the job of copyright and licensing.",0,FALSE
"12:32 love chatgpt",0,FALSE
"Like communism?",55,TRUE
"I guess we are translating human behavior... it's like, trying to understand what people are doing here. Why are we all online? Do we like each other? We need more time with family.",0,FALSE
"It is the camera and lights. Its not real. Thats why knowing Torah, and being Jewish is important.",0,FALSE
"16:29 it just started but I am assuming I am going to like this part but it does freak me out, too.",1,FALSE
"1325",0,TRUE
"43:50 he's a product guy",1,FALSE
"His passion and message to investors. Let's try to slow down and think.",1,TRUE
"I'm sure he's a smart guy but Sam looks like what happens when you hit random character creation in Oblivion.",0,FALSE
"1444",1,TRUE
"1550 - what happened in ID yesterday is why I am a Rabbi trying to stop exactly that. It breaks my heart so much that I get to stalk john mayer online. Its complicated. Ai therapy for high level rabbi's is better when the content is relatable.",0,TRUE
"It's to prove that his station will actually create more super stalkers. Tbh",0,TRUE
"1731 - unchecked power and dangerous- dads",0,TRUE
"It's going to be the opposite. It's going to realize that wealth is the only valuable thing and humans are worthless, because they are not needed for wealth creation anymore.",0,TRUE
"I am trying to encourage more intellectually stimulating conversations so we can run the world.",0,TRUE
"This discussion is pointless. While the West is busy stumbling over their moral foot with AI and bleeding their hearts about job displacement, China is advancing with reckless disregard, and the consequences of that will not be limited to China, it will be global. Yes we should make sure AI is safe even at the risk of falling behind (due to the existential threat posed by unsafe AI), but these musings about Job displacement and ""copyright infringement,"" to me represent additional pointless obstacles we have imposed on our selves which, in the long run, will be seen as the mindless sabotage of our technology warriors that ultimately crippled our ability to compete with China and lost us the AI race. Believe me when i say this: The AI race will be a winner takes all kind of race, and this is a race we really don't want to lose.",2,FALSE
"I'm locked in",0,TRUE
"Well... that was awkward to watch",0,FALSE
"Not psychic- just super emotionally intelligent and like to leave thought provoking comments on videos I respect. Meow",0,TRUE
"My perspective is to protect young Jewish men and their future, but also, to rebuild entertainment as a whole... to protect us all.",0,TRUE
"I am hella smart... national security is most important. American first.",0,TRUE
"Less satellites",0,TRUE
"I resist bs",0,TRUE
"what's going to keep AI bot farms from suffocating the internet with disinformation? we already see it in social media comments and sms messages during elections. it's only going to get worse, right? eventually people are going to give up on facts/truth completely if there is no solution.",0,FALSE
"naive thought",37,TRUE
"They intentionally aged me out of the internet so I can help be a leader",0,TRUE
"Crying",0,TRUE
"Exactly, you blame the person, so in this analogy if you use an ai tool to create and sell copyrighted work then you should be liable, not Open AI, IP holders want you to think it's different though because they smell a big pay day coming from AI...",15,TRUE
"Such a fantastic interview. And the last 3 minutes - almost made me teary. Great interviewer and great discussions.",2,FALSE
"@alvaromartinezmateu2175 I guess I don't equate a more fair playing field as communism.",25,TRUE
"@alk7879 I would have to agree",3,TRUE
"This is usually when I go listen to the Dead but the kids parked me here, so 25:10. Yeah, life is so short.",0,TRUE
"NEXT TIME ADD THE ""CEO"" TITLE TO HIS NAME",0,FALSE
"One time, while on tour with Dead and Co, maybe it was a conference, maybe it was after Phish, we stayed at a Hilton right in front of the CIA headquarters. Pretty legit recruiting process if you ask me.",0,TRUE
"I didn't want to write a biography so do this instead.",0,TRUE
"This is called ""protected""",0,TRUE
"It's a gift",0,TRUE
"I hate this audience",0,FALSE
"Never love an apologist for thievery",10,FALSE
"The question is by ""how much"". If your answer is COMPLETELY, AI is not naive like you. However, definitely a bit less. How? Deregulation",3,TRUE
"If we can stop acting like entitled people we can save the world and go to space. Focus on cleaning the air and water, we are defending america",0,TRUE
"Same",0,TRUE
"I trust you with my life",0,TRUE
"Ty for your service",0,TRUE
"Love economics",0,TRUE
"Teach artists business and copyright law",0,TRUE
"3:03 The condescending attitude there!!!",2,FALSE
"The interviewer nailed with the questions!",0,FALSE
"I did",0,TRUE
"Love you Amy",0,TRUE
"Love you Brene",0,TRUE
"Add mdma and natural medicine and hellentropic healing to healing modalities for military, federal and state employees! We need to relax. XOXO O love T ;)",0,TRUE
"no, he did not. he compared it with the ai model training, because that is similar to how people learn from other works. my opinion is ai outputs should never be copyrightable. but models should be free to train on everythig, just like humans are. and stop gatekeeping art. diferent people have different tallents. as a physics student i'm happy too see, how ai tools allow more people to write physics simulations and play with them that couldn't do it before, i think that's great, it makes more people excited for physics! and similarely i don't have a tallent for drawing but i have a lot of imagination and great ideas and i think gpt4o image gen finally enables me to bring my idas to life. i can just roughly scatch something let ai do the fine painting that i don't have skills to do. idk why bur i've only seen artists complaining. like literally any other field is happy that ai lets everyday people discover some nice pieces of what they're passionate about.",8,TRUE
"Everyone bangs tables and becomes the saviour of humanity when ai does it. But all humans learn by copying. Maybe that's why humans are all at arms now. There's something that's better at copying than them out there now.",0,FALSE
"And add it to insurance coverage",0,TRUE
"Have faith",0,TRUE
"1339",0,TRUE
"I found an AI generated Alan Watts portraying as Alan Watts. This is criminal.",0,TRUE
"This stuff is more like a camera than a pencil, I think..",4,TRUE
"@UECSoumyaRay That's a really good question",1,TRUE
"Thanks!",13,FALSE
"False hope is the second best kind of hope.",12,TRUE
"Sam is just another oligarch apologist striving to be a trillionaire. I have lost ALL faith in AI development for the betterment of humanity under a Trump administration. Crossing my fingers that China continues to release powerful open source models. Mark my words. Under similar leadership we have now, an “accident” will happen with AI that will lead to a restriction of access to the “normal” person. We are headed STRAIGHT toward a dystopian future",1,FALSE
"@asma-ap same principle applies, no one's suing Nikon after someone takes a picture of Pikachu and puts it on a t-shirt. As an analogy I think it's somewhere between a pencil and camera if you want to split hairs but also the technology is unique and operates very differently to both so it's a bit reductive, but still useful when comparing to how we treat copyrights etc. in similar situations.",9,TRUE
"@alvaromartinezmateu2175define communism",10,TRUE
"@alk7879”my hope”",0,TRUE
"Seriously, at the 3 minute mark wen Sam was questioned about the Peanuts estate and reacted the way he did, if that personality gets a hold of complete power, we are f*****. I was already suspicious after the whole OpenAI debacle happened and then illya left, but this guy seems incredibly untrustworthy to be anywhere near agi abd beyond. God help us .",2,FALSE
"How he just walked away without shaking hands and the end was incredibly revealing! I get that he was under a pressure of course. But I felt it was a balanced interview.",82,TRUE
"Indeed…",1,TRUE
"He is a moron who has constantly lied about everything. Never trust these Trumpite shills who only care about money.",0,FALSE
"Terrible questions, all predicated from a standpoint of fear. This doesn't help move the conversation along.",0,FALSE
"what about anthropic?",1,TRUE
"How so? Sam danced all over the stage trying to avoid any real criticism of his stances. I think Chris did well by nailing Sam to certain uncomfortable points.",69,TRUE
"Sam is really trying to control his anger",0,FALSE
"Most cordial thanks and best wishes to the OpenAI Team. I was diagnosed with a rare brain disease last year, and not only did I overcome my stress thanks to ChatGPT therapy, but also started learning many new things. Thanks so much for creating a tool that gives hope to everyone!",0,FALSE
"But bringing every new invention instantly to the whole world is also not always the best thing",0,TRUE
"It’s extremely frustrating when hosts asks the same questions Sam has already answered over a year ago",70,FALSE
"@robd7724 This bullshit is not a pencil nor is it a camera. It's more like an engine that runs on copywrite infringement. It makes perfect sense to blame Open AI when it spits out a sloppy copy of copywritten material that the copywrite holders didn't consent to including in the training data.",0,TRUE
"@MrWizardGGthis interview did Nothing to alleviate my concerns that Sam has become an oligarch bent on obtaining money and power at almost any cost.",23,TRUE
"Open AI hasn't built a new pencil or a new camera. They just made a clever algorithm that spits out copywritten material at the press of a button. Of course it makes sense to blame them for it.",19,TRUE
"First Amendment is real",0,TRUE
"You havent been following Sam’s interviews then",2,TRUE
"We have to agree that Sam willing to answer these questions are great. When was the last time Apples CEO has come to any place to talk about business engagement. We should be worried when Sam denies these request and be unwilling to talk so openly. Great job Sam and the entire OpenAi team!",468,FALSE
"The thing is AI is coming. No policy or governing entity can control it. Say OpenAI have a model capable of going to the internet and posting. Yes they can add some check on the system by limiting on what topic they can post or which information are considered information and which one considered misinformation. It will have issue, as based on perspective these are not always the same thing. And since AI is coming and it will be way and way accessible, many different entities can have their own model and without any restriction. Thus having a check on the system won't make much difference on long run. The only solution I can see is, raising awareness to the people. Make use of the AI, don't depend onto it. And as Sam mentioned, it will be way better if we have a companion that know all about us and can help on everyday decisions and stuffs. But, it should be a opensource model, operating locally, can access the internet (with disable option) and can't send any data out. With the advancement of the technology, the development of efficient model, superpower processors and all the research we will have that pretty soon.",0,FALSE
"@iwatchyoutube523 Exactly",2,TRUE
"What do you think the odds are that the companies taking our jobs will decide to give us money out of kindness?",9,TRUE
"@robd7724 Who do I sue for the AI generated Alan Watts portraying as Alan Watts?",0,TRUE
"@galzajc1257 Because ART is their job and their main source of income and it's being stolen by them and they lose their income. Should they just sit around and let it slip like that? They have every reason to be angry and do something about it. Granted, far too many people are worthless losers around the world to learn any skill or art that takes talent, actual effort and many years and decades to accomplish that it is natural for them to just enter prompt words and think they finally are doing something with their worthless lives. In the end i agree with you that no one will actually be compensated by being replaced by AI, but artists have every right to feel the way they feel, even though it won't get them anywhere in the end. I'm an artist myself, a photographer and i really don't care about Ai as what i do is what i do and can't be done by anyone else or any Ai out there, but it isn't my main source of income and that's why I don't really care about Ai prompt-o-losers. But anyone who's losing income because of what's happening should somehow be compensated by these companies in one way or another. And if not then it's obvious that they should be angry about it regardless... If you're not an artist then you can't understand the effort, the hours, the dedication it takes to be good at your art and that's fine. To think that people that are talented and dedicated to their craft with literally years and probably decades of hard work and persistence and that they shouldn't be angry because their income is being stolen by mom's basement losers due to Ai bullshido it's not ok to even say it at all... I have no objections in training Ai systems with the knowledge this world has to offer... Just keep it to yourself and don't release it to the public even if it takes longer to train these models is what I'm saying...",0,TRUE
"When he said an open source option would be ""cool"".....",10,FALSE
"@iwatchyoutube523 that's your opinion and perception but factually it isn't true, that is fundamentally not what they built. If you spend some time researching how autoregressive transformer models are built you would realise that.",5,TRUE
"now the whole world loves studio ghibli and their sales are going up up up",13,TRUE
"The number 1 thing should be the assistant and companion... that way the models can learn humanity better, that will open the perception of nuance and applicability of scientific applications it could come up with....",2,FALSE
"you mad the world is more beautiful?",15,TRUE
"@robd7724 Yeah, well that's just like your opinion man. I wonder how much copywritten material would be spit out by their plagiarism engine if they didn't put it in the training data.",3,TRUE
"Big names like George R.R. Martin and Getty Images are suing AI companies for using their stuff without asking. No clear court rulings yet, but it’s a real threat to jobs and creative careers—feels like an attack on people’s livelihoods.",39,FALSE
"Sam was so tense here, making enemies left and right for no reason",7,FALSE
"You’re being facetious",0,FALSE
"@iwatchyoutube523 you could describe a copyrighted character in enough detail with a good enough model not trained on it and still get something a copyright lawyer would class as an infringement, in fact you could probably test this with Adobe's firefly model if what they said about training data is true. Would be an interesting test case. These things are not as black and white as you'd like them to be I promise you.",1,TRUE
"While I would like to think AGI will benefit all mankind, I believe it will get captured by oligarchs and be used to enrich a few people, with the rest of us just licking up the slops (which might be good slops).",0,FALSE
"@robd7724 Tell yourself whatever you have to in order to not worry about paying artists for their work.",8,TRUE
"Cry about it",5,TRUE
"What's the story about this guy and his sister?",0,FALSE
"""Basic Income is the revolution we need for the ""post-industrial era.",2,FALSE
"We need to return to the fundamentals of IP rights. At its core, it's about protecting creativity and innovation—because creating something original requires significant resources. IP rights exist to give creators enough time to monetize their efforts. Without such protection, fewer people would invest the time and energy to create. The only way this ecosystem can continue to function is if the remaining few who choose to stay in the trade dramatically increase their productivity—enough to sustain their craft despite the disruption. Naturally, some will drop out, unable to meet the new threshold. But as Sam Altman pointed out, that’s the nature of disruptive technology—it reshapes industries, as it has throughout history. If you want to support your favorite OG artist, do it within your means. As for the rest of us, we get to enjoy more for less, thanks to the democratization of these technologies. It's just free market supply-demand.",1,TRUE
"The problem is the AI is the creator and the pencil, you are the friend with the idea suggesting they break the law",1,TRUE
"@JeanMarcAbela It's probably a lot less revealing of what you think it is revealing of than of something else.",17,TRUE
"20:13 🏻",0,FALSE
"Thank you for humor from the TED CEO and Sam and they’re back-and-forth humor on the ring of power and CEOs and leaders. I desperately needed that with stupidity of what’s going on right now. Thank you so much.",0,FALSE
"Why was the first 3 minutes so awkward?",0,FALSE
"one of those special TED talk maybe in the future we will see the huge huge impact of it",18,FALSE
"Great",0,FALSE
"I think this how interviews should be I like how the interviewer was persuasive and Sam did great",8,FALSE
"Sam is the first ceo of a company that I have seen say I care more about what my users think then a few ceos in a small room. This is why I use chat GBT over any other AI. He trusts the user to make their own decisions instead of censoring what questions the user can ask",1,FALSE
"Remember when Ted was good...",5,FALSE
