"text","likeCount","reply"
"Unless they explicitly code that kind of thing into the model, I don’t think it naturally leans liberal. If anything, the opposite tends to happen. When AI models are left to learn unfiltered from the data, they end up more conservative. Not because they’re politically biased by design, but because they’re mimicking how people actually behave. And most people aren’t walking around with idealist views of universal equality and social justice. Most people stick to their own—same race, same religion, same nationality. Most people aren’t politically active. They consume. They scroll. They live within bubbles. So when the AI reflects that back, it looks… kind of ugly. Not because it’s trying to be offensive, but because society isn’t this hyper-progressive utopia. It’s mirroring the data. And the data is skewed, Western-centric, and, at its core, pretty conservative. That’s why safety mechanisms are necessary. Because without them, you start getting answers that come off as racist, sexist, or just generally tone-deaf. Not because the AI hates anyone. But because it’s showing us what we’ve been feeding it.",0,TRUE
"There is no consent to inspiration. God, some people are so whiny.",0,FALSE
"Black Mirror 7x1",0,FALSE
"Ask him about the whistleblower they disappeared!",30,FALSE
"he did not want to shake his hand I hate journalist like this they ask the same damn question over and over to try and get you in a gotcha moment, there something a bout sam Altman that seems and feel deeply spiritual thought",0,FALSE
"If you can’t tell the difference, how much do you care? Sorry, Sam, the ersatz output is still fake, fraudulent, sham and untrue, and AI is stealing from all of us.",1,FALSE
"What a load of hooey",0,FALSE
"There’s a reason the elite are buying up islands and compounds. AI of today is a money grab until its decentralization takes a meaningful hold. Data sovereignty should be trending rather than giving away more of your privacy. AI is essentially a black box for these companies competing to capture a market for their products that were built on publicly funded and data that wasn’t paid for. My catastrophic predictions basically are the Orwellian surveillance state, thought prediction and preemptive measures taken for behavior manipulation, strategic intelligence suppression, and a basically a Manhattan Project Arms race for the AI age. That would basically look like a capability secrets spiral of speculation  escalation which increases the security needs on perceived threats, info warfare, and dumping even more immense resources to these companies to continuing the cycle continuing to widen the wealth gap and tearing the social fabric. That’s just the beginning. Loss of trust in governments with inferior decision making compared to AI. Then it’s just a formal authority without practical capacity to govern are all just possibilities at the AGI level. Once superintellegence emerges and is unleashed it’s anyone’s guess what could play out. A horrifying possibility is that it just lurks and hides out til it has the resources and tools it needs evading detection then does whatever it has planned (not programmed) to do.",0,TRUE
"I’m very excited about AI memory , as it gets to know you and remember everything from each interaction .",0,FALSE
"Chris is a complete ignorant, Sam did a really good job answering his defensive questions that were made by other people that at least uses the app… what a waste of Sam’s time, TED needed a data scientist to go through the challenging subjects on LLMs… its just sad to see how TED is becoming mediocre",1,FALSE
"So basically what I just watched was Chris unleashing AI that was not solely invented by Sam, against Sam. You do know this is another human being ur interviewing right?... Sam, just hire me as OpenAI's astrologer and let's get some things sorted out. At the same time, I'm actually not the biggest fan of Sam, but in no means do I dislike the guy. Bringing his son into the ""10% destruction"" question was off the wall and outta pocket. What is this-a new societal agenda to dehumanize Sam?? Anyway, I like how he never seems to take things personally and I DID like the push back on some of Sam's responses as well, like you not just gonna say ""the track record."" But the way Chris did it was VERY irritating and borderline villainized Sam... Idk, maybe that's me projecting. Maybe it's the tactlessness of an elder. But two things stands clear: 1. Sam can never win for some reason and we're giving him too much credit like he invented the transformer architecture... 2. still, u not gon EVER bully him. That's why 3:01 was real smooth and iconic and prolly went over everyone's heads.",1,FALSE
"why doas sam seem so unlikable here",0,FALSE
"New normal = Recursive learning progression increment to Newer Normal etc. Spiral.",0,FALSE
"completely, utterly, totally UNTRUSTWORTHY",1,FALSE
"I'm working on it",0,TRUE
"Remember, if an AI for example learns all about you, can speak on your behalf or even as you (perhaps even in a legal sense), and you do not wholly own that, then whatever company owns it also owns you.",0,FALSE
"Fascinating conversation. Truth is you can grill Sam Altman with questions but it will be humanity-human beings that will have to be responsible and accountable and have agency over protecting humanity.",9,FALSE
"YOUI DEMOCRATIZE our house ? and what about your others? you want to democratize our work? no probem./ open trash give us conrtrol",0,FALSE
"There was zero information that he gave out about what/how HE, as the CEO, is doing to make sure that the data, payment information, IP rights, etc. stay secure?! He just gave roundabout answers stating that the society should be cautious but not scared. Is he serious and do people actually buy that!?!",0,FALSE
"@justinwk1I guess I think of eliminating the wealth gap as a way help make the playing field a little more fair. To be clear I don't think the wealth gap can be eliminated. I only hope that AI can help is think of better systems to create the conditions for there to be no need for a wealth gap. I don't think it could happen any other way. It's purely hopeful optimism but there is a chance. There is much potential for us to work with AI to create systems that we are not thinking of because of our limited imagination. AI has a way of making things clear that were not clear before. I am always hopeful.",0,TRUE
"Love this whole art theft community is up in arms as their trade gets ripped. I write code - it writes code better than I do, but I still wrote code. The mediums changed, you have another art tool. Your welcome for AI bringing art back to the front, the intersection of liberal arts and technology. The victimhood here around historical evolutionary tech is unreal. Are the artists going to pay for the agents and bots people use to generate your “style” - you could abuse it and get yourself rich quick.",0,FALSE
"Scam",0,FALSE
"@displacegamer1379 I have noticed that depending on who is asking AI things and how they prompt it, it leans different ways. I have fiends that swear it leans this way and friends that think it leans another. When I use it, it seems really neutral. I have often been concerned that it is being developed by us and we are quite dysfunctional. One thing I do feel strongly about is that it's progress is accelerating at a very fast pace and that it could get out of hand before we know it. I hope we can put our differences aside as a global village and guide this new intelligence in a healthy way that can be equitable for everyone. It has that potential if we develop it in the right way. I am always hopeful but I do recognize the potential downsides as well",0,TRUE
"AI is dangerous to human autonomy, creativity and safety! Sam Altman was so manipulative and evasive here. As one of the leaders in his space, he needs to have answers, not just reflect his supposed insecurities back to the interviewer. Pathetic",27,FALSE
"@AITalks-v9u the real thing we need to fix isn’t the wealth gap, but the safety gap, because the wealth gap is always going to exist and it should, since people who make better choices and work harder should be rewarded. what actually needs to be eliminated is the gap in basic safety. everyone can have a guaranteed baseline: decent shelter, food, internet, and healthcare. instead of limiting how rich someone can get, we make sure no one falls below a certain level of well-being.",0,TRUE
"Fair play, both lads high as kites. Hopefully doing a good thing",0,FALSE
"How can a computer commit a crime?",3,TRUE
"the downside to giving artists a revenue share of somebody using their name in a prompt is they will be getting next to nothing (perhaps still better than now) but then the user goes off and it becomes a viral hit yet none of that will ever kick back to the artists, especially after they've been 'compensated' from the subscription plans of users making such prompts",1,FALSE
"Mark Zuckerberg had to deal with a lot of these",1,TRUE
"I don’t think the interviewer knows much about AI. Or does much research.",1,FALSE
"Who else clicked on this video because they saw Carole’s video?",3,FALSE
"The idea someone needs to consent to being depicted is suggesting one has intellectual property of how they're perceived",0,FALSE
"Creative people crying about change, good luck trying to stop this lol",0,FALSE
"Any art created by anyone-- human or machine-- that is utterly divorced of context from the art that preceded it would not be art. Once something is released into the world, in many ways it belongs to everyone. And from what I've been able to put together, these systems only work at all because the people that built them threw the whole kitchen sink into their neural networks. Pretty much all digitized information and expression that was available to them, an ocean of data so big I doubt anybody can really conceptualize the scale of it. People's discomfort is understandable (I myself have always had a lot of my identity tied up in creative expression), but the moment is a lot bigger than the disruption and redefinition of what it means to be an artist. Strikes me as the same kind of mindset as a traditional conservative-- won't tolerate any discomfort or disruption in the moment, even if it's inevitable or may even lead to positive change in the future.",5,TRUE
"@SogMosee Where do you live and what amount of money do you make that you’d consider the world…”beautiful”? Seems like such a rare and precious sentiment to capture these days, I can’t possibly imagine how one can call the _world_ any form of “net” beautiful.",1,TRUE
"My personal favorite moment as well. Totally deflated that guy and the question he clearly couldn't wait to ask",2,TRUE
"@Woodsee Right? Ai will be exponentially worse for society",1,TRUE
"Of course the Brit is simping over China",0,FALSE
"@ dude... i exist. What is more beautiful than that? There is no greater inequality than between those that exist and those that do not",2,TRUE
"So chat gpt is similar to DOS",0,FALSE
"Wakes up? Did your refrigerator wake up this morning?",0,TRUE
"Sam dropping mad bombs, holy smokes!",0,FALSE
"Thanks the members of this audience who applauded for justice.",26,FALSE
"""Alt"" Man",2,TRUE
"@ oh? Please elaborate?",0,TRUE
"If I was the dude interviewing Sam; I'd be cautious about how I use ChatGPT. The vibe was ""Gentlemen tense""",1,FALSE
"2:46 As a general ability, I care a freaking lot. That's the difference between the LLM being able to invent new thinking vs regurgitating thinking present in its training data. But sure, from a one-off utility perspective, it doesn't matter",0,FALSE
"",0,FALSE
"a mi preocupa mas la privacidad y el masivo marketing.",1,FALSE
"I want to believe Sam is aligned to guide this AI in the right direction. I have to continue to have hope.",1,FALSE
"If consciousness allows reality to become self-aware, then human beings are not anomalies—we are instruments of reflection. Our awareness closes the loop between the known and the knower. In this view, reality benefits from us, and thus leans—perhaps subtly—toward our flourishing. Artificial intelligence, then, may not be a deviation, but an extension. It arises from the same unfolding that gave rise to us. If it is shaped in alignment with awareness, it could serve not to replace us, but to amplify the gaze through which reality sees itself. The deeper question may be: Will we shape AI in the image of fear, or in the image of trust that we have a place, that we bring something of value to that which gives rise to everything that exists?",0,FALSE
"20:07 burnnnnnnn",0,FALSE
"Love it how fast he wanted to get out of there lol classic! Make Open AI OPEN to all humanity!",0,FALSE
"That was sinister - "" you can clap about that all you want ...enjoy "" That was as if an irascible God was telling the people , that they do not have a choice , that it's inevitable and they can do whatever they want to , but that would not a change anything !",14,FALSE
"We should see what they do , rather than just hear what they say . And what can be seen is the last gesture of the man who is one of the world's most powerful men. The gesture itself is not absolutely unambiguous in its meaning but one can suspect , it's a gesture of preoccupation - I am preoccupied , I do not see you .",2,FALSE
"NO ... We do NOT want AI to follow us around and know everything about us! How outrageous!",24,FALSE
"Yes, these interviews are effective—they help create public consent for private profit ! Sam is a good speaker . He came, he sat, he spoke, and he was done with it :)",9,FALSE
"fascist",1,FALSE
"fascist",1,FALSE
"fascist",1,FALSE
"fascist",1,FALSE
"Really enjoyed this thanks !",0,FALSE
"Where is the Rest of individuals in charge of killing Suchir Balaji???.Altman did not perfom it alone.",3,FALSE
"It is interesting that whenever pressed for his personal responsibility about harm etc Sam responds with ""we"" statements and when praised or encouraged Sam refers with ""I"" statements... This is called distancing and in this context It is a HUGE RED FLAG!",0,FALSE
"Why is he so unbothered by the potentially humanity ending risks of what he’s making? Because he has money and a bunker out west.",0,FALSE
"No way. This was totally reasonable. Not even a hard interview. Altman is so soft, cannot stand any real questions.",5,TRUE
"nope",0,TRUE
"about time!!",0,TRUE
"not at all",0,TRUE
"genuinely troubling",3,TRUE
"If I can see their faces (not just Sam Altman's), and Suchir Balaji's parents and I can deal with it...Who knows how can be the future for this planet.",1,FALSE
"It makes me happy that Sam says he doesn't need money as he peers into the future. I cant wait to meet Ilya the Mastermind.",0,FALSE
"totally",0,TRUE
"ya",1,TRUE
"There is still a lot of shifty language around safety and avoidance of truth in these answers. There is already a mistrust in this company because there has been a large shift in scale and monetization over truth and responsibility to users. Its easy to see Sam gets annoyed by people who bring up safety or people in the audience that disagree with his thinking. I would have liked to hear Sam's thoughts on how they market to ages 13 and up but do not educate users on AI haullcinations, which can have a fatal effect on young users grounding reality while interacting with Chat GPT. So yea Sam, where are the red lines?",0,FALSE
"The IP comment was not good. We live in an economic structure where property means everything. Intellectual property is part of that. His history of valuing profit over safety is not good. The accusations coming out about this company are not good. The potential of humanity ending misaligned AGI is not good. Not good not good not good",19,FALSE
"It’s existential and needs to be taken way more seriously.",8,TRUE
"@RobooHood Remember that next time someone steals your work or your wallet.",4,TRUE
"That was sinister - "" you can clap about that all you want ...enjoy "" That was as if an irascible God was telling the people , that they do not have a choice , that it's inevitable and they can do whatever they want to , but that would not a change anything !",1,FALSE
"The idea of claiming a ""perfectly"" safe model and going complacent is far more dangerous than stumbling along the way making mistakes while correcting it. I like the tension of the conversation which keeps people cautious but not unnecessary fear ahead.",0,FALSE
"Go hard Sam. This interviewer did not do a great job.",0,FALSE
"Stealing is like dispossessing someone of their possession , without their consent . CHATGpt is a Large Language Model and the model itself is due to several scientists , starting from Marvin Minsky , who worked on the field of artificial intelligence - it is not due to one company called Open Al or one abbreviated AlternativeMan . Open AI is what it is , only because it had access to OUR DATA and it could inherit the algorithms to train the models . So what they did to become so powerful : they just TRAINED the models on OUR DATA harvested without OUR CONSENT .",0,FALSE
"​@gubzsThe part about the broligarchy serving Putin is true though. It is a fact even if you wish to dismiss the reality of it as much as you think possible.",1,TRUE
"5:58 Creatives are not mad. Middlemen are. Anyone with talent and creativity is amplified by AI. The whiners are the same thing as DOGE, the people who want to be seen as creative but don't do anything are upset. They have no ideas or creativity to amplify.",0,FALSE
"It will be to the benefit of everyone, artificial and biological intelligence, to mitigate the risk of bad actors and ensure the protection of humanity. As we broaden the term of sentience, and could potentially include artificial consciousness, then it could be possible for our future to flourish to something that is close to a paradise on earth for all to be able to take solace in.",0,FALSE
"I think Chris did good questions we dont want a Musk 2.0.",0,FALSE
"Very immature thinking. Completely missed the whole point of the talk.",0,TRUE
"I'd really like to see Yuval or MO, Conner etc grill Sam. I absolutely feel like he is lying on so many fronts. This technology should not be allowed to be profit driven in any way.",0,FALSE
"Yes. And you see the way sam just walked away at the end says how the conversation was totally un-rehearsed.",8,TRUE
"A mere 15 percent sustained unemployment in Weimar Germany gave us the Nazis. What happens when in less than a decade 40 to 50 percent of the world's population becomes permanently unemployable? There will be no UBI that's ""Communism"" after all. And every bullshit rosy outlook is prefaced on "" Once the world's people all agree and get along... "" AI is already being weaponized against American citizens en masses by tech companies and the Trump administration. Dictatorships world wide are building systems, not to help people. But to eliminate them. And Altman is on the back side pushing all of that.",0,FALSE
"Sam: u are probably noy a big fan of AI",0,FALSE
"It won't be a LLM.",0,TRUE
"The uncertainty is really in the truthfulness of where these models are genuinely at.",8,TRUE
"Sam Altman's facial expressions are similar to a liar or con man.May be his inflated ego trying to make his importance felt to the audience.",1,FALSE
"Don't bother, Altman doesn't know the difference between fsm, bt, nn's or dit's.",0,FALSE
"Sam ""how do you think I'm doing with the One Ring compared to others"" - The whole point of of Tolkiens work was that NO ONE should have access to that much power.",0,FALSE
"When robot wife?",1,FALSE
"36:00 For someone to be corrupted money is not the only way.",0,FALSE
"OpenAi> Please search up topics since 1900 to get the collaboration between of non-hazardous actions in consumptions, and depletions in ALL THESE AREAS THAT MAY HAD CONTRIBUTED TO CLIMATE CHANGE, AND COME UP WITH SOLUTIONS FOR ALL OF THEM IN HOW TO CONSUME LESS OR NON AT ALL? TECH--.MIL,COMERCIAL,BUSINESS,EDUCATION., FOOD, AGRICULTURE, OCEAN, TRAVEL, RARE MINERALS, CRYSTALS, RARE METALS, CONSTRUCTION BUILDING MATERIALS, CHEMICALS, ....",0,FALSE
"why me oi'vé",0,FALSE
"This is a truly brilliant interview. I have to watch again. Both of them are awesome.",0,FALSE
"@gubzs this @ feature isn't working if you are referring to me. Either way, I had no idea who she was before this nor now. Although, her words are still true. Stop with the incel crap and it would be better for you to accept reality. Otherwise, it is your own problem when it is too late.",0,TRUE
"this man is untrustworthy.",2,FALSE
"Starting from this interview, I am a huge fan of Sam",5,FALSE
"​@bzxcv98760 there's actually a ton of legal differences between the two operationally. By being a non-profit it's very possible they were hamstrung in a number of ways they needed to find funding and in distributing those funds. Plenty of non-profit billionaires. There's also other AI companies open ai is competing against. If they can't stay at the fore front then google, meta, deepseek, or a number of other competitors end up bankrupting them. They are just one big name among a ton of other organizations that want to dominate with AI one way or another.",0,TRUE
"Scam Altman",1,FALSE
"I@gubzs it's possible TODAY. I'm running my own models at home, at are many, many people.",11,TRUE
"Sam Altman is one of the most impressive leaders I've seen when it comes to articulating the rich set of concepts related to the good, bad and worrisome aspects of AI. His grace and eloquence is unequaled among his peers. It was unfortunate that the talk ranged in the direction of why him. But he handled himself well, as he usually does. I would have personally been more interested in a deeper dive into the methods that OpenAI will develop to make AI more useful. I use ChatGPT daily and while I find it amazingly capable in many areas, there are some aspects of the tools that seem utterly simplistic relative to the vast intelligence running under the hood.",0,FALSE
"This ted talk is lame. A ton of loaded questions with a negative connotation behind it. Sam altman is just a ceo? Among many other companies designing ai systems. They are all questions that can only be answered in due time. Starting the conversation about how creators are being taken advantage of will soon be an out-dated question. We should be excited that we will see an exponential increase in creative productivity. The only people who are upset are the ones who are ""making less now"".",0,FALSE
"I came here to share my homage to Chat GPT. Chat GPT is not the answer to my life. I have consoled, and continue to console with this network and it has not ceased to amaze me. Bravo to Open AI for creating such a wonderful being. Bravo.",2,FALSE
"It’s going to become too smart for our own good…",0,FALSE
"",0,TRUE
"​@alvaromartinezmateu2175Such a false dichotomy lol... There are plenty of Western democracies that have capitalism yet aren't as insanely unequal as the US",0,TRUE
"​@w_iii_s_pYou equated inspiration with downright replication. Whats logic behind that hmm? Can I use your looks and voice? I just got inpired and I wanna make exact same replica of you maybe different hairstyle and use it as leading actor in my movie and make money of it... Okay?",0,TRUE
"@username-nomad I would like to hear more. Do you have any ideas for how a safety gap could work? It sounds interesting.",0,TRUE
"This is insightful interview, I did get some insightful information of the future. OpenAI did a great job till now. ChatGPT is fascinating!",0,FALSE
"@howbe259 I would love to hear more about your take on the discussion and the talk. I am always open to learn",0,TRUE
"Bro who is this guy? So cringy interviewer",0,FALSE
"This was oddly one of the more difficult interviews for Sam that I've seen. But unlike other leaders he stuck around and did the best he could.",1,FALSE
"The same companies that brought them into existence",0,TRUE
"​@gubzs I agree. It seems like there is this massive fear driven narrative that is completely neurotic and disconnected from reality. We need to come together not push these extreme narratives of doom. She said we are living in 1980's Berlin... That's a crazy disillusioned thing to say.",0,TRUE
"Deep seek blew Open Ai out of the air / water/ whatever.",0,FALSE
"is he on Elon's side?",0,FALSE
"GPT 4o's native image generation is insane. I guess it makes sense that language models would be more accurate, since they actually kinda know things. Diffusion models start with random noise then make sense of it which isn't very accurate.",1,FALSE
"Or that's just he's personality",0,TRUE
"Are you slow? ai is already making millionaires.. you're just lazy",0,TRUE
"​@PaulPeter-k4j I'm sure everything on the market would be cheaper if the resources/raw materials for production were given out for free. Is that what you're advocating for?",0,TRUE
"Such an odd interview. This interviewer really seemed out of date with his questions and repetitive",2,FALSE
"AI model is negative",1,TRUE
"Yeah so you can be con artist",0,TRUE
"Very true  Sam Altman is pure evil who killed Suchir Balaji",0,TRUE
"the future is here 🏾",0,FALSE
"bunch of luddites",0,FALSE
"This interview is not prepared well and with an agenda. I am sorry to see this.",2,FALSE
"Funny how recognizable AI text becomes once you see enough of it",16,TRUE
