"text","likeCount","reply"
"Great speech, thanks for enlightening us : we saw the results of your honeymoon",4,FALSE
"Absolutely loved this speech! You brought in such a fresh perspective, especially with the references to Switzerland—such a brilliant addition!  The insights on Race and its impact on marketing were spot on and super thought-provoking. This talk really gave me some great takeaways to think about moving forward. Amazing job, super inspiring!",4,FALSE
"Amazing perspective and very well articulated..",3,FALSE
"Such a wonderful speech Ram . Genuinely loved it ️ It was very insightful and definitely makes us think about the choices we make !! The kind of motivation everyone needs to ponder upon !!",3,FALSE
"Wow, what an incredible speech! it really added depth and made everything even more relatable.  The discussion around Race in marketing was so powerful and thought-provoking; you've given us all so much to reflect on. Truly an outstanding presentation, thank you for sharing your wisdom with us!",5,FALSE
"This is incredible!  I’m so proud of you for speaking at TEDx! It's amazing to see you share your knowledge on such a huge stage!  Keep doing awesome things—couldn’t be prouder! "", Not a lot of teenagers get to hear something like this! Amazing!",8,FALSE
"Inspired by your speech and interesting too, love the way you elaborate it in an insightful way, totally loved it",4,FALSE
"Such an amazing talk by Ramkumar Sethuramalingam!  The way he breaks down the role of AI in marketing and the psychology behind consumer decisions is so eye-opening.  It’s not every day you get to hear from someone with such vast experience and knowledge, and self-introspection. Definitely learned a lot from this.",4,FALSE
"Its really amazing that you shared your personal story Mr. Ram Kumar , i find this really inspiring and motivative",4,FALSE
"Thankyou :)",1,TRUE
"Wow, this talk was incredible, Ramkumar!  Your insights into AI in marketing and the psychology behind consumer behavior were so eye-opening.  It's amazing to see someone with your level of expertise sharing such valuable knowledge on a platform like TEDx. I’m sure this will inspire so many people!",4,FALSE
"Congratulations on this speech. It has everything a convincing talk needs. Thanks for sharing your experience, thought provoking questions and for making laugh. Can’t wait for your next one",4,FALSE
"Excellent topic, very well articulated with personal experiences! Shoutout to you, bro!",4,FALSE
"Such an inspiring and motivating speech Ram 🏼🏼🏼🏼. Please keep it up .",3,FALSE
"Ram, what an insightful and at the same time humorous speech on an extremely relevant subject these days. I am currently in the situation where I as future mom am considered a big money bag that can be targeted and manipulated by the marketing AI easily! I will follow your RACE rules and try to protect my choices",2,FALSE
"Wonderful Ram",4,FALSE
"All the German gods are on vacation in Switzerland! For beauty and low taxes",4,FALSE
"Great talk Ram! Congratulations  I really like your example of getting a pair of shoes. Now I will check all my devices.  Thanks for sharing!",4,FALSE
"What a great sprach! Thank you for the insights.",4,FALSE
"Very nice and interesting talk. You might feel manipulated by the system. It’s good to be conscious of your choices …Congrats",4,FALSE
"Absolutely brilliant, Ram! Your talk was so inspiring and incredibly informative - loved how you seamlessly blended personal stories with powerful insights on marketing AI. Your passion and creativity truly shine through. Amazing work! ️",4,FALSE
"An excellent talk that really stood out! The insights into AI marketing were not only informative but also presented in a way that kept me hooked throughout. It’s always great to learn from someone with such clarity and perspective!",4,FALSE
"Congratulations Wonderful speech",5,FALSE
"Your deep knowledge of AI and its applications in marketing really came through. It's clear that you have a great understanding of both the technical aspects and practical implications.",4,FALSE
"congratulations for the great talk. Interesting insights!",4,FALSE
"What a clarity in speech that's understandable even for a common man. Wonderful talk  keep going",5,FALSE
"Congrats, Ram! Your TED Talk was fantastic—AI ethics and storytelling in marketing? You absolutely nailed it! With your blend of psychology, AI magic, and 18 years of expertise, you had us hooked. Keep owning the stage and reminding us to ask the big question before hitting “buy”: Do I really need this? Brilliant stuff!",4,FALSE
"Excellent talk Ram. Relevant topic in today’s AI world. Father’s wisdom ‘I like the iPad, but do not need it.’",5,FALSE
"A big applause to you Ram for delivering an informative speech highlighting the menace of AI.",4,FALSE
"That's an interesting talk and a real eye opener....liked the way that you made anyone connect with your speech...hearty congratulations",5,FALSE
"Amazing talk! So proud of you!🏽",4,FALSE
"Wonderful talk! Congratulations on being a TedX speaker",5,FALSE
"Very nicely presented with personal touch to keep the audience at the edge of their seat !!",4,FALSE
"Bro!! Just Loved it!! Its utmost important to take Control of self and our decisioning power...than being a Puppet to the AI Influencers 🏼🏼🏼🏼🏼🏼",6,FALSE
"Excellent ram. Loved it",4,FALSE
"Wow Ram! Such an amazing speech, many insights which makes us more aware in our daily life!",5,FALSE
"Congrats Ram, this is indeed on a different level. A big achievement and a major milestone ... Way to go",5,FALSE
"It was a great talk",4,FALSE
"Wonderful pitch Ram. You have a great stage dominance and the power to grab the attention for a long period of time. Your pitch is eye opening on the choices we make on a day to day basis and also gives a solution on how to protect our choices. Very well done. Congratulations.",5,FALSE
"I really enjoyed watching this.",4,FALSE
"Congratulations Ram, you not only picked a super important topic around Ethical AI – you also presented in a very professional manner. It is very visible, that you are enjoying the stage while being recorded! Your superb and very likeable presence makes it fun watching you. Keep investing into this talent of yours!",5,FALSE
"Very good message",2,FALSE
"Superb Ram wonderful and motivating speech . Please keep it up 🏼🏼🏼🏼",2,FALSE
"awesome pitch with a limbic opening of Choices... and link it to the Marketing AI topic.",3,FALSE
"Thanks a lot @geethagopalakrishnan5217 for those kind words !",0,TRUE
"Fantastic talk, Great insights on Marketing & AI along with a nice message to protect our choices!",3,FALSE
"That is a wonderful message. Great work Ram.",4,FALSE
"This is a perfect pitch ! Much needed awareness for the current generation in terms of their spending maturity . Difference between necessity and luxury couldn't be better explained than this . Kudos to you !",3,FALSE
"Awesome speech .. Millennials and Gen z kids have changed the way they handle their finances and easily get influenced by online marketing . Its high time , people realise the importance of their choices that are necessary",4,FALSE
"This talk is truly insightful and inspiring! Ram did an excellent job breaking down complex marketing AI concepts into understandable bits. It's clear that the future of marketing is being shaped right before our eyes",2,FALSE
"This presentation was incredibly thought-provoking and motivating! Ram did an outstanding job simplifying complex AI marketing concepts into easy-to-digest insights. It's evident that the future of marketing is unfolding right in front of us.",2,FALSE
"Very good educational bit on how AI can help, but also how we can set the limits. Good reminder on data privacy. Coincidentally, I had switched off a few settings for targeted ads on Instagram and Facebook so they don't have access to so much of my data, and now I cannot scroll past 3 posts without waiting on an irrelevant ad pushed on my screen. Like they're some vengeful whiny exes.",3,FALSE
"Awesome talk . You presented it so good with apt examples in layman terms !!",3,FALSE
"Superb speech Ram !! Very impactful and delivery was on spot . Being a common man it was so clear for my understanding! Much needed topic",3,FALSE
"Excellent pitch . A topic with a mandatory awareness that everyone should actually possess",3,FALSE
"Starting with the Nutella reference was a great move to attract the viewers especially me !! Good speech Ram",3,FALSE
"Wonderful speech!!! Thanks a lot for choosing this topic",3,FALSE
"Good job Ram your talk was informative and interesting. Keep rocking",3,FALSE
"Thankyou drjanani2783.",0,TRUE
"Thankyou @Arthur James-w7t",0,TRUE
"Thankyou @iyyappadevaraj3387 for your extensive and appreciative feedback. I like those words necessity and luxury. Thanks",0,TRUE
"Thankyou @anithasekar3409",0,TRUE
"Ram's TEDx talk was so good, more like TedX Masterpiece! I'm starting to think I'm friends with the next big thinker. Seriously, well done!",1,FALSE
"Well done! Great effort. Family proud of you!",2,FALSE
"Wow, thank you so much for your incredibly kind words! Your message truly made my day—it means a lot coming from a friend like you!",0,TRUE
"@ganeshkumar1273 Thank you so much for your kind words! It means the world to have my family’s support and pride—it truly keeps me motivated. Grateful for all the encouragement along the way!",0,TRUE
"Awesome Talk, with a clever Nutella intro and a perfect closing that tied everything together brilliantly! Thankyou for providing a takeaway with Race!",1,FALSE
"Neat job, Not only did you choose an incredibly important topic on Ethical AI, but you also delivered it with a high level of professionalism. It’s clear that you were truly enjoying yourself on stage, and your enthusiasm came through in the recording. Your engaging and likable presence made it a pleasure to watch. Keep nurturing this natural talent of yours!",3,FALSE
"Great talk, Ram! Important topic ! Very well presented.",1,FALSE
"You seemed really relaxed during the whole talk. And made me smile with the jar of Nutella. And created more awareness about AI marketing. And I am glad that I don't use stuff like Alexa and the likes. But it is still spooky that I search for something I want to buy and the suggestions keep on appearing for such a long time.",1,FALSE
"Very well done, Ram! Congratulations on delivering such a talk on such on important topic. Keep going!",1,FALSE
"Love the talk Ramkumar! Dead on! Congrats my friend.",1,FALSE
"I have just watched this, and it’s fantastic! I really enjoyed Ramkumar´s storytelling and how he linked it to the influence of marketing AI on our everyday choices. Key takeaways for me: Marketing AI is both empowering and manipulative. The fact that we make 35,000 choices a day and there are 86,400 seconds in a day really puts things into perspective, showing how easily we can give away our freedom to make choices. PS – That statistic about the top 500 brands we choose coming from just 12 companies in the world is mind-blowing!",1,FALSE
"well done! congrats for an impactful talk",1,FALSE
"Great talk. Hearing about the ever eluding privacy of ours and its translation to marketing we receive is a great reminder.",1,FALSE
"Nice speech Ram. Insight ful conversion. Good job",1,FALSE
"Had no idea what was happening at the start but it did make me laugh",1,FALSE
"35000 choice in a single day is insane",1,FALSE
"Thankyou , hope it built the suspense !",1,TRUE
"True, but it’s the Reality !",1,TRUE
"I would never ever trust Marketing AI Ramkumar. Excellent talk , thank you",0,FALSE
"@ramcaliberIt definitely did",1,TRUE
"@ramcaliberit is indeed",1,TRUE
"Thankyou! It’s Not about Trust , it’s more about your own Will to see an offer, and say - do I really need this",0,TRUE
"I couldn’t trust it either",0,FALSE
"Thanks for giving me a deeper insight to marketing Ai Ramkumar",1,FALSE
"Thankyou , appreciate it !",1,TRUE
"@ramcalibergood point and thank you for taking the time to reply. You sir are a fabulous speaker , ps i love Nutella too :-)",0,TRUE
"Powerful message ! I’m not really into these topics BUT i do appreciate great speakers who make the talk more interesting than the topic actually is! Great speaker ! Congratulations",0,FALSE
"⁠@ramcaliberNo problem",1,TRUE
"Thank you so much , that truly means a lot! I'm glad the message resonated with you, even if the topic isn’t your usual cup of tea. It’s always my goal to bring energy and relevance to every conversation. Appreciate the kind words and support!",0,TRUE
"Be conscious of your choices atleast your dad knew the answer lol",2,FALSE
"Haven’t been good with my money at all since the internet has been pushing this stuff in my face it’s just so easy",2,FALSE
"Yes, Defintely.Dad's Wisdom :Ask before you buy -Do you really need it !",0,TRUE
"Yes, its tough but awarness even more important",0,TRUE
"Raising awareness to stay away from this stuff is so important thanks for keeping our heads up",1,FALSE
"Making the right choices especially the ones that are right and wrong are improtsnt",1,FALSE
"If your AI-generated campaign goes viral but alienates your audience, did it actually succeed - enjoyed your talk",0,FALSE
"We shouldn’t just be asking how AI can sell better—but how it can sell more responsibly.",0,FALSE
"Love the talk Ramkumar also love that name it’s awesome",1,FALSE
"We shouldn’t always trust marketing but especially not marketing Ai i’ve seen it everywhere and it’s horrible",1,FALSE
"Well done Ramkumar. You sir are an inspiration. Keep shining !",1,FALSE
"Very interesting and informative talk sir. I really enjoyed it. Thought provoking and such a fast changing area !",1,FALSE
"Ai is u predictable and the ads have been ridiculous",1,FALSE
"Really enjoyed the talk Ramkumar you’re a great speaker dude",1,FALSE
"Absolutely!",0,TRUE
"Thankyou well said, Prioritize your wants based on needs is important !",1,TRUE
"Thankyou!",1,TRUE
"@ramcaliber",0,TRUE
"@ramcaliberi agree",0,TRUE
"@ramcaliberYou’re welcome",1,TRUE
"AI doesn’t remove the need for human marketers Ramkumar ; it shifts their role—from data analysts to strategic storytellers.",0,FALSE
"Imagine a future where your favorite brand anticipates your needs without being invasive. That’s the sweet spot—AI with empathy!",0,FALSE
"Amazing talk my man !",0,FALSE
"Had to give this talk a second watch Ramkumar you speak a lot of truth",0,FALSE
"How could you say no to some Nutella though they got you aswell",1,FALSE
"Marketing now is becoming so smart and targeted",2,FALSE
"Gotta have that dad wisdom!",2,FALSE
"@ramcaliberalways thinking bout what we need",1,TRUE
"Yes definetely! Do we really need it",0,TRUE
"Personalization on the go is the Trend !",0,TRUE
"Yes :)",0,TRUE
"Thankyou for you support !,",0,TRUE
"Watching it again few months Ram, still resonates fresh!",1,FALSE
"The way he connected psychology with AI-driven marketing really made me think about how much of my buying is subconscious. It’s a little unsettling but also fascinating.",0,FALSE
"I love how he emphasized ethics because AI without responsibility could easily manipulate people instead of empowering them. That’s the part we often overlook in tech discussions.",0,FALSE
"His breakdown of social proof and scarcity was spot-on. It really shows how AI is just amplifying tactics that already work on us.",0,FALSE
"The storytelling aspect stood out to me, it feels so timeless, yet now AI can replicate it at scale. Makes me wonder if we’ll even notice when a machine is pulling at our emotions.",0,FALSE
"Thanks for your insights , yes more on the psychology !",0,TRUE
"True — AI can move us with stories, but the real magic still lies in the human intention behind them.",0,TRUE
"The talk makes me question how much of my loyalty to brands is actually real versus engineered. That’s kind of a scary realization.",0,FALSE
"I liked how he framed AI as transformative but also a double-edged sword. It all comes down to who’s controlling the narrative behind the algorithms.",0,FALSE
"Scarcity being used by AI feels dangerous, because machines don’t have a sense of balance. They’ll just keep pushing until people are exhausted.",0,FALSE
"The part about consistency in messaging resonated with me. It’s amazing how predictable we humans can be once AI maps our behavior.",0,FALSE
"Yes indeed!",0,TRUE
"I appreciate that he didn’t demonize AI but instead highlighted the responsibility of marketers. That perspective felt more balanced than the usual doom-and-gloom talks.",1,FALSE
"The psychology he explained almost makes me want to audit my own buying decisions. How many of my “choices” were really mine?",1,FALSE
"His mention of sustainability alongside AI was refreshing. It’s rare to hear marketing experts put both in the same sentence.",0,FALSE
"What struck me most is how emotions are the universal language, even in a digital world. AI just happens to be fluent in exploiting it.",1,FALSE
"The reminder about ethics is so important, because without it, AI marketing could become manipulation disguised as personalization. That’s a thin line.",0,FALSE
"I couldn’t stop thinking about the consistency principle AI makes it so easy to reinforce habits we don’t even notice forming. That’s both powerful and risky.",0,FALSE
"Storytelling being central to AI marketing is wild. Machines are now the ones spinning the tales we use to define ourselves.",1,FALSE
"@ramcaliber True!",0,TRUE
"This made me rethink the ads I scroll past every day. They’re not just random—they’re designed to hit my psychological triggers.",0,FALSE
"The emphasis on emotional connections reminded me that at the end of the day, marketing is about people, not products. AI just adds another layer of sophistication to that.",0,FALSE
"I admire how he didn’t shy away from the darker side of AI marketing. It’s refreshing to hear an expert acknowledge both sides of the coin.",0,FALSE
"His experience really came through when he tied psychology to technology so seamlessly. It felt less like theory and more like wisdom from the field.",0,FALSE
"The talk made me reflect on trust do we trust the technology itself, or the people programming it? That’s probably the real question.",0,FALSE
"Trust is a big question !",0,TRUE
"Thankyou !",0,TRUE
"Have to tell the facts exactly !",0,TRUE
"I like how he reminded us that AI isn’t just about efficiency, it’s about responsibility. Without ethics, marketing can easily become manipulation.",0,FALSE
"His point about emotional connections being amplified by AI really hit me. It’s a reminder that tech can either deepen trust or exploit it.",0,FALSE
"I never thought about how consistency in messaging could be abused by AI. It shows why ethical boundaries matter more than ever.",0,FALSE
"Scarcity has always been a powerful marketing tool, but with AI it could become dangerous. I like that he’s calling for restraint, not just innovation.",0,FALSE
"This talk made me realize how much of my buying is driven by psychology. AI just makes those levers easier to pull—ethics has to balance that.",0,FALSE
"Nooo vive Marjane Algérie",0,FALSE
"I love that he framed AI as a tool for empathy, not exploitation. It’s a challenge to marketers to rise to a higher standard.",0,FALSE
"The combination of AI and storytelling is powerful. But like he said, the story should inspire, not manipulate.",0,FALSE
"His focus on social proof made me think of how easily AI could fake it. Transparency really is the only safeguard.",0,FALSE
"It’s refreshing to hear someone with experience in marketing talk about values, not just data. That’s what gives this talk weight.",0,FALSE
"He reminded me that technology is neutral—it’s our intent that decides if it helps or harms. That’s especially true with AI marketing.",0,FALSE
"His experience across CRM and digital tools makes the warnings real. He’s not anti-tech, he’s pro-ethical tech.",0,FALSE
"The idea that AI can predict preferences is amazing, but it also raises the question: where’s the line between serving and controlling?",0,FALSE
"I liked how he linked psychology with AI. It shows that understanding people is still at the heart of marketing.",0,FALSE
"His point about loyalty being shaped by emotions was powerful. AI just scales those emotions—ethics ensures they’re genuine.",0,FALSE
"It’s easy to think of AI as cold, but he showed it can actually humanize marketing if used responsibly. That’s a hopeful perspective.",0,FALSE
"thank for 224 subscribe r",0,FALSE
"I love how he reminded us that scarcity tactics shouldn’t become predatory. AI can create fake urgency, and that’s where ethics must step in.",0,FALSE
"His talk made me question how many of my online “choices” are actually influenced by hidden nudges. That’s the scary power of AI in marketing.",0,FALSE
"I like that he didn’t frame AI as the villain. It’s the choices behind it that matter.",0,FALSE
"His mention of consistency resonated—trust is built slowly but can be destroyed instantly if AI crosses the line.",0,FALSE
"It’s inspiring to hear someone in marketing call for accountability. That’s leadership we need in this space.",0,FALSE
"Hi",0,FALSE
"Yes exactly",1,TRUE
"That was a truly informative speech; it made me realize how important it is to be more aware of our choices. Thanks Ram!",0,FALSE
