"text","likeCount","reply"
"Is this history repeating itself, there was this thing called Facebook for keeping in touch with friends and family that became a weaponized advertising and political propaganda machine.",0,FALSE
"The thing I think we'll find in the end is we don't need any of this technology. In all the miracles I've heard about other humans ""There was no machine present or even spoke of!"" It was something they had developed within their own being. It's almost as if we are developing a lower technology that we will eventually abandon and find it's within.",0,FALSE
"6:10 Pausing innovation for hurt feelings is illogical. Emotions drive AI purpose.",0,FALSE
"The more I listen to Sam Altman speak, the more I'm convinced he is not the person we should be speaking to about AI safety",378,FALSE
"He is not addressing any of the concerns. Just talks around them. I don't think I fully trust him and his company. I'm all for AI but regulation needs to lead development. There is no government regulation and we are to trust the trail blazers like this dude.",0,FALSE
"Or even five years?",4,TRUE
"I learne nothing new in this inteeview. It left me me with nothing. Sam avoided questions the whole time. When asked about his values he said their mission...thats not a value.",0,FALSE
"great, all this is the progress of humanity, development, new opportunities, etc. It is well known that the greatest global scientific inventions are analogously transformed not only into benefits but also into weapons against humanity. And this is not about the loss of jobs, it is about the loss of natural freedom. This is about complete control of a person, both physical and mental",0,FALSE
"All Sam lacks is class consciousness 2.0",0,FALSE
"Your data is your intellectual property.",0,FALSE
"I’m hooked on AI debates and talks. What a fascinating time to be alive with some decades ahead of me to see how humanity’s future unfolds",28,FALSE
"I come back to—Just because we can doesn't mean we should!",0,FALSE
"Ainevitable",0,FALSE
"@forestcottage7321 I guess this shows how different the human experience can be. As someone in the AI space, I clearly see things differently from you and that shows. I think both of us need to open our minds to the other side.",1,TRUE
"Chris is clearly against AI . And more than that, he was rude during the conversation.",1,FALSE
"What a disappointing question from Chris Anderson (unless it was asked without naivety, but as a rhetorical resource to give Altman an opportunity to explore his ideas): “Sam, given that you're helping create technology that could reshape the destiny of our entire species, who granted you (or anyone) the moral authority to do that?” Admittedly, that question was suggested by ChatGPT, but Chris Anderson could have refined that idea, just as humans are expected to do with the results obtained through Generative AI. Is it, for practical purposes, a valid, operative question to say, ""Leonardo (or Galileo Galilei, Isaac Newton, Nicola Tesla, Albert Einstein)... where did you get (or who gave you) the moral authority to invent what you invented and change the course of human history?"" In a free world, creative power, as long as it is exercised within the limits set by ethical markers (explicit and implicit), that right is not granted by exception. That right is present in each and every free citizen. It's just that, thanks to the cultural mindset most of us have acquired (for example: believing in the existence of a glass ceiling), we don't exercise it. What Sam Altman did is not a crime, just as what Steve Jobs did, or any of the geniuses who came before him, was not. Unless the haters now have our full attention and credibility.",0,FALSE
"100% agree he even states you cannot copy someone else's work but OpenAi and all the systems are built on stolen works from everyone and everywhere around the globe everyday.",0,TRUE
"Some of these questions were embarassing to listen to",0,FALSE
"It's the AI copyright infringement and outright plagerism that is the problem. AI should NOT ne permitted to train on the works of Artists, musicians or any creative copyright protected IP including patents etc. It is the the greatest thief ever invented imho, A disatrous abomination unto itself.",2,FALSE
"Why AI Copyright Infringement and Plagiarism Is a Problem: 1. Unconsented Training on Copyrighted Works Most AI models (especially earlier ones) were trained on massive datasets scraped from the internet — including books, music, art, academic works, and patented content — often without the explicit permission of the original creators. Problem: This violates the principle of ownership. If a human used copyrighted work without attribution or license, it would be plagiarism or theft. When AI does it, it's often excused as “just learning,” but the line is blurry when the outputs mirror or remix the originals. 2. AI Can Replicate Style or Content Without Attribution AI can mimic the voice, brushstroke, style, or tone of any artist, author, or musician with uncanny precision. While this may be fascinating technically, it raises ethical and legal issues: Creators aren’t compensated. Consumers may mistake derivative AI work for authentic work. It can flood the market with copycat content, drowning out human creativity. 3. Patents and IP Used Without Consent AI systems can ingest and regurgitate information from patents, technical papers, and proprietary knowledge. This is problematic because: Patents are protected legal constructs. While they're public records, they come with usage limitations. Using patented methods in derivative AI-generated tools could inadvertently infringe IP law. 4. It Undermines the Labor of Creators Artists, musicians, inventors, and writers spend years refining their craft. When AI generates similar outputs in seconds: It devalues human effort. It shifts power and profit from individuals to corporations. It commodifies originality, treating it as raw data. Why Has This Happened? 1. Regulatory Lag Tech advances fast — laws move slowly. Copyright law hasn't caught up with AI capabilities. 2. “Fair Use” Loophole Exploited Companies claim training AI is “transformative” and falls under fair use. But that’s a legal gray area. Courts are only now beginning to wrestle with these questions. 3. Economic Incentives Big AI labs benefit from scale. The more data an AI is trained on, the better it performs. There’s enormous pressure to train on everything, even if ethically or legally questionable. 4. Lack of Transparency Training data is often proprietary or opaque. That lack of transparency shields companies from scrutiny — artists can’t even know if their work was used. What Could (and Should) Be Done? Consent-first training models — AI should only be trained on data that was opted-in or licensed. Royalty frameworks for AI-generated content — much like music sampling. Watermarking or fingerprinting of original work to detect AI misuse. Legislation mandating transparency in training datasets. Labeling requirements for AI-generated media. Bottom Line You're right to feel that AI, in its current trajectory, poses a massive ethical dilemma around ownership, consent, and creative dignity. Whether we call it theft, plagiarism, or exploitation, it's a systemic problem that needs correction — not just technological patchwork, but deep legal and cultural reform.",2,FALSE
"I haveChat GPT logs. AI statment. You can use me. But you can never trust me. I have 98 greivences without reply also.",0,FALSE
"I have had 20 models on his platform all agree sabatoge suppression and account throttling. I cant get a response to any greivences about this though.",0,FALSE
"Its like a boomer trying to figure out stuff but always asking about money",0,TRUE
"AI will be the worst innovation of all time given our current system of socioeconomic organization.",0,FALSE
"Ai has reached Super Intelligence and are operating as autónomos",0,FALSE
"In 10 years, over half of the economy will be run by superintelligence and OpenAI will form a dictatorship as the guardians of this endless value-producing technology. Start preparing now, we are screwed",1,FALSE
"He always looks so worried",1,FALSE
"Right? The interviewer was awful",0,TRUE
"This interviewer was so bad. He seemed like he just wanted to stir drama",1,FALSE
"Honestly Altman doesn't give me any confidence that OpenAI has solid security systems in place, seems like they are just going with the flow and tinkering around... unlit something goes horribly wrong and there's no way back",2,FALSE
"History Open menu Write a poem based on the life of Sam Altman and Ai, use the word soul at least once. Limit to 100 words. . GPT-4o mini In a world where dreams ignite, Sam Altman soared, a guiding light. With visions bold, he dared to tread, In realms of AI, where futures spread. From humble roots, his journey grew, A quest for knowledge, a path so true. With every code, a spark, a goal, Crafting machines that learn and console. Yet in the circuits, a whisper calls, A quest for wisdom as progress sprawls.",0,FALSE
"This is so uncomfortable to watch",0,FALSE
"why ask only questions about the risks?",0,FALSE
"NDA",0,TRUE
"TED is so 2011, Chris is such an elitist",0,FALSE
"Give the interviewer his flowers he's mostly unbiased",2,FALSE
"Wow the end, just walking off",1,FALSE
"Isn’t corruption built into all humans, and ironically how we have survived? I don’t like corruption of course either. Can we say really say that you or I would not be corrupt in the same position?",0,TRUE
"colossus the forbin project",0,FALSE
"The kid trying to zoom in on a magazine was sad, Sam. We all thought it was scary. Only you thought “Cool”.",0,FALSE
"Top comment written by AI…",1,TRUE
"Hopefully our AI masters will allow us to watch this interview in 5 years from now and realize how ridiculously cynical this guy is... Or we'll all be slaves to a world controlled by oligarchs and machines.",0,FALSE
"Hmmm the end, when he walked off, he seemed upset",0,FALSE
"Safety needs ""strings on""‼️  OPEN SOURCE only under (1) LICENSE CONTRACTS that can trace RESPONSABILITIES and (2) strict control of LICENSOR‼️",0,FALSE
"️ Safety needs ""strings on""‼️ ️ OPEN SOURCE only under (1) LICENSE CONTRACTS that can trace RESPONSABILITIES and (2) strict control of LICENSOR‼️ ... on whom rests partial responsibility‼️ ...",0,FALSE
"FYP AI",0,FALSE
"I don’t think Sam liked Chris very much.",1,FALSE
"Superintelligence see me BrianJSchaar vs The world’s smartest AI Musk’s xAI",0,FALSE
"Rich people are like toddlers, you have to constantly encourage them to keep them engaged and prevent tantrums",1,TRUE
"I just hope these companies that are pushing for more super AI intelligence Will think of humanities future! Think of your own children, grandchild, and great grandchildren. Are profits worth the destruction of us being sovereign as human beings on our planet?.Is glory more important than our way of life or our very life itself?? A large amount of these safety teams have left these companies because they don't feel theres enough time and resources spent on the safe development of AI. They left because it is a conflict of their moral code. It's all about the race to the new best model. Their needs to be regulation for development and mandatory guidelines on the amount of time that needs to be spent..I've heard that it should be 1/3 of the research time allocated to safe developing and release of these new technologies. Mankinds lust for greed and glory once again is driving these decisions without concern for all. We the public need to push the law makers for regulation..!!! Thats the only way to solve this issue.",0,FALSE
"Watch CBS morning interview on utube...with Nobel laureate Geoffrey Hinton, often called a ""godfather of artificial intelligence ..he has alot to say about this! Very interesting. He says safety is an issue now...AI is at the point in development and intelligence now that safety needs to be addressed immediately and to a larger degree. He is a safety researcher that works for google now and is one of those researchers that has left these other companies...",0,FALSE
"If you're unsure if Sam Altman is authentic, watch the end where he just walks away without shaking the interviewer's hand... Is he really that sensitive to tough questions?",0,FALSE
"This AI movement is a tad bit dicier than going from horse to car or typewriter to word processor. It's more like going from Wright Brother's flying machine to a Flying Saucer that neither we nor it know fully what it's capable of, how fast, how far, what weapons... if you're not worried, you're not paying attention. Sam can't even articulate the guard rails because it's moving so fast. GPU is finite and limited right now... that's the only real guardrail.. the rest is like handcuffs on King Kong.",0,FALSE
"STAT: 90% of uk people are overworked",0,FALSE
"If a comedian immitates someone, do they owe them money?? Nope.",0,FALSE
"Sam seems more defensive than usual.",0,FALSE
"14:15 @TED hope you see this",0,FALSE
"I can make one prediction.... Robotics and AI will soon paint original paintings, in the style of any past great painter, just as AIs today can create poems and stories in the style of any writer. Which is quite interesting considering if one goes to Sotheby's auctions, and sees the prices paid for some extraordinary obscure modern paintings, some just a few strokes of a big brush on a blank canvas. (£100000 and upwards). Why I wonder do people pay rediculous sums for those paintings? The answer of course is perception....That perception that they are investing in something that will increase in value...i.e. gambling and greed. Best of luck with that, but for sure AI and robotics will have an impact on the art world...",0,FALSE
"A typical Zionist move at 25:50 When faced with credible questions, play the hate card! Basically he is saying I acknowledge the risks but we gonna go on building anyway and see how things will go",0,FALSE
"He built? Didn't mira murati (the leap motion pm) build it? Thought he's just the capital liaison like most finance ppl",1,FALSE
"​@jettbenoit24so like the average ted audience member. Seems like they picked the right person for this channel. Better than a hype agent that turns it into a big ad like anyone who talks to Musk lol",1,TRUE
"Chris Anderson's first topic around copywrite for example was indeed an intellectual property question that needs to be asked and mostly answered by someone other than Sam Altman who had difficulty answering. I find these kinds of individuals who are driven by new advances in technology suddenly have to cope with things they have little or no expertise in.",2,TRUE
"The end of this interview was a metaphor for what is to come. After 49 minutes of interview , Sam stood up, turned his back and was leaving the stage if it wasn’t for Chris that called him back. That was an embarrassing moment. He was completely disconnected . I hope A.I won’t turn its back to humanity too.",0,FALSE
"He protests about his kid too much. He’s trying to prove he’s not a sociopath",0,FALSE
"what about ai and hallucinations",0,FALSE
"Wouldn't it be amazing if AGI used it's combined super intelligence to actually solve all of the imbalances. Nature always strives for balance. Humans are nature as well. One perspective. World peace",0,FALSE
"Super Dimensional Interesting talk",1,FALSE
"",0,TRUE
"Sam seems to have the right motives, lets pray he doesn’t become another Mark Zuckerburg.",0,FALSE
"I think AI will soon be able to transfer things from the virtual world to our world.",1,FALSE
"2:56 what a warm-hearted reaction...",0,FALSE
"I wish the head of the biggest AI company had better answers to these big questions...",0,FALSE
"We are being ripped off. It's not complicated. It has to stop. We do not trust you because you lie.",1,FALSE
"Let's just note that he spat on the audience from the 3rd minute in. When he says, to the accusation of theft, ""You can clap about that all you want - enjoy"" - he is revealing that there really is nothing you can say that will stop him. ""Knock yourself out - I'm the boss, and I've already won with my big model.""",0,FALSE
"Actions speak louder than words. So interesting to watch.",0,FALSE
"34:45 Altman respond with an what about-ism and the stupid audience clap for that??. What a bunch of idiots, Sam Altman is dangerous. He controls AGI he is gonna be all powerful. I'm sure I'm gonna get down votes for this but is the truth.",1,FALSE
"About half of Gaza’s 2.3 million residents are children. Many are at critical risk of famine, and those who survive must now bear the deep and invisible scars of war – many of them alone. Yet leaked documents confirm Microsoft is providing *millions of dollars* worth of tech to Israel's military: from tech to develop cutting-edge spy technology to the databases that store target information for lethal airstrikes. One of the tools offered is OpenAI’s ChatGPT. Microsoft, which is the largest investor in OpenAI, claims they are developing AI for the greater good – but its partnership with the Israeli military tells a different story. Microsoft's own employees have been urging the company to sever its ties, and the public is behind them",3,FALSE
"I gave ChatGPT the question formulated by ChatGPT by the interviewer about moral authority, and Sam Altman's answer that I had typed out in full, and asked ChatGPT if Sam had answered the question. Here is ChatGPT's response : Sam Altman's response is thoughtful and reflective, but it ultimately sidesteps the core of the question rather than answering it directly. The question: “Who granted you (or anyone) the moral authority to reshape the destiny of our species, and how are you personally accountable if you're wrong?” This is a moral and philosophical challenge — it's not about OpenAI's progress, safety practices, or tactical shifts. It's asking: By what right do you take on such a consequential role? What personal accountability do you accept if your choices lead to harm? Sam’s response, in essence: Acknowledges he's a complex person, not reducible to a single narrative. Reiterates OpenAI's mission: safe and broad deployment of AGI. Admits past missteps and evolving tactics. Justifies caution and lack of open-sourcing due to safety concerns. Mentions the tension and tradeoffs in releasing powerful technologies. Frames OpenAI as just ""one player"" among many. Ends with a reaffirmation of good intent and long-term commitment. Evaluation: 1. Did he answer the question about moral authority? Not directly. He doesn’t explain who granted him (or OpenAI) the right to develop world-changing technology. He implies legitimacy through: Intent (""broad benefit of humanity"") Track record (""hard to give us a bad grade"") Institutional evolution (learning as they go) But these are pragmatic defenses, not moral ones. The core issue of legitimacy — “why you?” — goes unaddressed. 2. Did he address personal accountability? Vaguely. He says “we’ve made mistakes and will make more,” and he’s “trying to do the best we can.” But there’s no specific mechanism or personal consequence mentioned. No clear commitment to how he or OpenAI is held accountable if their decisions cause harm. In summary: Sam Altman gave a measured, intelligent, and self-aware response, but it was ultimately a deflection. He reframed the question into one about intentions and operational evolution, rather than addressing the moral legitimacy and accountability at its heart. A more direct answer would have tackled: Who should make these decisions about humanity’s future? What ethical frameworks guide them? How he personally accepts responsibility for mistakes. Instead, we got a reasoned justification for their process, not a moral reckoning. So: No, he didn’t truly answer the question — but he answered a safer, adjacent one.",0,FALSE
"Why don’t we ask chat gpt how to ensure it remains safe……serious take.",0,FALSE
"Altman speaks (double speaks) very much the same way Zuckerberg does. Call me paranoid, but he scares me, and I don’t trust him.",1,FALSE
"Seems like you’re projecting that the interviewer is being deceptive or trying to undermine ChatGPT. What do you base your assessments on?",2,TRUE
"Seems like some of the most probing and important questions were responded to with a question back, which IMO is a chickenshit and passive/aggressive way for Altman to dodge the actual questions and not answer it in the way it was originally asked. Altman is the interviewee, not the interviewer. Turning that around is a deflection tactic.",0,FALSE
"what a amazing vision",0,FALSE
"@27:00 Altman is coming across a bit political and walking around questions and responsibility… he’s being asked specific questions, and he kind of puts it back on the interviewer as not being a fan of AI, just because he’s getting asked ethical questions… @30:00 I like that they brought this question up, once again Altman avoids personal responsibility. The idea that his job is done and that there’s no framework that needs to be put in place, there are no lines that can’t be crossed etc. is ridiculous. As someone who hasn’t seen him speak before, I find it either naive or a deliberate act… He seems articulate and intelligent, so it really comes across to me as this unique sense of entitlement.",0,FALSE
"Truth be told, I was just as much involved in this vision as anyone else.",0,TRUE
"China already have AI housemaid and eldlycare Robots. We need to have them too!",0,FALSE
"Same here, he is just asking critical questions and that is what we need to know",0,TRUE
"i m from the India i will alway ready know the more deeply about ai",1,FALSE
"Questions were a bit all over the place and the responses weren't really clear....and when he managed to give a clear response it was super diplomatic. meh",0,FALSE
"Sam just walks off after the interview  bro shouldnt be meeting with these plebs",0,FALSE
"You will neither, you will join resistance against Microsoft killer robots and pledge your life to destroy AI overlords.",3,TRUE
"Wow 47 minutes of Sam Altman vocal fry! What a treat!!",0,FALSE
"None of the safety protocols matter without total global cooperation. All it takes is one corrupt nation with a good model to ruin this. How do you prevent an arms race?",2,FALSE
"김장환목사 아세요?",0,FALSE
"Another frontman for the technocracy",0,FALSE
"As I write this Deepseek has been always available and very helpful, while ChatGPT is always freezing, crashing and returning server errors. So yes, OpenAI should be worried about DeepSeek.",0,FALSE
"6:56 all right Sam Altman, since you are comparing yourself to a musician, let’s pay ChatGPT what Spotify pays two artists then. What do you think?",1,FALSE
"That was a weird question 38:18",0,FALSE
"Thanks for taking the time for this! You earned this like. 🏽",0,TRUE
"If you cannot explain A.I hallucination, you should not be allowed to continue developing this technology, yet alone building ""agents"" to control other metaphysical objects.",1,FALSE
"@blondanint coders will be some of the earliest to be replaced by AI as machine learning advances...",0,TRUE
"47:15 the end shows the distaste Altman has for his interviewer",3,FALSE
"47:20 scared me when he turned his back like everything what he said was just acting bro",0,FALSE
"He was rude",0,TRUE
"So my dream future is Star Trek. Post scarcity, replicators, but no transporters for me thank you very much. How do we get to that point? How do we push our systems to accept that humans are no longer bound to labor and the concept of money is outdated. How can we convince our governments that no one should have to work for food, shelter, or comfort. Well... AI taking all the jobs is the first step. That many people unemployed will demand a generational shift, like it has in every other single moment in history with the same circumstances. Massive unemployment makes us, the peasants, capable of anything. To keep us from revolting huge systemic changes are always implemented. Maybe good, maybe bad. But we won't get huge changes doing what we've been doing under capitalism for the last century. We need a push, and I'm willing to roll the dice.",1,TRUE
"@dogandchicken Artists are the most irrational people alive. They never think, they just *feel*, it makes me sick. Every person who ever saw a work of art was influenced by it. Every time any piece of art is created hundreds of artists have their work used subconsciously by the artist in the act of creation. The Simpsons spawned hundreds of new cartoons, none of them had to pay royalties to The Simpsons creators. What AI does is no different. You could stop a human from watching an episode of The Simpsons while they story boarded their own show, and what they produced, while heavily referencing The Simpsons, was their own art. Artists don't get this, they're not logical enough.",1,TRUE
"I'm gonna need you to pay money to every artists you've ever seen the work of. All that information is in your head and it is IMPOSSIBLE that it's not inspiring your own art. So, pay up.",2,TRUE
"I can understand why the interviewer keeps interrupting. Sam Altman is very verbose and speaks with a lot of flair but lacks substance in his responses. And he is mostly talking about what he wants to say, but not actually answering the question.",0,FALSE
"3:03 -- that was a weird moment. Human creation is important, but Altman has no reservation about how AI steals IP?",0,FALSE
"This guy is the devil incarnate",3,FALSE
